No.     Time           Source                Destination           Protocol Length Info
      1 0.000000       host                  1.6.0                 USB      36     URB_CONTROL out

Frame 1: 36 bytes on wire (288 bits), 36 bytes captured (288 bits) on interface 0
USB URB
    [Source: host]
    [Destination: 1.6.0]
    USBPcap pseudoheader length: 28
    IRP ID: 0xffff80030c18daf0
    IRP USBD_STATUS: USBD_STATUS_SUCCESS (0x00000000)
    URB Function: URB_FUNCTION_CONTROL_TRANSFER (0x0008)
    IRP information: 0x00, Direction: FDO -> PDO
        0000 000. = Reserved: 0x00
        .... ...0 = Direction: FDO -> PDO (0x0)
    URB bus id: 1
    Device address: 6
    Endpoint: 0x00, Direction: OUT
        0... .... = Direction: OUT (0)
        .... 0000 = Endpoint number: 0
    URB transfer type: URB_CONTROL (0x02)
    Packet Data Length: 8
    [Response in: 2]
    Control transfer stage: Setup (0)
    [bInterfaceClass: Unknown (0xffff)]
URB setup
    bmRequestType: 0x41
    bRequest: 0
    wValue: 0xffff
    wIndex: 0 (0x0000)
    wLength: 0

No.     Time           Source                Destination           Protocol Length Info
      2 0.000107       1.6.0                 host                  USB      28     GET STATUS Status

Frame 2: 28 bytes on wire (224 bits), 28 bytes captured (224 bits) on interface 0
USB URB
    [Source: 1.6.0]
    [Destination: host]
    USBPcap pseudoheader length: 28
    IRP ID: 0xffff80030c18daf0
    IRP USBD_STATUS: USBD_STATUS_SUCCESS (0x00000000)
    URB Function: URB_FUNCTION_CONTROL_TRANSFER (0x0008)
    IRP information: 0x01, Direction: PDO -> FDO
        0000 000. = Reserved: 0x00
        .... ...1 = Direction: PDO -> FDO (0x1)
    URB bus id: 1
    Device address: 6
    Endpoint: 0x00, Direction: OUT
        0... .... = Direction: OUT (0)
        .... 0000 = Endpoint number: 0
    URB transfer type: URB_CONTROL (0x02)
    Packet Data Length: 0
    [Request in: 1]
    [Time from request: 0.000107000 seconds]
    Control transfer stage: Status (2)

No.     Time           Source                Destination           Protocol Length Info
      3 0.000114       host                  1.6.0                 USB      36     URB_CONTROL in

Frame 3: 36 bytes on wire (288 bits), 36 bytes captured (288 bits) on interface 0
USB URB
    [Source: host]
    [Destination: 1.6.0]
    USBPcap pseudoheader length: 28
    IRP ID: 0xffff800307b3f010
    IRP USBD_STATUS: USBD_STATUS_SUCCESS (0x00000000)
    URB Function: URB_FUNCTION_CONTROL_TRANSFER (0x0008)
    IRP information: 0x00, Direction: FDO -> PDO
        0000 000. = Reserved: 0x00
        .... ...0 = Direction: FDO -> PDO (0x0)
    URB bus id: 1
    Device address: 6
    Endpoint: 0x80, Direction: IN
        1... .... = Direction: IN (1)
        .... 0000 = Endpoint number: 0
    URB transfer type: URB_CONTROL (0x02)
    Packet Data Length: 8
    [Response in: 4]
    Control transfer stage: Setup (0)
    [bInterfaceClass: Unknown (0xffff)]
URB setup
    bmRequestType: 0xc1
    bRequest: 8
    wValue: 0x0000
    wIndex: 0 (0x0000)
    wLength: 1

No.     Time           Source                Destination           Protocol Length Info
      4 0.000236       1.6.0                 host                  USB      29     URB_CONTROL in

Frame 4: 29 bytes on wire (232 bits), 29 bytes captured (232 bits) on interface 0
USB URB
    [Source: 1.6.0]
    [Destination: host]
    USBPcap pseudoheader length: 28
    IRP ID: 0xffff800307b3f010
    IRP USBD_STATUS: USBD_STATUS_SUCCESS (0x00000000)
    URB Function: URB_FUNCTION_CONTROL_TRANSFER (0x0008)
    IRP information: 0x01, Direction: PDO -> FDO
        0000 000. = Reserved: 0x00
        .... ...1 = Direction: PDO -> FDO (0x1)
    URB bus id: 1
    Device address: 6
    Endpoint: 0x80, Direction: IN
        1... .... = Direction: IN (1)
        .... 0000 = Endpoint number: 0
    URB transfer type: URB_CONTROL (0x02)
    Packet Data Length: 1
    [Request in: 3]
    [Time from request: 0.000122000 seconds]
    Control transfer stage: Data (1)
    [bInterfaceClass: Unknown (0xffff)]
CONTROL response data: 00

No.     Time           Source                Destination           Protocol Length Info
      5 0.000236       1.6.0                 host                  USB      28     GET CONFIGURATION Status

Frame 5: 28 bytes on wire (224 bits), 28 bytes captured (224 bits) on interface 0
USB URB
    [Source: 1.6.0]
    [Destination: host]
    USBPcap pseudoheader length: 28
    IRP ID: 0xffff800307b3f010
    IRP USBD_STATUS: USBD_STATUS_SUCCESS (0x00000000)
    URB Function: URB_FUNCTION_CONTROL_TRANSFER (0x0008)
    IRP information: 0x01, Direction: PDO -> FDO
        0000 000. = Reserved: 0x00
        .... ...1 = Direction: PDO -> FDO (0x1)
    URB bus id: 1
    Device address: 6
    Endpoint: 0x80, Direction: IN
        1... .... = Direction: IN (1)
        .... 0000 = Endpoint number: 0
    URB transfer type: URB_CONTROL (0x02)
    Packet Data Length: 0
    [Request in: 3]
    [Time from request: 0.000122000 seconds]
    Control transfer stage: Status (2)

No.     Time           Source                Destination           Protocol Length Info
      6 0.000241       host                  1.6.0                 USB      36     URB_CONTROL in

Frame 6: 36 bytes on wire (288 bits), 36 bytes captured (288 bits) on interface 0
USB URB
    [Source: host]
    [Destination: 1.6.0]
    USBPcap pseudoheader length: 28
    IRP ID: 0xffff80030c18daf0
    IRP USBD_STATUS: USBD_STATUS_SUCCESS (0x00000000)
    URB Function: URB_FUNCTION_CONTROL_TRANSFER (0x0008)
    IRP information: 0x00, Direction: FDO -> PDO
        0000 000. = Reserved: 0x00
        .... ...0 = Direction: FDO -> PDO (0x0)
    URB bus id: 1
    Device address: 6
    Endpoint: 0x80, Direction: IN
        1... .... = Direction: IN (1)
        .... 0000 = Endpoint number: 0
    URB transfer type: URB_CONTROL (0x02)
    Packet Data Length: 8
    [Response in: 7]
    Control transfer stage: Setup (0)
URB setup
    bmRequestType: 0xc0
    bRequest: 16
    wValue: 0x0000
    wIndex: 0 (0x0000)
    wLength: 20

No.     Time           Source                Destination           Protocol Length Info
      7 0.000416       1.6.0                 host                  USB      47     URB_CONTROL in

Frame 7: 47 bytes on wire (376 bits), 47 bytes captured (376 bits) on interface 0
USB URB
    [Source: 1.6.0]
    [Destination: host]
    USBPcap pseudoheader length: 28
    IRP ID: 0xffff80030c18daf0
    IRP USBD_STATUS: USBD_STATUS_SUCCESS (0x00000000)
    URB Function: URB_FUNCTION_CONTROL_TRANSFER (0x0008)
    IRP information: 0x01, Direction: PDO -> FDO
        0000 000. = Reserved: 0x00
        .... ...1 = Direction: PDO -> FDO (0x1)
    URB bus id: 1
    Device address: 6
    Endpoint: 0x80, Direction: IN
        1... .... = Direction: IN (1)
        .... 0000 = Endpoint number: 0
    URB transfer type: URB_CONTROL (0x02)
    Packet Data Length: 19
    [Request in: 6]
    [Time from request: 0.000175000 seconds]
    Control transfer stage: Data (1)
CONTROL response data: 00000000000000000000000000000000000000

No.     Time           Source                Destination           Protocol Length Info
      8 0.000437       1.6.0                 host                  USB      28     Unknown type 10 Status

Frame 8: 28 bytes on wire (224 bits), 28 bytes captured (224 bits) on interface 0
USB URB
    [Source: 1.6.0]
    [Destination: host]
    USBPcap pseudoheader length: 28
    IRP ID: 0xffff80030c18daf0
    IRP USBD_STATUS: USBD_STATUS_SUCCESS (0x00000000)
    URB Function: URB_FUNCTION_CONTROL_TRANSFER (0x0008)
    IRP information: 0x01, Direction: PDO -> FDO
        0000 000. = Reserved: 0x00
        .... ...1 = Direction: PDO -> FDO (0x1)
    URB bus id: 1
    Device address: 6
    Endpoint: 0x80, Direction: IN
        1... .... = Direction: IN (1)
        .... 0000 = Endpoint number: 0
    URB transfer type: URB_CONTROL (0x02)
    Packet Data Length: 0
    [Request in: 6]
    [Time from request: 0.000196000 seconds]
    Control transfer stage: Status (2)

No.     Time           Source                Destination           Protocol Length Info
      9 0.000443       host                  1.6.0                 USB      36     URB_CONTROL out

Frame 9: 36 bytes on wire (288 bits), 36 bytes captured (288 bits) on interface 0
USB URB
    [Source: host]
    [Destination: 1.6.0]
    USBPcap pseudoheader length: 28
    IRP ID: 0xffff800307b3f010
    IRP USBD_STATUS: USBD_STATUS_SUCCESS (0x00000000)
    URB Function: URB_FUNCTION_CONTROL_TRANSFER (0x0008)
    IRP information: 0x00, Direction: FDO -> PDO
        0000 000. = Reserved: 0x00
        .... ...0 = Direction: FDO -> PDO (0x0)
    URB bus id: 1
    Device address: 6
    Endpoint: 0x00, Direction: OUT
        0... .... = Direction: OUT (0)
        .... 0000 = Endpoint number: 0
    URB transfer type: URB_CONTROL (0x02)
    Packet Data Length: 8
    [Response in: 10]
    Control transfer stage: Setup (0)
    [bInterfaceClass: Unknown (0xffff)]
URB setup
    bmRequestType: 0x41
    bRequest: 3
    wValue: 0x0700
    wIndex: 0 (0x0000)
    wLength: 0

No.     Time           Source                Destination           Protocol Length Info
     10 0.000544       1.6.0                 host                  USB      28     SET FEATURE Status

Frame 10: 28 bytes on wire (224 bits), 28 bytes captured (224 bits) on interface 0
USB URB
    [Source: 1.6.0]
    [Destination: host]
    USBPcap pseudoheader length: 28
    IRP ID: 0xffff800307b3f010
    IRP USBD_STATUS: USBD_STATUS_SUCCESS (0x00000000)
    URB Function: URB_FUNCTION_CONTROL_TRANSFER (0x0008)
    IRP information: 0x01, Direction: PDO -> FDO
        0000 000. = Reserved: 0x00
        .... ...1 = Direction: PDO -> FDO (0x1)
    URB bus id: 1
    Device address: 6
    Endpoint: 0x00, Direction: OUT
        0... .... = Direction: OUT (0)
        .... 0000 = Endpoint number: 0
    URB transfer type: URB_CONTROL (0x02)
    Packet Data Length: 0
    [Request in: 9]
    [Time from request: 0.000101000 seconds]
    Control transfer stage: Status (2)

No.     Time           Source                Destination           Protocol Length Info
     11 0.000549       host                  1.6.0                 USB      36     URB_CONTROL out

Frame 11: 36 bytes on wire (288 bits), 36 bytes captured (288 bits) on interface 0
USB URB
    [Source: host]
    [Destination: 1.6.0]
    USBPcap pseudoheader length: 28
    IRP ID: 0xffff800307b3f010
    IRP USBD_STATUS: USBD_STATUS_SUCCESS (0x00000000)
    URB Function: URB_FUNCTION_CONTROL_TRANSFER (0x0008)
    IRP information: 0x00, Direction: FDO -> PDO
        0000 000. = Reserved: 0x00
        .... ...0 = Direction: FDO -> PDO (0x0)
    URB bus id: 1
    Device address: 6
    Endpoint: 0x00, Direction: OUT
        0... .... = Direction: OUT (0)
        .... 0000 = Endpoint number: 0
    URB transfer type: URB_CONTROL (0x02)
    Packet Data Length: 8
    [Response in: 12]
    Control transfer stage: Setup (0)
    [bInterfaceClass: Unknown (0xffff)]
URB setup
    bmRequestType: 0x41
    bRequest: 19
    wValue: 0x0000
    wIndex: 0 (0x0000)
    wLength: 16

No.     Time           Source                Destination           Protocol Length Info
     12 0.000654       1.6.0                 host                  USB      44     URB_CONTROL out

Frame 12: 44 bytes on wire (352 bits), 44 bytes captured (352 bits) on interface 0
USB URB
    [Source: 1.6.0]
    [Destination: host]
    USBPcap pseudoheader length: 28
    IRP ID: 0xffff800307b3f010
    IRP USBD_STATUS: USBD_STATUS_SUCCESS (0x00000000)
    URB Function: URB_FUNCTION_CONTROL_TRANSFER (0x0008)
    IRP information: 0x01, Direction: PDO -> FDO
        0000 000. = Reserved: 0x00
        .... ...1 = Direction: PDO -> FDO (0x1)
    URB bus id: 1
    Device address: 6
    Endpoint: 0x00, Direction: OUT
        0... .... = Direction: OUT (0)
        .... 0000 = Endpoint number: 0
    URB transfer type: URB_CONTROL (0x02)
    Packet Data Length: 16
    [Request in: 11]
    [Time from request: 0.000105000 seconds]
    Control transfer stage: Data (1)
    [bInterfaceClass: Unknown (0xffff)]
CONTROL response data: 00000000000000000080000000200000

No.     Time           Source                Destination           Protocol Length Info
     13 0.000655       1.6.0                 host                  USB      28     Unknown type 13 Status

Frame 13: 28 bytes on wire (224 bits), 28 bytes captured (224 bits) on interface 0
USB URB
    [Source: 1.6.0]
    [Destination: host]
    USBPcap pseudoheader length: 28
    IRP ID: 0xffff800307b3f010
    IRP USBD_STATUS: USBD_STATUS_SUCCESS (0x00000000)
    URB Function: URB_FUNCTION_CONTROL_TRANSFER (0x0008)
    IRP information: 0x01, Direction: PDO -> FDO
        0000 000. = Reserved: 0x00
        .... ...1 = Direction: PDO -> FDO (0x1)
    URB bus id: 1
    Device address: 6
    Endpoint: 0x00, Direction: OUT
        0... .... = Direction: OUT (0)
        .... 0000 = Endpoint number: 0
    URB transfer type: URB_CONTROL (0x02)
    Packet Data Length: 0
    [Request in: 11]
    [Time from request: 0.000106000 seconds]
    Control transfer stage: Status (2)

No.     Time           Source                Destination           Protocol Length Info
     14 0.000659       host                  1.6.0                 USB      36     URB_CONTROL out

Frame 14: 36 bytes on wire (288 bits), 36 bytes captured (288 bits) on interface 0
USB URB
    [Source: host]
    [Destination: 1.6.0]
    USBPcap pseudoheader length: 28
    IRP ID: 0xffff800307b3f010
    IRP USBD_STATUS: USBD_STATUS_SUCCESS (0x00000000)
    URB Function: URB_FUNCTION_CONTROL_TRANSFER (0x0008)
    IRP information: 0x00, Direction: FDO -> PDO
        0000 000. = Reserved: 0x00
        .... ...0 = Direction: FDO -> PDO (0x0)
    URB bus id: 1
    Device address: 6
    Endpoint: 0x00, Direction: OUT
        0... .... = Direction: OUT (0)
        .... 0000 = Endpoint number: 0
    URB transfer type: URB_CONTROL (0x02)
    Packet Data Length: 8
    [Response in: 15]
    Control transfer stage: Setup (0)
    [bInterfaceClass: Unknown (0xffff)]
URB setup
    bmRequestType: 0x41
    bRequest: 25
    wValue: 0x0000
    wIndex: 0 (0x0000)
    wLength: 6

No.     Time           Source                Destination           Protocol Length Info
     15 0.000789       1.6.0                 host                  USB      34     URB_CONTROL out

Frame 15: 34 bytes on wire (272 bits), 34 bytes captured (272 bits) on interface 0
USB URB
    [Source: 1.6.0]
    [Destination: host]
    USBPcap pseudoheader length: 28
    IRP ID: 0xffff800307b3f010
    IRP USBD_STATUS: USBD_STATUS_SUCCESS (0x00000000)
    URB Function: URB_FUNCTION_CONTROL_TRANSFER (0x0008)
    IRP information: 0x01, Direction: PDO -> FDO
        0000 000. = Reserved: 0x00
        .... ...1 = Direction: PDO -> FDO (0x1)
    URB bus id: 1
    Device address: 6
    Endpoint: 0x00, Direction: OUT
        0... .... = Direction: OUT (0)
        .... 0000 = Endpoint number: 0
    URB transfer type: URB_CONTROL (0x02)
    Packet Data Length: 6
    [Request in: 14]
    [Time from request: 0.000130000 seconds]
    Control transfer stage: Data (1)
    [bInterfaceClass: Unknown (0xffff)]
CONTROL response data: 000000001113

No.     Time           Source                Destination           Protocol Length Info
     16 0.000789       1.6.0                 host                  USB      28     Unknown type 19 Status

Frame 16: 28 bytes on wire (224 bits), 28 bytes captured (224 bits) on interface 0
USB URB
    [Source: 1.6.0]
    [Destination: host]
    USBPcap pseudoheader length: 28
    IRP ID: 0xffff800307b3f010
    IRP USBD_STATUS: USBD_STATUS_SUCCESS (0x00000000)
    URB Function: URB_FUNCTION_CONTROL_TRANSFER (0x0008)
    IRP information: 0x01, Direction: PDO -> FDO
        0000 000. = Reserved: 0x00
        .... ...1 = Direction: PDO -> FDO (0x1)
    URB bus id: 1
    Device address: 6
    Endpoint: 0x00, Direction: OUT
        0... .... = Direction: OUT (0)
        .... 0000 = Endpoint number: 0
    URB transfer type: URB_CONTROL (0x02)
    Packet Data Length: 0
    [Request in: 14]
    [Time from request: 0.000130000 seconds]
    Control transfer stage: Status (2)

No.     Time           Source                Destination           Protocol Length Info
     17 0.000797       host                  1.6.0                 USB      36     URB_CONTROL out

Frame 17: 36 bytes on wire (288 bits), 36 bytes captured (288 bits) on interface 0
USB URB
    [Source: host]
    [Destination: 1.6.0]
    USBPcap pseudoheader length: 28
    IRP ID: 0xffff800309e1e770
    IRP USBD_STATUS: USBD_STATUS_SUCCESS (0x00000000)
    URB Function: URB_FUNCTION_CONTROL_TRANSFER (0x0008)
    IRP information: 0x00, Direction: FDO -> PDO
        0000 000. = Reserved: 0x00
        .... ...0 = Direction: FDO -> PDO (0x0)
    URB bus id: 1
    Device address: 6
    Endpoint: 0x00, Direction: OUT
        0... .... = Direction: OUT (0)
        .... 0000 = Endpoint number: 0
    URB transfer type: URB_CONTROL (0x02)
    Packet Data Length: 8
    [Response in: 18]
    Control transfer stage: Setup (0)
    [bInterfaceClass: Unknown (0xffff)]
URB setup
    bmRequestType: 0x41
    bRequest: 30
    wValue: 0x0000
    wIndex: 0 (0x0000)
    wLength: 4

No.     Time           Source                Destination           Protocol Length Info
     18 0.000920       1.6.0                 host                  USB      32     URB_CONTROL out

Frame 18: 32 bytes on wire (256 bits), 32 bytes captured (256 bits) on interface 0
USB URB
    [Source: 1.6.0]
    [Destination: host]
    USBPcap pseudoheader length: 28
    IRP ID: 0xffff800309e1e770
    IRP USBD_STATUS: USBD_STATUS_SUCCESS (0x00000000)
    URB Function: URB_FUNCTION_CONTROL_TRANSFER (0x0008)
    IRP information: 0x01, Direction: PDO -> FDO
        0000 000. = Reserved: 0x00
        .... ...1 = Direction: PDO -> FDO (0x1)
    URB bus id: 1
    Device address: 6
    Endpoint: 0x00, Direction: OUT
        0... .... = Direction: OUT (0)
        .... 0000 = Endpoint number: 0
    URB transfer type: URB_CONTROL (0x02)
    Packet Data Length: 4
    [Request in: 17]
    [Time from request: 0.000123000 seconds]
    Control transfer stage: Data (1)
    [bInterfaceClass: Unknown (0xffff)]
CONTROL response data: b0040000

No.     Time           Source                Destination           Protocol Length Info
     19 0.000921       1.6.0                 host                  USB      28     Unknown type 1e Status

Frame 19: 28 bytes on wire (224 bits), 28 bytes captured (224 bits) on interface 0
USB URB
    [Source: 1.6.0]
    [Destination: host]
    USBPcap pseudoheader length: 28
    IRP ID: 0xffff800309e1e770
    IRP USBD_STATUS: USBD_STATUS_SUCCESS (0x00000000)
    URB Function: URB_FUNCTION_CONTROL_TRANSFER (0x0008)
    IRP information: 0x01, Direction: PDO -> FDO
        0000 000. = Reserved: 0x00
        .... ...1 = Direction: PDO -> FDO (0x1)
    URB bus id: 1
    Device address: 6
    Endpoint: 0x00, Direction: OUT
        0... .... = Direction: OUT (0)
        .... 0000 = Endpoint number: 0
    URB transfer type: URB_CONTROL (0x02)
    Packet Data Length: 0
    [Request in: 17]
    [Time from request: 0.000124000 seconds]
    Control transfer stage: Status (2)

No.     Time           Source                Destination           Protocol Length Info
     20 0.001238       host                  1.6.0                 USB      36     URB_CONTROL out

Frame 20: 36 bytes on wire (288 bits), 36 bytes captured (288 bits) on interface 0
USB URB
    [Source: host]
    [Destination: 1.6.0]
    USBPcap pseudoheader length: 28
    IRP ID: 0xffff80030c18daf0
    IRP USBD_STATUS: USBD_STATUS_SUCCESS (0x00000000)
    URB Function: URB_FUNCTION_CONTROL_TRANSFER (0x0008)
    IRP information: 0x00, Direction: FDO -> PDO
        0000 000. = Reserved: 0x00
        .... ...0 = Direction: FDO -> PDO (0x0)
    URB bus id: 1
    Device address: 6
    Endpoint: 0x00, Direction: OUT
        0... .... = Direction: OUT (0)
        .... 0000 = Endpoint number: 0
    URB transfer type: URB_CONTROL (0x02)
    Packet Data Length: 8
    [Response in: 21]
    Control transfer stage: Setup (0)
    [bInterfaceClass: Unknown (0xffff)]
URB setup
    bmRequestType: 0x41
    bRequest: 30
    wValue: 0x0000
    wIndex: 0 (0x0000)
    wLength: 4

No.     Time           Source                Destination           Protocol Length Info
     21 0.001507       1.6.0                 host                  USB      32     URB_CONTROL out

Frame 21: 32 bytes on wire (256 bits), 32 bytes captured (256 bits) on interface 0
USB URB
    [Source: 1.6.0]
    [Destination: host]
    USBPcap pseudoheader length: 28
    IRP ID: 0xffff80030c18daf0
    IRP USBD_STATUS: USBD_STATUS_SUCCESS (0x00000000)
    URB Function: URB_FUNCTION_CONTROL_TRANSFER (0x0008)
    IRP information: 0x01, Direction: PDO -> FDO
        0000 000. = Reserved: 0x00
        .... ...1 = Direction: PDO -> FDO (0x1)
    URB bus id: 1
    Device address: 6
    Endpoint: 0x00, Direction: OUT
        0... .... = Direction: OUT (0)
        .... 0000 = Endpoint number: 0
    URB transfer type: URB_CONTROL (0x02)
    Packet Data Length: 4
    [Request in: 20]
    [Time from request: 0.000269000 seconds]
    Control transfer stage: Data (1)
    [bInterfaceClass: Unknown (0xffff)]
CONTROL response data: 00e10000

No.     Time           Source                Destination           Protocol Length Info
     22 0.001525       1.6.0                 host                  USB      28     Unknown type 1e Status

Frame 22: 28 bytes on wire (224 bits), 28 bytes captured (224 bits) on interface 0
USB URB
    [Source: 1.6.0]
    [Destination: host]
    USBPcap pseudoheader length: 28
    IRP ID: 0xffff80030c18daf0
    IRP USBD_STATUS: USBD_STATUS_SUCCESS (0x00000000)
    URB Function: URB_FUNCTION_CONTROL_TRANSFER (0x0008)
    IRP information: 0x01, Direction: PDO -> FDO
        0000 000. = Reserved: 0x00
        .... ...1 = Direction: PDO -> FDO (0x1)
    URB bus id: 1
    Device address: 6
    Endpoint: 0x00, Direction: OUT
        0... .... = Direction: OUT (0)
        .... 0000 = Endpoint number: 0
    URB transfer type: URB_CONTROL (0x02)
    Packet Data Length: 0
    [Request in: 20]
    [Time from request: 0.000287000 seconds]
    Control transfer stage: Status (2)

No.     Time           Source                Destination           Protocol Length Info
     23 0.001543       host                  1.6.0                 USB      36     URB_CONTROL out

Frame 23: 36 bytes on wire (288 bits), 36 bytes captured (288 bits) on interface 0
USB URB
    [Source: host]
    [Destination: 1.6.0]
    USBPcap pseudoheader length: 28
    IRP ID: 0xffff80030c18daf0
    IRP USBD_STATUS: USBD_STATUS_SUCCESS (0x00000000)
    URB Function: URB_FUNCTION_CONTROL_TRANSFER (0x0008)
    IRP information: 0x00, Direction: FDO -> PDO
        0000 000. = Reserved: 0x00
        .... ...0 = Direction: FDO -> PDO (0x0)
    URB bus id: 1
    Device address: 6
    Endpoint: 0x00, Direction: OUT
        0... .... = Direction: OUT (0)
        .... 0000 = Endpoint number: 0
    URB transfer type: URB_CONTROL (0x02)
    Packet Data Length: 8
    [Response in: 24]
    Control transfer stage: Setup (0)
    [bInterfaceClass: Unknown (0xffff)]
URB setup
    bmRequestType: 0x41
    bRequest: 7
    wValue: 0x0200
    wIndex: 0 (0x0000)
    wLength: 0

No.     Time           Source                Destination           Protocol Length Info
     24 0.001612       1.6.0                 host                  USB      28     SET DESCRIPTOR Status

Frame 24: 28 bytes on wire (224 bits), 28 bytes captured (224 bits) on interface 0
USB URB
    [Source: 1.6.0]
    [Destination: host]
    USBPcap pseudoheader length: 28
    IRP ID: 0xffff80030c18daf0
    IRP USBD_STATUS: USBD_STATUS_SUCCESS (0x00000000)
    URB Function: URB_FUNCTION_CONTROL_TRANSFER (0x0008)
    IRP information: 0x01, Direction: PDO -> FDO
        0000 000. = Reserved: 0x00
        .... ...1 = Direction: PDO -> FDO (0x1)
    URB bus id: 1
    Device address: 6
    Endpoint: 0x00, Direction: OUT
        0... .... = Direction: OUT (0)
        .... 0000 = Endpoint number: 0
    URB transfer type: URB_CONTROL (0x02)
    Packet Data Length: 0
    [Request in: 23]
    [Time from request: 0.000069000 seconds]
    Control transfer stage: Status (2)

No.     Time           Source                Destination           Protocol Length Info
     25 0.001625       host                  1.6.0                 USB      36     URB_CONTROL in

Frame 25: 36 bytes on wire (288 bits), 36 bytes captured (288 bits) on interface 0
USB URB
    [Source: host]
    [Destination: 1.6.0]
    USBPcap pseudoheader length: 28
    IRP ID: 0xffff80030c18daf0
    IRP USBD_STATUS: USBD_STATUS_SUCCESS (0x00000000)
    URB Function: URB_FUNCTION_CONTROL_TRANSFER (0x0008)
    IRP information: 0x00, Direction: FDO -> PDO
        0000 000. = Reserved: 0x00
        .... ...0 = Direction: FDO -> PDO (0x0)
    URB bus id: 1
    Device address: 6
    Endpoint: 0x80, Direction: IN
        1... .... = Direction: IN (1)
        .... 0000 = Endpoint number: 0
    URB transfer type: URB_CONTROL (0x02)
    Packet Data Length: 8
    [Response in: 27]
    Control transfer stage: Setup (0)
    [bInterfaceClass: Unknown (0xffff)]
URB setup
    bmRequestType: 0xc1
    bRequest: 8
    wValue: 0x0000
    wIndex: 0 (0x0000)
    wLength: 4

No.     Time           Source                Destination           Protocol Length Info
     26 0.001633       host                  1.6.0                 USB      36     URB_CONTROL out

Frame 26: 36 bytes on wire (288 bits), 36 bytes captured (288 bits) on interface 0
USB URB
    [Source: host]
    [Destination: 1.6.0]
    USBPcap pseudoheader length: 28
    IRP ID: 0xffff800307b3f010
    IRP USBD_STATUS: USBD_STATUS_SUCCESS (0x00000000)
    URB Function: URB_FUNCTION_CONTROL_TRANSFER (0x0008)
    IRP information: 0x00, Direction: FDO -> PDO
        0000 000. = Reserved: 0x00
        .... ...0 = Direction: FDO -> PDO (0x0)
    URB bus id: 1
    Device address: 6
    Endpoint: 0x00, Direction: OUT
        0... .... = Direction: OUT (0)
        .... 0000 = Endpoint number: 0
    URB transfer type: URB_CONTROL (0x02)
    Packet Data Length: 8
    [Response in: 29]
    Control transfer stage: Setup (0)
    [bInterfaceClass: Unknown (0xffff)]
URB setup
    bmRequestType: 0x41
    bRequest: 7
    wValue: 0x0100
    wIndex: 0 (0x0000)
    wLength: 0

No.     Time           Source                Destination           Protocol Length Info
     27 0.001742       1.6.0                 host                  USB      29     URB_CONTROL in

Frame 27: 29 bytes on wire (232 bits), 29 bytes captured (232 bits) on interface 0
USB URB
    [Source: 1.6.0]
    [Destination: host]
    USBPcap pseudoheader length: 28
    IRP ID: 0xffff80030c18daf0
    IRP USBD_STATUS: USBD_STATUS_SUCCESS (0x00000000)
    URB Function: URB_FUNCTION_CONTROL_TRANSFER (0x0008)
    IRP information: 0x01, Direction: PDO -> FDO
        0000 000. = Reserved: 0x00
        .... ...1 = Direction: PDO -> FDO (0x1)
    URB bus id: 1
    Device address: 6
    Endpoint: 0x80, Direction: IN
        1... .... = Direction: IN (1)
        .... 0000 = Endpoint number: 0
    URB transfer type: URB_CONTROL (0x02)
    Packet Data Length: 1
    [Request in: 25]
    [Time from request: 0.000117000 seconds]
    Control transfer stage: Data (1)
    [bInterfaceClass: Unknown (0xffff)]
CONTROL response data: 00

No.     Time           Source                Destination           Protocol Length Info
     28 0.001743       1.6.0                 host                  USB      28     GET CONFIGURATION Status

Frame 28: 28 bytes on wire (224 bits), 28 bytes captured (224 bits) on interface 0
USB URB
    [Source: 1.6.0]
    [Destination: host]
    USBPcap pseudoheader length: 28
    IRP ID: 0xffff80030c18daf0
    IRP USBD_STATUS: USBD_STATUS_SUCCESS (0x00000000)
    URB Function: URB_FUNCTION_CONTROL_TRANSFER (0x0008)
    IRP information: 0x01, Direction: PDO -> FDO
        0000 000. = Reserved: 0x00
        .... ...1 = Direction: PDO -> FDO (0x1)
    URB bus id: 1
    Device address: 6
    Endpoint: 0x80, Direction: IN
        1... .... = Direction: IN (1)
        .... 0000 = Endpoint number: 0
    URB transfer type: URB_CONTROL (0x02)
    Packet Data Length: 0
    [Request in: 25]
    [Time from request: 0.000118000 seconds]
    Control transfer stage: Status (2)

No.     Time           Source                Destination           Protocol Length Info
     29 0.001792       1.6.0                 host                  USB      28     SET DESCRIPTOR Status

Frame 29: 28 bytes on wire (224 bits), 28 bytes captured (224 bits) on interface 0
USB URB
    [Source: 1.6.0]
    [Destination: host]
    USBPcap pseudoheader length: 28
    IRP ID: 0xffff800307b3f010
    IRP USBD_STATUS: USBD_STATUS_SUCCESS (0x00000000)
    URB Function: URB_FUNCTION_CONTROL_TRANSFER (0x0008)
    IRP information: 0x01, Direction: PDO -> FDO
        0000 000. = Reserved: 0x00
        .... ...1 = Direction: PDO -> FDO (0x1)
    URB bus id: 1
    Device address: 6
    Endpoint: 0x00, Direction: OUT
        0... .... = Direction: OUT (0)
        .... 0000 = Endpoint number: 0
    URB transfer type: URB_CONTROL (0x02)
    Packet Data Length: 0
    [Request in: 26]
    [Time from request: 0.000159000 seconds]
    Control transfer stage: Status (2)

No.     Time           Source                Destination           Protocol Length Info
     30 0.001800       host                  1.6.0                 USB      36     URB_CONTROL in

Frame 30: 36 bytes on wire (288 bits), 36 bytes captured (288 bits) on interface 0
USB URB
    [Source: host]
    [Destination: 1.6.0]
    USBPcap pseudoheader length: 28
    IRP ID: 0xffff80030c18daf0
    IRP USBD_STATUS: USBD_STATUS_SUCCESS (0x00000000)
    URB Function: URB_FUNCTION_CONTROL_TRANSFER (0x0008)
    IRP information: 0x00, Direction: FDO -> PDO
        0000 000. = Reserved: 0x00
        .... ...0 = Direction: FDO -> PDO (0x0)
    URB bus id: 1
    Device address: 6
    Endpoint: 0x80, Direction: IN
        1... .... = Direction: IN (1)
        .... 0000 = Endpoint number: 0
    URB transfer type: URB_CONTROL (0x02)
    Packet Data Length: 8
    [Response in: 32]
    Control transfer stage: Setup (0)
    [bInterfaceClass: Unknown (0xffff)]
URB setup
    bmRequestType: 0xc1
    bRequest: 8
    wValue: 0x0000
    wIndex: 0 (0x0000)
    wLength: 4

No.     Time           Source                Destination           Protocol Length Info
     31 0.001814       host                  1.6.0                 USB      36     URB_CONTROL out

Frame 31: 36 bytes on wire (288 bits), 36 bytes captured (288 bits) on interface 0
USB URB
    [Source: host]
    [Destination: 1.6.0]
    USBPcap pseudoheader length: 28
    IRP ID: 0xffff800307a97690
    IRP USBD_STATUS: USBD_STATUS_SUCCESS (0x00000000)
    URB Function: URB_FUNCTION_CONTROL_TRANSFER (0x0008)
    IRP information: 0x00, Direction: FDO -> PDO
        0000 000. = Reserved: 0x00
        .... ...0 = Direction: FDO -> PDO (0x0)
    URB bus id: 1
    Device address: 6
    Endpoint: 0x00, Direction: OUT
        0... .... = Direction: OUT (0)
        .... 0000 = Endpoint number: 0
    URB transfer type: URB_CONTROL (0x02)
    Packet Data Length: 8
    [Response in: 34]
    Control transfer stage: Setup (0)
    [bInterfaceClass: Unknown (0xffff)]
URB setup
    bmRequestType: 0x41
    bRequest: 3
    wValue: 0x0800
    wIndex: 0 (0x0000)
    wLength: 0

No.     Time           Source                Destination           Protocol Length Info
     32 0.001919       1.6.0                 host                  USB      29     URB_CONTROL in

Frame 32: 29 bytes on wire (232 bits), 29 bytes captured (232 bits) on interface 0
USB URB
    [Source: 1.6.0]
    [Destination: host]
    USBPcap pseudoheader length: 28
    IRP ID: 0xffff80030c18daf0
    IRP USBD_STATUS: USBD_STATUS_SUCCESS (0x00000000)
    URB Function: URB_FUNCTION_CONTROL_TRANSFER (0x0008)
    IRP information: 0x01, Direction: PDO -> FDO
        0000 000. = Reserved: 0x00
        .... ...1 = Direction: PDO -> FDO (0x1)
    URB bus id: 1
    Device address: 6
    Endpoint: 0x80, Direction: IN
        1... .... = Direction: IN (1)
        .... 0000 = Endpoint number: 0
    URB transfer type: URB_CONTROL (0x02)
    Packet Data Length: 1
    [Request in: 30]
    [Time from request: 0.000119000 seconds]
    Control transfer stage: Data (1)
    [bInterfaceClass: Unknown (0xffff)]
CONTROL response data: 00

No.     Time           Source                Destination           Protocol Length Info
     33 0.001919       1.6.0                 host                  USB      28     GET CONFIGURATION Status

Frame 33: 28 bytes on wire (224 bits), 28 bytes captured (224 bits) on interface 0
USB URB
    [Source: 1.6.0]
    [Destination: host]
    USBPcap pseudoheader length: 28
    IRP ID: 0xffff80030c18daf0
    IRP USBD_STATUS: USBD_STATUS_SUCCESS (0x00000000)
    URB Function: URB_FUNCTION_CONTROL_TRANSFER (0x0008)
    IRP information: 0x01, Direction: PDO -> FDO
        0000 000. = Reserved: 0x00
        .... ...1 = Direction: PDO -> FDO (0x1)
    URB bus id: 1
    Device address: 6
    Endpoint: 0x80, Direction: IN
        1... .... = Direction: IN (1)
        .... 0000 = Endpoint number: 0
    URB transfer type: URB_CONTROL (0x02)
    Packet Data Length: 0
    [Request in: 30]
    [Time from request: 0.000119000 seconds]
    Control transfer stage: Status (2)

No.     Time           Source                Destination           Protocol Length Info
     34 0.002050       1.6.0                 host                  USB      28     SET FEATURE Status

Frame 34: 28 bytes on wire (224 bits), 28 bytes captured (224 bits) on interface 0
USB URB
    [Source: 1.6.0]
    [Destination: host]
    USBPcap pseudoheader length: 28
    IRP ID: 0xffff800307a97690
    IRP USBD_STATUS: USBD_STATUS_SUCCESS (0x00000000)
    URB Function: URB_FUNCTION_CONTROL_TRANSFER (0x0008)
    IRP information: 0x01, Direction: PDO -> FDO
        0000 000. = Reserved: 0x00
        .... ...1 = Direction: PDO -> FDO (0x1)
    URB bus id: 1
    Device address: 6
    Endpoint: 0x00, Direction: OUT
        0... .... = Direction: OUT (0)
        .... 0000 = Endpoint number: 0
    URB transfer type: URB_CONTROL (0x02)
    Packet Data Length: 0
    [Request in: 31]
    [Time from request: 0.000236000 seconds]
    Control transfer stage: Status (2)

No.     Time           Source                Destination           Protocol Length Info
     35 0.002063       host                  1.6.0                 USB      36     URB_CONTROL out

Frame 35: 36 bytes on wire (288 bits), 36 bytes captured (288 bits) on interface 0
USB URB
    [Source: host]
    [Destination: 1.6.0]
    USBPcap pseudoheader length: 28
    IRP ID: 0xffff800307a97690
    IRP USBD_STATUS: USBD_STATUS_SUCCESS (0x00000000)
    URB Function: URB_FUNCTION_CONTROL_TRANSFER (0x0008)
    IRP information: 0x00, Direction: FDO -> PDO
        0000 000. = Reserved: 0x00
        .... ...0 = Direction: FDO -> PDO (0x0)
    URB bus id: 1
    Device address: 6
    Endpoint: 0x00, Direction: OUT
        0... .... = Direction: OUT (0)
        .... 0000 = Endpoint number: 0
    URB transfer type: URB_CONTROL (0x02)
    Packet Data Length: 8
    [Response in: 36]
    Control transfer stage: Setup (0)
    [bInterfaceClass: Unknown (0xffff)]
URB setup
    bmRequestType: 0x41
    bRequest: 25
    wValue: 0x0000
    wIndex: 0 (0x0000)
    wLength: 6

No.     Time           Source                Destination           Protocol Length Info
     36 0.002193       1.6.0                 host                  USB      34     URB_CONTROL out

Frame 36: 34 bytes on wire (272 bits), 34 bytes captured (272 bits) on interface 0
USB URB
    [Source: 1.6.0]
    [Destination: host]
    USBPcap pseudoheader length: 28
    IRP ID: 0xffff800307a97690
    IRP USBD_STATUS: USBD_STATUS_SUCCESS (0x00000000)
    URB Function: URB_FUNCTION_CONTROL_TRANSFER (0x0008)
    IRP information: 0x01, Direction: PDO -> FDO
        0000 000. = Reserved: 0x00
        .... ...1 = Direction: PDO -> FDO (0x1)
    URB bus id: 1
    Device address: 6
    Endpoint: 0x00, Direction: OUT
        0... .... = Direction: OUT (0)
        .... 0000 = Endpoint number: 0
    URB transfer type: URB_CONTROL (0x02)
    Packet Data Length: 6
    [Request in: 35]
    [Time from request: 0.000130000 seconds]
    Control transfer stage: Data (1)
    [bInterfaceClass: Unknown (0xffff)]
CONTROL response data: 000000001113

No.     Time           Source                Destination           Protocol Length Info
     37 0.002194       1.6.0                 host                  USB      28     Unknown type 19 Status

Frame 37: 28 bytes on wire (224 bits), 28 bytes captured (224 bits) on interface 0
USB URB
    [Source: 1.6.0]
    [Destination: host]
    USBPcap pseudoheader length: 28
    IRP ID: 0xffff800307a97690
    IRP USBD_STATUS: USBD_STATUS_SUCCESS (0x00000000)
    URB Function: URB_FUNCTION_CONTROL_TRANSFER (0x0008)
    IRP information: 0x01, Direction: PDO -> FDO
        0000 000. = Reserved: 0x00
        .... ...1 = Direction: PDO -> FDO (0x1)
    URB bus id: 1
    Device address: 6
    Endpoint: 0x00, Direction: OUT
        0... .... = Direction: OUT (0)
        .... 0000 = Endpoint number: 0
    URB transfer type: URB_CONTROL (0x02)
    Packet Data Length: 0
    [Request in: 35]
    [Time from request: 0.000131000 seconds]
    Control transfer stage: Status (2)

No.     Time           Source                Destination           Protocol Length Info
     38 0.002205       host                  1.6.0                 USB      36     URB_CONTROL out

Frame 38: 36 bytes on wire (288 bits), 36 bytes captured (288 bits) on interface 0
USB URB
    [Source: host]
    [Destination: 1.6.0]
    USBPcap pseudoheader length: 28
    IRP ID: 0xffff800307a97690
    IRP USBD_STATUS: USBD_STATUS_SUCCESS (0x00000000)
    URB Function: URB_FUNCTION_CONTROL_TRANSFER (0x0008)
    IRP information: 0x00, Direction: FDO -> PDO
        0000 000. = Reserved: 0x00
        .... ...0 = Direction: FDO -> PDO (0x0)
    URB bus id: 1
    Device address: 6
    Endpoint: 0x00, Direction: OUT
        0... .... = Direction: OUT (0)
        .... 0000 = Endpoint number: 0
    URB transfer type: URB_CONTROL (0x02)
    Packet Data Length: 8
    [Response in: 39]
    Control transfer stage: Setup (0)
    [bInterfaceClass: Unknown (0xffff)]
URB setup
    bmRequestType: 0x41
    bRequest: 19
    wValue: 0x0000
    wIndex: 0 (0x0000)
    wLength: 16

No.     Time           Source                Destination           Protocol Length Info
     39 0.002337       1.6.0                 host                  USB      44     URB_CONTROL out

Frame 39: 44 bytes on wire (352 bits), 44 bytes captured (352 bits) on interface 0
USB URB
    [Source: 1.6.0]
    [Destination: host]
    USBPcap pseudoheader length: 28
    IRP ID: 0xffff800307a97690
    IRP USBD_STATUS: USBD_STATUS_SUCCESS (0x00000000)
    URB Function: URB_FUNCTION_CONTROL_TRANSFER (0x0008)
    IRP information: 0x01, Direction: PDO -> FDO
        0000 000. = Reserved: 0x00
        .... ...1 = Direction: PDO -> FDO (0x1)
    URB bus id: 1
    Device address: 6
    Endpoint: 0x00, Direction: OUT
        0... .... = Direction: OUT (0)
        .... 0000 = Endpoint number: 0
    URB transfer type: URB_CONTROL (0x02)
    Packet Data Length: 16
    [Request in: 38]
    [Time from request: 0.000132000 seconds]
    Control transfer stage: Data (1)
    [bInterfaceClass: Unknown (0xffff)]
CONTROL response data: 00000000000000003200000034000000

No.     Time           Source                Destination           Protocol Length Info
     40 0.002337       1.6.0                 host                  USB      28     Unknown type 13 Status

Frame 40: 28 bytes on wire (224 bits), 28 bytes captured (224 bits) on interface 0
USB URB
    [Source: 1.6.0]
    [Destination: host]
    USBPcap pseudoheader length: 28
    IRP ID: 0xffff800307a97690
    IRP USBD_STATUS: USBD_STATUS_SUCCESS (0x00000000)
    URB Function: URB_FUNCTION_CONTROL_TRANSFER (0x0008)
    IRP information: 0x01, Direction: PDO -> FDO
        0000 000. = Reserved: 0x00
        .... ...1 = Direction: PDO -> FDO (0x1)
    URB bus id: 1
    Device address: 6
    Endpoint: 0x00, Direction: OUT
        0... .... = Direction: OUT (0)
        .... 0000 = Endpoint number: 0
    URB transfer type: URB_CONTROL (0x02)
    Packet Data Length: 0
    [Request in: 38]
    [Time from request: 0.000132000 seconds]
    Control transfer stage: Status (2)

No.     Time           Source                Destination           Protocol Length Info
     41 0.002823       host                  1.6.0                 USB      36     URB_CONTROL out

Frame 41: 36 bytes on wire (288 bits), 36 bytes captured (288 bits) on interface 0
USB URB
    [Source: host]
    [Destination: 1.6.0]
    USBPcap pseudoheader length: 28
    IRP ID: 0xffff800307a97690
    IRP USBD_STATUS: USBD_STATUS_SUCCESS (0x00000000)
    URB Function: URB_FUNCTION_CONTROL_TRANSFER (0x0008)
    IRP information: 0x00, Direction: FDO -> PDO
        0000 000. = Reserved: 0x00
        .... ...0 = Direction: FDO -> PDO (0x0)
    URB bus id: 1
    Device address: 6
    Endpoint: 0x00, Direction: OUT
        0... .... = Direction: OUT (0)
        .... 0000 = Endpoint number: 0
    URB transfer type: URB_CONTROL (0x02)
    Packet Data Length: 8
    [Response in: 42]
    Control transfer stage: Setup (0)
    [bInterfaceClass: Unknown (0xffff)]
URB setup
    bmRequestType: 0x41
    bRequest: 30
    wValue: 0x0000
    wIndex: 0 (0x0000)
    wLength: 4

No.     Time           Source                Destination           Protocol Length Info
     42 0.003031       1.6.0                 host                  USB      32     URB_CONTROL out

Frame 42: 32 bytes on wire (256 bits), 32 bytes captured (256 bits) on interface 0
USB URB
    [Source: 1.6.0]
    [Destination: host]
    USBPcap pseudoheader length: 28
    IRP ID: 0xffff800307a97690
    IRP USBD_STATUS: USBD_STATUS_SUCCESS (0x00000000)
    URB Function: URB_FUNCTION_CONTROL_TRANSFER (0x0008)
    IRP information: 0x01, Direction: PDO -> FDO
        0000 000. = Reserved: 0x00
        .... ...1 = Direction: PDO -> FDO (0x1)
    URB bus id: 1
    Device address: 6
    Endpoint: 0x00, Direction: OUT
        0... .... = Direction: OUT (0)
        .... 0000 = Endpoint number: 0
    URB transfer type: URB_CONTROL (0x02)
    Packet Data Length: 4
    [Request in: 41]
    [Time from request: 0.000208000 seconds]
    Control transfer stage: Data (1)
    [bInterfaceClass: Unknown (0xffff)]
CONTROL response data: 00e10000

No.     Time           Source                Destination           Protocol Length Info
     43 0.003058       1.6.0                 host                  USB      28     Unknown type 1e Status

Frame 43: 28 bytes on wire (224 bits), 28 bytes captured (224 bits) on interface 0
USB URB
    [Source: 1.6.0]
    [Destination: host]
    USBPcap pseudoheader length: 28
    IRP ID: 0xffff800307a97690
    IRP USBD_STATUS: USBD_STATUS_SUCCESS (0x00000000)
    URB Function: URB_FUNCTION_CONTROL_TRANSFER (0x0008)
    IRP information: 0x01, Direction: PDO -> FDO
        0000 000. = Reserved: 0x00
        .... ...1 = Direction: PDO -> FDO (0x1)
    URB bus id: 1
    Device address: 6
    Endpoint: 0x00, Direction: OUT
        0... .... = Direction: OUT (0)
        .... 0000 = Endpoint number: 0
    URB transfer type: URB_CONTROL (0x02)
    Packet Data Length: 0
    [Request in: 41]
    [Time from request: 0.000235000 seconds]
    Control transfer stage: Status (2)

No.     Time           Source                Destination           Protocol Length Info
     44 0.003073       host                  1.6.0                 USB      36     URB_CONTROL out

Frame 44: 36 bytes on wire (288 bits), 36 bytes captured (288 bits) on interface 0
USB URB
    [Source: host]
    [Destination: 1.6.0]
    USBPcap pseudoheader length: 28
    IRP ID: 0xffff800307a97690
    IRP USBD_STATUS: USBD_STATUS_SUCCESS (0x00000000)
    URB Function: URB_FUNCTION_CONTROL_TRANSFER (0x0008)
    IRP information: 0x00, Direction: FDO -> PDO
        0000 000. = Reserved: 0x00
        .... ...0 = Direction: FDO -> PDO (0x0)
    URB bus id: 1
    Device address: 6
    Endpoint: 0x00, Direction: OUT
        0... .... = Direction: OUT (0)
        .... 0000 = Endpoint number: 0
    URB transfer type: URB_CONTROL (0x02)
    Packet Data Length: 8
    [Response in: 45]
    Control transfer stage: Setup (0)
    [bInterfaceClass: Unknown (0xffff)]
URB setup
    bmRequestType: 0x41
    bRequest: 7
    wValue: 0x0200
    wIndex: 0 (0x0000)
    wLength: 0

No.     Time           Source                Destination           Protocol Length Info
     45 0.003138       1.6.0                 host                  USB      28     SET DESCRIPTOR Status

Frame 45: 28 bytes on wire (224 bits), 28 bytes captured (224 bits) on interface 0
USB URB
    [Source: 1.6.0]
    [Destination: host]
    USBPcap pseudoheader length: 28
    IRP ID: 0xffff800307a97690
    IRP USBD_STATUS: USBD_STATUS_SUCCESS (0x00000000)
    URB Function: URB_FUNCTION_CONTROL_TRANSFER (0x0008)
    IRP information: 0x01, Direction: PDO -> FDO
        0000 000. = Reserved: 0x00
        .... ...1 = Direction: PDO -> FDO (0x1)
    URB bus id: 1
    Device address: 6
    Endpoint: 0x00, Direction: OUT
        0... .... = Direction: OUT (0)
        .... 0000 = Endpoint number: 0
    URB transfer type: URB_CONTROL (0x02)
    Packet Data Length: 0
    [Request in: 44]
    [Time from request: 0.000065000 seconds]
    Control transfer stage: Status (2)

No.     Time           Source                Destination           Protocol Length Info
     46 0.003146       host                  1.6.0                 USB      36     URB_CONTROL in

Frame 46: 36 bytes on wire (288 bits), 36 bytes captured (288 bits) on interface 0
USB URB
    [Source: host]
    [Destination: 1.6.0]
    USBPcap pseudoheader length: 28
    IRP ID: 0xffff800307a97690
    IRP USBD_STATUS: USBD_STATUS_SUCCESS (0x00000000)
    URB Function: URB_FUNCTION_CONTROL_TRANSFER (0x0008)
    IRP information: 0x00, Direction: FDO -> PDO
        0000 000. = Reserved: 0x00
        .... ...0 = Direction: FDO -> PDO (0x0)
    URB bus id: 1
    Device address: 6
    Endpoint: 0x80, Direction: IN
        1... .... = Direction: IN (1)
        .... 0000 = Endpoint number: 0
    URB transfer type: URB_CONTROL (0x02)
    Packet Data Length: 8
    [Response in: 48]
    Control transfer stage: Setup (0)
    [bInterfaceClass: Unknown (0xffff)]
URB setup
    bmRequestType: 0xc1
    bRequest: 8
    wValue: 0x0000
    wIndex: 0 (0x0000)
    wLength: 4

No.     Time           Source                Destination           Protocol Length Info
     47 0.003161       host                  1.6.0                 USB      36     URB_CONTROL out

Frame 47: 36 bytes on wire (288 bits), 36 bytes captured (288 bits) on interface 0
USB URB
    [Source: host]
    [Destination: 1.6.0]
    USBPcap pseudoheader length: 28
    IRP ID: 0xffff80030c18daf0
    IRP USBD_STATUS: USBD_STATUS_SUCCESS (0x00000000)
    URB Function: URB_FUNCTION_CONTROL_TRANSFER (0x0008)
    IRP information: 0x00, Direction: FDO -> PDO
        0000 000. = Reserved: 0x00
        .... ...0 = Direction: FDO -> PDO (0x0)
    URB bus id: 1
    Device address: 6
    Endpoint: 0x00, Direction: OUT
        0... .... = Direction: OUT (0)
        .... 0000 = Endpoint number: 0
    URB transfer type: URB_CONTROL (0x02)
    Packet Data Length: 8
    [Response in: 50]
    Control transfer stage: Setup (0)
    [bInterfaceClass: Unknown (0xffff)]
URB setup
    bmRequestType: 0x41
    bRequest: 7
    wValue: 0x0100
    wIndex: 0 (0x0000)
    wLength: 0

No.     Time           Source                Destination           Protocol Length Info
     48 0.003267       1.6.0                 host                  USB      29     URB_CONTROL in

Frame 48: 29 bytes on wire (232 bits), 29 bytes captured (232 bits) on interface 0
USB URB
    [Source: 1.6.0]
    [Destination: host]
    USBPcap pseudoheader length: 28
    IRP ID: 0xffff800307a97690
    IRP USBD_STATUS: USBD_STATUS_SUCCESS (0x00000000)
    URB Function: URB_FUNCTION_CONTROL_TRANSFER (0x0008)
    IRP information: 0x01, Direction: PDO -> FDO
        0000 000. = Reserved: 0x00
        .... ...1 = Direction: PDO -> FDO (0x1)
    URB bus id: 1
    Device address: 6
    Endpoint: 0x80, Direction: IN
        1... .... = Direction: IN (1)
        .... 0000 = Endpoint number: 0
    URB transfer type: URB_CONTROL (0x02)
    Packet Data Length: 1
    [Request in: 46]
    [Time from request: 0.000121000 seconds]
    Control transfer stage: Data (1)
    [bInterfaceClass: Unknown (0xffff)]
CONTROL response data: 00

No.     Time           Source                Destination           Protocol Length Info
     49 0.003267       1.6.0                 host                  USB      28     GET CONFIGURATION Status

Frame 49: 28 bytes on wire (224 bits), 28 bytes captured (224 bits) on interface 0
USB URB
    [Source: 1.6.0]
    [Destination: host]
    USBPcap pseudoheader length: 28
    IRP ID: 0xffff800307a97690
    IRP USBD_STATUS: USBD_STATUS_SUCCESS (0x00000000)
    URB Function: URB_FUNCTION_CONTROL_TRANSFER (0x0008)
    IRP information: 0x01, Direction: PDO -> FDO
        0000 000. = Reserved: 0x00
        .... ...1 = Direction: PDO -> FDO (0x1)
    URB bus id: 1
    Device address: 6
    Endpoint: 0x80, Direction: IN
        1... .... = Direction: IN (1)
        .... 0000 = Endpoint number: 0
    URB transfer type: URB_CONTROL (0x02)
    Packet Data Length: 0
    [Request in: 46]
    [Time from request: 0.000121000 seconds]
    Control transfer stage: Status (2)

No.     Time           Source                Destination           Protocol Length Info
     50 0.003393       1.6.0                 host                  USB      28     SET DESCRIPTOR Status

Frame 50: 28 bytes on wire (224 bits), 28 bytes captured (224 bits) on interface 0
USB URB
    [Source: 1.6.0]
    [Destination: host]
    USBPcap pseudoheader length: 28
    IRP ID: 0xffff80030c18daf0
    IRP USBD_STATUS: USBD_STATUS_SUCCESS (0x00000000)
    URB Function: URB_FUNCTION_CONTROL_TRANSFER (0x0008)
    IRP information: 0x01, Direction: PDO -> FDO
        0000 000. = Reserved: 0x00
        .... ...1 = Direction: PDO -> FDO (0x1)
    URB bus id: 1
    Device address: 6
    Endpoint: 0x00, Direction: OUT
        0... .... = Direction: OUT (0)
        .... 0000 = Endpoint number: 0
    URB transfer type: URB_CONTROL (0x02)
    Packet Data Length: 0
    [Request in: 47]
    [Time from request: 0.000232000 seconds]
    Control transfer stage: Status (2)

No.     Time           Source                Destination           Protocol Length Info
     51 0.003400       host                  1.6.0                 USB      36     URB_CONTROL in

Frame 51: 36 bytes on wire (288 bits), 36 bytes captured (288 bits) on interface 0
USB URB
    [Source: host]
    [Destination: 1.6.0]
    USBPcap pseudoheader length: 28
    IRP ID: 0xffff80030c18daf0
    IRP USBD_STATUS: USBD_STATUS_SUCCESS (0x00000000)
    URB Function: URB_FUNCTION_CONTROL_TRANSFER (0x0008)
    IRP information: 0x00, Direction: FDO -> PDO
        0000 000. = Reserved: 0x00
        .... ...0 = Direction: FDO -> PDO (0x0)
    URB bus id: 1
    Device address: 6
    Endpoint: 0x80, Direction: IN
        1... .... = Direction: IN (1)
        .... 0000 = Endpoint number: 0
    URB transfer type: URB_CONTROL (0x02)
    Packet Data Length: 8
    [Response in: 53]
    Control transfer stage: Setup (0)
    [bInterfaceClass: Unknown (0xffff)]
URB setup
    bmRequestType: 0xc1
    bRequest: 8
    wValue: 0x0000
    wIndex: 0 (0x0000)
    wLength: 4

No.     Time           Source                Destination           Protocol Length Info
     52 0.003409       host                  1.6.0                 USB      36     URB_CONTROL out

Frame 52: 36 bytes on wire (288 bits), 36 bytes captured (288 bits) on interface 0
USB URB
    [Source: host]
    [Destination: 1.6.0]
    USBPcap pseudoheader length: 28
    IRP ID: 0xffff80030ce33010
    IRP USBD_STATUS: USBD_STATUS_SUCCESS (0x00000000)
    URB Function: URB_FUNCTION_CONTROL_TRANSFER (0x0008)
    IRP information: 0x00, Direction: FDO -> PDO
        0000 000. = Reserved: 0x00
        .... ...0 = Direction: FDO -> PDO (0x0)
    URB bus id: 1
    Device address: 6
    Endpoint: 0x00, Direction: OUT
        0... .... = Direction: OUT (0)
        .... 0000 = Endpoint number: 0
    URB transfer type: URB_CONTROL (0x02)
    Packet Data Length: 8
    [Response in: 55]
    Control transfer stage: Setup (0)
    [bInterfaceClass: Unknown (0xffff)]
URB setup
    bmRequestType: 0x41
    bRequest: 3
    wValue: 0x0800
    wIndex: 0 (0x0000)
    wLength: 0

No.     Time           Source                Destination           Protocol Length Info
     53 0.003521       1.6.0                 host                  USB      29     URB_CONTROL in

Frame 53: 29 bytes on wire (232 bits), 29 bytes captured (232 bits) on interface 0
USB URB
    [Source: 1.6.0]
    [Destination: host]
    USBPcap pseudoheader length: 28
    IRP ID: 0xffff80030c18daf0
    IRP USBD_STATUS: USBD_STATUS_SUCCESS (0x00000000)
    URB Function: URB_FUNCTION_CONTROL_TRANSFER (0x0008)
    IRP information: 0x01, Direction: PDO -> FDO
        0000 000. = Reserved: 0x00
        .... ...1 = Direction: PDO -> FDO (0x1)
    URB bus id: 1
    Device address: 6
    Endpoint: 0x80, Direction: IN
        1... .... = Direction: IN (1)
        .... 0000 = Endpoint number: 0
    URB transfer type: URB_CONTROL (0x02)
    Packet Data Length: 1
    [Request in: 51]
    [Time from request: 0.000121000 seconds]
    Control transfer stage: Data (1)
    [bInterfaceClass: Unknown (0xffff)]
CONTROL response data: 00

No.     Time           Source                Destination           Protocol Length Info
     54 0.003522       1.6.0                 host                  USB      28     GET CONFIGURATION Status

Frame 54: 28 bytes on wire (224 bits), 28 bytes captured (224 bits) on interface 0
USB URB
    [Source: 1.6.0]
    [Destination: host]
    USBPcap pseudoheader length: 28
    IRP ID: 0xffff80030c18daf0
    IRP USBD_STATUS: USBD_STATUS_SUCCESS (0x00000000)
    URB Function: URB_FUNCTION_CONTROL_TRANSFER (0x0008)
    IRP information: 0x01, Direction: PDO -> FDO
        0000 000. = Reserved: 0x00
        .... ...1 = Direction: PDO -> FDO (0x1)
    URB bus id: 1
    Device address: 6
    Endpoint: 0x80, Direction: IN
        1... .... = Direction: IN (1)
        .... 0000 = Endpoint number: 0
    URB transfer type: URB_CONTROL (0x02)
    Packet Data Length: 0
    [Request in: 51]
    [Time from request: 0.000122000 seconds]
    Control transfer stage: Status (2)

No.     Time           Source                Destination           Protocol Length Info
     55 0.003655       1.6.0                 host                  USB      28     SET FEATURE Status

Frame 55: 28 bytes on wire (224 bits), 28 bytes captured (224 bits) on interface 0
USB URB
    [Source: 1.6.0]
    [Destination: host]
    USBPcap pseudoheader length: 28
    IRP ID: 0xffff80030ce33010
    IRP USBD_STATUS: USBD_STATUS_SUCCESS (0x00000000)
    URB Function: URB_FUNCTION_CONTROL_TRANSFER (0x0008)
    IRP information: 0x01, Direction: PDO -> FDO
        0000 000. = Reserved: 0x00
        .... ...1 = Direction: PDO -> FDO (0x1)
    URB bus id: 1
    Device address: 6
    Endpoint: 0x00, Direction: OUT
        0... .... = Direction: OUT (0)
        .... 0000 = Endpoint number: 0
    URB transfer type: URB_CONTROL (0x02)
    Packet Data Length: 0
    [Request in: 52]
    [Time from request: 0.000246000 seconds]
    Control transfer stage: Status (2)

No.     Time           Source                Destination           Protocol Length Info
     56 0.003694       host                  1.6.0                 USB      36     URB_CONTROL out

Frame 56: 36 bytes on wire (288 bits), 36 bytes captured (288 bits) on interface 0
USB URB
    [Source: host]
    [Destination: 1.6.0]
    USBPcap pseudoheader length: 28
    IRP ID: 0xffff80030c18daf0
    IRP USBD_STATUS: USBD_STATUS_SUCCESS (0x00000000)
    URB Function: URB_FUNCTION_CONTROL_TRANSFER (0x0008)
    IRP information: 0x00, Direction: FDO -> PDO
        0000 000. = Reserved: 0x00
        .... ...0 = Direction: FDO -> PDO (0x0)
    URB bus id: 1
    Device address: 6
    Endpoint: 0x00, Direction: OUT
        0... .... = Direction: OUT (0)
        .... 0000 = Endpoint number: 0
    URB transfer type: URB_CONTROL (0x02)
    Packet Data Length: 8
    [Response in: 57]
    Control transfer stage: Setup (0)
    [bInterfaceClass: Unknown (0xffff)]
URB setup
    bmRequestType: 0x41
    bRequest: 25
    wValue: 0x0000
    wIndex: 0 (0x0000)
    wLength: 6

No.     Time           Source                Destination           Protocol Length Info
     57 0.003822       1.6.0                 host                  USB      34     URB_CONTROL out

Frame 57: 34 bytes on wire (272 bits), 34 bytes captured (272 bits) on interface 0
USB URB
    [Source: 1.6.0]
    [Destination: host]
    USBPcap pseudoheader length: 28
    IRP ID: 0xffff80030c18daf0
    IRP USBD_STATUS: USBD_STATUS_SUCCESS (0x00000000)
    URB Function: URB_FUNCTION_CONTROL_TRANSFER (0x0008)
    IRP information: 0x01, Direction: PDO -> FDO
        0000 000. = Reserved: 0x00
        .... ...1 = Direction: PDO -> FDO (0x1)
    URB bus id: 1
    Device address: 6
    Endpoint: 0x00, Direction: OUT
        0... .... = Direction: OUT (0)
        .... 0000 = Endpoint number: 0
    URB transfer type: URB_CONTROL (0x02)
    Packet Data Length: 6
    [Request in: 56]
    [Time from request: 0.000128000 seconds]
    Control transfer stage: Data (1)
    [bInterfaceClass: Unknown (0xffff)]
CONTROL response data: 000000001113

No.     Time           Source                Destination           Protocol Length Info
     58 0.003822       1.6.0                 host                  USB      28     Unknown type 19 Status

Frame 58: 28 bytes on wire (224 bits), 28 bytes captured (224 bits) on interface 0
USB URB
    [Source: 1.6.0]
    [Destination: host]
    USBPcap pseudoheader length: 28
    IRP ID: 0xffff80030c18daf0
    IRP USBD_STATUS: USBD_STATUS_SUCCESS (0x00000000)
    URB Function: URB_FUNCTION_CONTROL_TRANSFER (0x0008)
    IRP information: 0x01, Direction: PDO -> FDO
        0000 000. = Reserved: 0x00
        .... ...1 = Direction: PDO -> FDO (0x1)
    URB bus id: 1
    Device address: 6
    Endpoint: 0x00, Direction: OUT
        0... .... = Direction: OUT (0)
        .... 0000 = Endpoint number: 0
    URB transfer type: URB_CONTROL (0x02)
    Packet Data Length: 0
    [Request in: 56]
    [Time from request: 0.000128000 seconds]
    Control transfer stage: Status (2)

No.     Time           Source                Destination           Protocol Length Info
     59 0.003836       host                  1.6.0                 USB      36     URB_CONTROL out

Frame 59: 36 bytes on wire (288 bits), 36 bytes captured (288 bits) on interface 0
USB URB
    [Source: host]
    [Destination: 1.6.0]
    USBPcap pseudoheader length: 28
    IRP ID: 0xffff80030c18daf0
    IRP USBD_STATUS: USBD_STATUS_SUCCESS (0x00000000)
    URB Function: URB_FUNCTION_CONTROL_TRANSFER (0x0008)
    IRP information: 0x00, Direction: FDO -> PDO
        0000 000. = Reserved: 0x00
        .... ...0 = Direction: FDO -> PDO (0x0)
    URB bus id: 1
    Device address: 6
    Endpoint: 0x00, Direction: OUT
        0... .... = Direction: OUT (0)
        .... 0000 = Endpoint number: 0
    URB transfer type: URB_CONTROL (0x02)
    Packet Data Length: 8
    [Response in: 60]
    Control transfer stage: Setup (0)
    [bInterfaceClass: Unknown (0xffff)]
URB setup
    bmRequestType: 0x41
    bRequest: 19
    wValue: 0x0000
    wIndex: 0 (0x0000)
    wLength: 16

No.     Time           Source                Destination           Protocol Length Info
     60 0.003941       1.6.0                 host                  USB      44     URB_CONTROL out

Frame 60: 44 bytes on wire (352 bits), 44 bytes captured (352 bits) on interface 0
USB URB
    [Source: 1.6.0]
    [Destination: host]
    USBPcap pseudoheader length: 28
    IRP ID: 0xffff80030c18daf0
    IRP USBD_STATUS: USBD_STATUS_SUCCESS (0x00000000)
    URB Function: URB_FUNCTION_CONTROL_TRANSFER (0x0008)
    IRP information: 0x01, Direction: PDO -> FDO
        0000 000. = Reserved: 0x00
        .... ...1 = Direction: PDO -> FDO (0x1)
    URB bus id: 1
    Device address: 6
    Endpoint: 0x00, Direction: OUT
        0... .... = Direction: OUT (0)
        .... 0000 = Endpoint number: 0
    URB transfer type: URB_CONTROL (0x02)
    Packet Data Length: 16
    [Request in: 59]
    [Time from request: 0.000105000 seconds]
    Control transfer stage: Data (1)
    [bInterfaceClass: Unknown (0xffff)]
CONTROL response data: 00000000000000003200000034000000

No.     Time           Source                Destination           Protocol Length Info
     61 0.003942       1.6.0                 host                  USB      28     Unknown type 13 Status

Frame 61: 28 bytes on wire (224 bits), 28 bytes captured (224 bits) on interface 0
USB URB
    [Source: 1.6.0]
    [Destination: host]
    USBPcap pseudoheader length: 28
    IRP ID: 0xffff80030c18daf0
    IRP USBD_STATUS: USBD_STATUS_SUCCESS (0x00000000)
    URB Function: URB_FUNCTION_CONTROL_TRANSFER (0x0008)
    IRP information: 0x01, Direction: PDO -> FDO
        0000 000. = Reserved: 0x00
        .... ...1 = Direction: PDO -> FDO (0x1)
    URB bus id: 1
    Device address: 6
    Endpoint: 0x00, Direction: OUT
        0... .... = Direction: OUT (0)
        .... 0000 = Endpoint number: 0
    URB transfer type: URB_CONTROL (0x02)
    Packet Data Length: 0
    [Request in: 59]
    [Time from request: 0.000106000 seconds]
    Control transfer stage: Status (2)

No.     Time           Source                Destination           Protocol Length Info
     62 0.003999       host                  1.6.0                 USB      36     URB_CONTROL out

Frame 62: 36 bytes on wire (288 bits), 36 bytes captured (288 bits) on interface 0
USB URB
    [Source: host]
    [Destination: 1.6.0]
    USBPcap pseudoheader length: 28
    IRP ID: 0xffff800307b3f010
    IRP USBD_STATUS: USBD_STATUS_SUCCESS (0x00000000)
    URB Function: URB_FUNCTION_CONTROL_TRANSFER (0x0008)
    IRP information: 0x00, Direction: FDO -> PDO
        0000 000. = Reserved: 0x00
        .... ...0 = Direction: FDO -> PDO (0x0)
    URB bus id: 1
    Device address: 6
    Endpoint: 0x00, Direction: OUT
        0... .... = Direction: OUT (0)
        .... 0000 = Endpoint number: 0
    URB transfer type: URB_CONTROL (0x02)
    Packet Data Length: 8
    [Response in: 63]
    Control transfer stage: Setup (0)
    [bInterfaceClass: Unknown (0xffff)]
URB setup
    bmRequestType: 0x41
    bRequest: 30
    wValue: 0x0000
    wIndex: 0 (0x0000)
    wLength: 4

No.     Time           Source                Destination           Protocol Length Info
     63 0.004178       1.6.0                 host                  USB      32     URB_CONTROL out

Frame 63: 32 bytes on wire (256 bits), 32 bytes captured (256 bits) on interface 0
USB URB
    [Source: 1.6.0]
    [Destination: host]
    USBPcap pseudoheader length: 28
    IRP ID: 0xffff800307b3f010
    IRP USBD_STATUS: USBD_STATUS_SUCCESS (0x00000000)
    URB Function: URB_FUNCTION_CONTROL_TRANSFER (0x0008)
    IRP information: 0x01, Direction: PDO -> FDO
        0000 000. = Reserved: 0x00
        .... ...1 = Direction: PDO -> FDO (0x1)
    URB bus id: 1
    Device address: 6
    Endpoint: 0x00, Direction: OUT
        0... .... = Direction: OUT (0)
        .... 0000 = Endpoint number: 0
    URB transfer type: URB_CONTROL (0x02)
    Packet Data Length: 4
    [Request in: 62]
    [Time from request: 0.000179000 seconds]
    Control transfer stage: Data (1)
    [bInterfaceClass: Unknown (0xffff)]
CONTROL response data: 00e10000

No.     Time           Source                Destination           Protocol Length Info
     64 0.004205       1.6.0                 host                  USB      28     Unknown type 1e Status

Frame 64: 28 bytes on wire (224 bits), 28 bytes captured (224 bits) on interface 0
USB URB
    [Source: 1.6.0]
    [Destination: host]
    USBPcap pseudoheader length: 28
    IRP ID: 0xffff800307b3f010
    IRP USBD_STATUS: USBD_STATUS_SUCCESS (0x00000000)
    URB Function: URB_FUNCTION_CONTROL_TRANSFER (0x0008)
    IRP information: 0x01, Direction: PDO -> FDO
        0000 000. = Reserved: 0x00
        .... ...1 = Direction: PDO -> FDO (0x1)
    URB bus id: 1
    Device address: 6
    Endpoint: 0x00, Direction: OUT
        0... .... = Direction: OUT (0)
        .... 0000 = Endpoint number: 0
    URB transfer type: URB_CONTROL (0x02)
    Packet Data Length: 0
    [Request in: 62]
    [Time from request: 0.000206000 seconds]
    Control transfer stage: Status (2)

No.     Time           Source                Destination           Protocol Length Info
     65 0.004219       host                  1.6.0                 USB      36     URB_CONTROL out

Frame 65: 36 bytes on wire (288 bits), 36 bytes captured (288 bits) on interface 0
USB URB
    [Source: host]
    [Destination: 1.6.0]
    USBPcap pseudoheader length: 28
    IRP ID: 0xffff80030c18daf0
    IRP USBD_STATUS: USBD_STATUS_SUCCESS (0x00000000)
    URB Function: URB_FUNCTION_CONTROL_TRANSFER (0x0008)
    IRP information: 0x00, Direction: FDO -> PDO
        0000 000. = Reserved: 0x00
        .... ...0 = Direction: FDO -> PDO (0x0)
    URB bus id: 1
    Device address: 6
    Endpoint: 0x00, Direction: OUT
        0... .... = Direction: OUT (0)
        .... 0000 = Endpoint number: 0
    URB transfer type: URB_CONTROL (0x02)
    Packet Data Length: 8
    [Response in: 66]
    Control transfer stage: Setup (0)
    [bInterfaceClass: Unknown (0xffff)]
URB setup
    bmRequestType: 0x41
    bRequest: 7
    wValue: 0x0200
    wIndex: 0 (0x0000)
    wLength: 0

No.     Time           Source                Destination           Protocol Length Info
     66 0.004337       1.6.0                 host                  USB      28     SET DESCRIPTOR Status

Frame 66: 28 bytes on wire (224 bits), 28 bytes captured (224 bits) on interface 0
USB URB
    [Source: 1.6.0]
    [Destination: host]
    USBPcap pseudoheader length: 28
    IRP ID: 0xffff80030c18daf0
    IRP USBD_STATUS: USBD_STATUS_SUCCESS (0x00000000)
    URB Function: URB_FUNCTION_CONTROL_TRANSFER (0x0008)
    IRP information: 0x01, Direction: PDO -> FDO
        0000 000. = Reserved: 0x00
        .... ...1 = Direction: PDO -> FDO (0x1)
    URB bus id: 1
    Device address: 6
    Endpoint: 0x00, Direction: OUT
        0... .... = Direction: OUT (0)
        .... 0000 = Endpoint number: 0
    URB transfer type: URB_CONTROL (0x02)
    Packet Data Length: 0
    [Request in: 65]
    [Time from request: 0.000118000 seconds]
    Control transfer stage: Status (2)

No.     Time           Source                Destination           Protocol Length Info
     67 0.004345       host                  1.6.0                 USB      36     URB_CONTROL in

Frame 67: 36 bytes on wire (288 bits), 36 bytes captured (288 bits) on interface 0
USB URB
    [Source: host]
    [Destination: 1.6.0]
    USBPcap pseudoheader length: 28
    IRP ID: 0xffff80030c18daf0
    IRP USBD_STATUS: USBD_STATUS_SUCCESS (0x00000000)
    URB Function: URB_FUNCTION_CONTROL_TRANSFER (0x0008)
    IRP information: 0x00, Direction: FDO -> PDO
        0000 000. = Reserved: 0x00
        .... ...0 = Direction: FDO -> PDO (0x0)
    URB bus id: 1
    Device address: 6
    Endpoint: 0x80, Direction: IN
        1... .... = Direction: IN (1)
        .... 0000 = Endpoint number: 0
    URB transfer type: URB_CONTROL (0x02)
    Packet Data Length: 8
    [Response in: 69]
    Control transfer stage: Setup (0)
    [bInterfaceClass: Unknown (0xffff)]
URB setup
    bmRequestType: 0xc1
    bRequest: 8
    wValue: 0x0000
    wIndex: 0 (0x0000)
    wLength: 4

No.     Time           Source                Destination           Protocol Length Info
     68 0.004357       host                  1.6.0                 USB      36     URB_CONTROL out

Frame 68: 36 bytes on wire (288 bits), 36 bytes captured (288 bits) on interface 0
USB URB
    [Source: host]
    [Destination: 1.6.0]
    USBPcap pseudoheader length: 28
    IRP ID: 0xffff800307a97690
    IRP USBD_STATUS: USBD_STATUS_SUCCESS (0x00000000)
    URB Function: URB_FUNCTION_CONTROL_TRANSFER (0x0008)
    IRP information: 0x00, Direction: FDO -> PDO
        0000 000. = Reserved: 0x00
        .... ...0 = Direction: FDO -> PDO (0x0)
    URB bus id: 1
    Device address: 6
    Endpoint: 0x00, Direction: OUT
        0... .... = Direction: OUT (0)
        .... 0000 = Endpoint number: 0
    URB transfer type: URB_CONTROL (0x02)
    Packet Data Length: 8
    [Response in: 71]
    Control transfer stage: Setup (0)
    [bInterfaceClass: Unknown (0xffff)]
URB setup
    bmRequestType: 0x41
    bRequest: 7
    wValue: 0x0100
    wIndex: 0 (0x0000)
    wLength: 0

No.     Time           Source                Destination           Protocol Length Info
     69 0.004464       1.6.0                 host                  USB      29     URB_CONTROL in

Frame 69: 29 bytes on wire (232 bits), 29 bytes captured (232 bits) on interface 0
USB URB
    [Source: 1.6.0]
    [Destination: host]
    USBPcap pseudoheader length: 28
    IRP ID: 0xffff80030c18daf0
    IRP USBD_STATUS: USBD_STATUS_SUCCESS (0x00000000)
    URB Function: URB_FUNCTION_CONTROL_TRANSFER (0x0008)
    IRP information: 0x01, Direction: PDO -> FDO
        0000 000. = Reserved: 0x00
        .... ...1 = Direction: PDO -> FDO (0x1)
    URB bus id: 1
    Device address: 6
    Endpoint: 0x80, Direction: IN
        1... .... = Direction: IN (1)
        .... 0000 = Endpoint number: 0
    URB transfer type: URB_CONTROL (0x02)
    Packet Data Length: 1
    [Request in: 67]
    [Time from request: 0.000119000 seconds]
    Control transfer stage: Data (1)
    [bInterfaceClass: Unknown (0xffff)]
CONTROL response data: 00

No.     Time           Source                Destination           Protocol Length Info
     70 0.004465       1.6.0                 host                  USB      28     GET CONFIGURATION Status

Frame 70: 28 bytes on wire (224 bits), 28 bytes captured (224 bits) on interface 0
USB URB
    [Source: 1.6.0]
    [Destination: host]
    USBPcap pseudoheader length: 28
    IRP ID: 0xffff80030c18daf0
    IRP USBD_STATUS: USBD_STATUS_SUCCESS (0x00000000)
    URB Function: URB_FUNCTION_CONTROL_TRANSFER (0x0008)
    IRP information: 0x01, Direction: PDO -> FDO
        0000 000. = Reserved: 0x00
        .... ...1 = Direction: PDO -> FDO (0x1)
    URB bus id: 1
    Device address: 6
    Endpoint: 0x80, Direction: IN
        1... .... = Direction: IN (1)
        .... 0000 = Endpoint number: 0
    URB transfer type: URB_CONTROL (0x02)
    Packet Data Length: 0
    [Request in: 67]
    [Time from request: 0.000120000 seconds]
    Control transfer stage: Status (2)

No.     Time           Source                Destination           Protocol Length Info
     71 0.004513       1.6.0                 host                  USB      28     SET DESCRIPTOR Status

Frame 71: 28 bytes on wire (224 bits), 28 bytes captured (224 bits) on interface 0
USB URB
    [Source: 1.6.0]
    [Destination: host]
    USBPcap pseudoheader length: 28
    IRP ID: 0xffff800307a97690
    IRP USBD_STATUS: USBD_STATUS_SUCCESS (0x00000000)
    URB Function: URB_FUNCTION_CONTROL_TRANSFER (0x0008)
    IRP information: 0x01, Direction: PDO -> FDO
        0000 000. = Reserved: 0x00
        .... ...1 = Direction: PDO -> FDO (0x1)
    URB bus id: 1
    Device address: 6
    Endpoint: 0x00, Direction: OUT
        0... .... = Direction: OUT (0)
        .... 0000 = Endpoint number: 0
    URB transfer type: URB_CONTROL (0x02)
    Packet Data Length: 0
    [Request in: 68]
    [Time from request: 0.000156000 seconds]
    Control transfer stage: Status (2)

No.     Time           Source                Destination           Protocol Length Info
     72 0.004519       host                  1.6.0                 USB      36     URB_CONTROL in

Frame 72: 36 bytes on wire (288 bits), 36 bytes captured (288 bits) on interface 0
USB URB
    [Source: host]
    [Destination: 1.6.0]
    USBPcap pseudoheader length: 28
    IRP ID: 0xffff800307a97690
    IRP USBD_STATUS: USBD_STATUS_SUCCESS (0x00000000)
    URB Function: URB_FUNCTION_CONTROL_TRANSFER (0x0008)
    IRP information: 0x00, Direction: FDO -> PDO
        0000 000. = Reserved: 0x00
        .... ...0 = Direction: FDO -> PDO (0x0)
    URB bus id: 1
    Device address: 6
    Endpoint: 0x80, Direction: IN
        1... .... = Direction: IN (1)
        .... 0000 = Endpoint number: 0
    URB transfer type: URB_CONTROL (0x02)
    Packet Data Length: 8
    [Response in: 74]
    Control transfer stage: Setup (0)
    [bInterfaceClass: Unknown (0xffff)]
URB setup
    bmRequestType: 0xc1
    bRequest: 8
    wValue: 0x0000
    wIndex: 0 (0x0000)
    wLength: 4

No.     Time           Source                Destination           Protocol Length Info
     73 0.004529       host                  1.6.0                 USB      36     URB_CONTROL out

Frame 73: 36 bytes on wire (288 bits), 36 bytes captured (288 bits) on interface 0
USB URB
    [Source: host]
    [Destination: 1.6.0]
    USBPcap pseudoheader length: 28
    IRP ID: 0xffff80030765b010
    IRP USBD_STATUS: USBD_STATUS_SUCCESS (0x00000000)
    URB Function: URB_FUNCTION_CONTROL_TRANSFER (0x0008)
    IRP information: 0x00, Direction: FDO -> PDO
        0000 000. = Reserved: 0x00
        .... ...0 = Direction: FDO -> PDO (0x0)
    URB bus id: 1
    Device address: 6
    Endpoint: 0x00, Direction: OUT
        0... .... = Direction: OUT (0)
        .... 0000 = Endpoint number: 0
    URB transfer type: URB_CONTROL (0x02)
    Packet Data Length: 8
    [Response in: 76]
    Control transfer stage: Setup (0)
    [bInterfaceClass: Unknown (0xffff)]
URB setup
    bmRequestType: 0x41
    bRequest: 3
    wValue: 0x0800
    wIndex: 0 (0x0000)
    wLength: 0

No.     Time           Source                Destination           Protocol Length Info
     74 0.004637       1.6.0                 host                  USB      29     URB_CONTROL in

Frame 74: 29 bytes on wire (232 bits), 29 bytes captured (232 bits) on interface 0
USB URB
    [Source: 1.6.0]
    [Destination: host]
    USBPcap pseudoheader length: 28
    IRP ID: 0xffff800307a97690
    IRP USBD_STATUS: USBD_STATUS_SUCCESS (0x00000000)
    URB Function: URB_FUNCTION_CONTROL_TRANSFER (0x0008)
    IRP information: 0x01, Direction: PDO -> FDO
        0000 000. = Reserved: 0x00
        .... ...1 = Direction: PDO -> FDO (0x1)
    URB bus id: 1
    Device address: 6
    Endpoint: 0x80, Direction: IN
        1... .... = Direction: IN (1)
        .... 0000 = Endpoint number: 0
    URB transfer type: URB_CONTROL (0x02)
    Packet Data Length: 1
    [Request in: 72]
    [Time from request: 0.000118000 seconds]
    Control transfer stage: Data (1)
    [bInterfaceClass: Unknown (0xffff)]
CONTROL response data: 00

No.     Time           Source                Destination           Protocol Length Info
     75 0.004637       1.6.0                 host                  USB      28     GET CONFIGURATION Status

Frame 75: 28 bytes on wire (224 bits), 28 bytes captured (224 bits) on interface 0
USB URB
    [Source: 1.6.0]
    [Destination: host]
    USBPcap pseudoheader length: 28
    IRP ID: 0xffff800307a97690
    IRP USBD_STATUS: USBD_STATUS_SUCCESS (0x00000000)
    URB Function: URB_FUNCTION_CONTROL_TRANSFER (0x0008)
    IRP information: 0x01, Direction: PDO -> FDO
        0000 000. = Reserved: 0x00
        .... ...1 = Direction: PDO -> FDO (0x1)
    URB bus id: 1
    Device address: 6
    Endpoint: 0x80, Direction: IN
        1... .... = Direction: IN (1)
        .... 0000 = Endpoint number: 0
    URB transfer type: URB_CONTROL (0x02)
    Packet Data Length: 0
    [Request in: 72]
    [Time from request: 0.000118000 seconds]
    Control transfer stage: Status (2)

No.     Time           Source                Destination           Protocol Length Info
     76 0.004768       1.6.0                 host                  USB      28     SET FEATURE Status

Frame 76: 28 bytes on wire (224 bits), 28 bytes captured (224 bits) on interface 0
USB URB
    [Source: 1.6.0]
    [Destination: host]
    USBPcap pseudoheader length: 28
    IRP ID: 0xffff80030765b010
    IRP USBD_STATUS: USBD_STATUS_SUCCESS (0x00000000)
    URB Function: URB_FUNCTION_CONTROL_TRANSFER (0x0008)
    IRP information: 0x01, Direction: PDO -> FDO
        0000 000. = Reserved: 0x00
        .... ...1 = Direction: PDO -> FDO (0x1)
    URB bus id: 1
    Device address: 6
    Endpoint: 0x00, Direction: OUT
        0... .... = Direction: OUT (0)
        .... 0000 = Endpoint number: 0
    URB transfer type: URB_CONTROL (0x02)
    Packet Data Length: 0
    [Request in: 73]
    [Time from request: 0.000239000 seconds]
    Control transfer stage: Status (2)

No.     Time           Source                Destination           Protocol Length Info
     77 0.004778       host                  1.6.0                 USB      36     URB_CONTROL out

Frame 77: 36 bytes on wire (288 bits), 36 bytes captured (288 bits) on interface 0
USB URB
    [Source: host]
    [Destination: 1.6.0]
    USBPcap pseudoheader length: 28
    IRP ID: 0xffff80030765b010
    IRP USBD_STATUS: USBD_STATUS_SUCCESS (0x00000000)
    URB Function: URB_FUNCTION_CONTROL_TRANSFER (0x0008)
    IRP information: 0x00, Direction: FDO -> PDO
        0000 000. = Reserved: 0x00
        .... ...0 = Direction: FDO -> PDO (0x0)
    URB bus id: 1
    Device address: 6
    Endpoint: 0x00, Direction: OUT
        0... .... = Direction: OUT (0)
        .... 0000 = Endpoint number: 0
    URB transfer type: URB_CONTROL (0x02)
    Packet Data Length: 8
    [Response in: 78]
    Control transfer stage: Setup (0)
    [bInterfaceClass: Unknown (0xffff)]
URB setup
    bmRequestType: 0x41
    bRequest: 25
    wValue: 0x0000
    wIndex: 0 (0x0000)
    wLength: 6

No.     Time           Source                Destination           Protocol Length Info
     78 0.004910       1.6.0                 host                  USB      34     URB_CONTROL out

Frame 78: 34 bytes on wire (272 bits), 34 bytes captured (272 bits) on interface 0
USB URB
    [Source: 1.6.0]
    [Destination: host]
    USBPcap pseudoheader length: 28
    IRP ID: 0xffff80030765b010
    IRP USBD_STATUS: USBD_STATUS_SUCCESS (0x00000000)
    URB Function: URB_FUNCTION_CONTROL_TRANSFER (0x0008)
    IRP information: 0x01, Direction: PDO -> FDO
        0000 000. = Reserved: 0x00
        .... ...1 = Direction: PDO -> FDO (0x1)
    URB bus id: 1
    Device address: 6
    Endpoint: 0x00, Direction: OUT
        0... .... = Direction: OUT (0)
        .... 0000 = Endpoint number: 0
    URB transfer type: URB_CONTROL (0x02)
    Packet Data Length: 6
    [Request in: 77]
    [Time from request: 0.000132000 seconds]
    Control transfer stage: Data (1)
    [bInterfaceClass: Unknown (0xffff)]
CONTROL response data: 000000001113

No.     Time           Source                Destination           Protocol Length Info
     79 0.004910       1.6.0                 host                  USB      28     Unknown type 19 Status

Frame 79: 28 bytes on wire (224 bits), 28 bytes captured (224 bits) on interface 0
USB URB
    [Source: 1.6.0]
    [Destination: host]
    USBPcap pseudoheader length: 28
    IRP ID: 0xffff80030765b010
    IRP USBD_STATUS: USBD_STATUS_SUCCESS (0x00000000)
    URB Function: URB_FUNCTION_CONTROL_TRANSFER (0x0008)
    IRP information: 0x01, Direction: PDO -> FDO
        0000 000. = Reserved: 0x00
        .... ...1 = Direction: PDO -> FDO (0x1)
    URB bus id: 1
    Device address: 6
    Endpoint: 0x00, Direction: OUT
        0... .... = Direction: OUT (0)
        .... 0000 = Endpoint number: 0
    URB transfer type: URB_CONTROL (0x02)
    Packet Data Length: 0
    [Request in: 77]
    [Time from request: 0.000132000 seconds]
    Control transfer stage: Status (2)

No.     Time           Source                Destination           Protocol Length Info
     80 0.004919       host                  1.6.0                 USB      36     URB_CONTROL out

Frame 80: 36 bytes on wire (288 bits), 36 bytes captured (288 bits) on interface 0
USB URB
    [Source: host]
    [Destination: 1.6.0]
    USBPcap pseudoheader length: 28
    IRP ID: 0xffff80030765b010
    IRP USBD_STATUS: USBD_STATUS_SUCCESS (0x00000000)
    URB Function: URB_FUNCTION_CONTROL_TRANSFER (0x0008)
    IRP information: 0x00, Direction: FDO -> PDO
        0000 000. = Reserved: 0x00
        .... ...0 = Direction: FDO -> PDO (0x0)
    URB bus id: 1
    Device address: 6
    Endpoint: 0x00, Direction: OUT
        0... .... = Direction: OUT (0)
        .... 0000 = Endpoint number: 0
    URB transfer type: URB_CONTROL (0x02)
    Packet Data Length: 8
    [Response in: 81]
    Control transfer stage: Setup (0)
    [bInterfaceClass: Unknown (0xffff)]
URB setup
    bmRequestType: 0x41
    bRequest: 19
    wValue: 0x0000
    wIndex: 0 (0x0000)
    wLength: 16

No.     Time           Source                Destination           Protocol Length Info
     81 0.005064       1.6.0                 host                  USB      44     URB_CONTROL out

Frame 81: 44 bytes on wire (352 bits), 44 bytes captured (352 bits) on interface 0
USB URB
    [Source: 1.6.0]
    [Destination: host]
    USBPcap pseudoheader length: 28
    IRP ID: 0xffff80030765b010
    IRP USBD_STATUS: USBD_STATUS_SUCCESS (0x00000000)
    URB Function: URB_FUNCTION_CONTROL_TRANSFER (0x0008)
    IRP information: 0x01, Direction: PDO -> FDO
        0000 000. = Reserved: 0x00
        .... ...1 = Direction: PDO -> FDO (0x1)
    URB bus id: 1
    Device address: 6
    Endpoint: 0x00, Direction: OUT
        0... .... = Direction: OUT (0)
        .... 0000 = Endpoint number: 0
    URB transfer type: URB_CONTROL (0x02)
    Packet Data Length: 16
    [Request in: 80]
    [Time from request: 0.000145000 seconds]
    Control transfer stage: Data (1)
    [bInterfaceClass: Unknown (0xffff)]
CONTROL response data: 00000000000000003200000034000000

No.     Time           Source                Destination           Protocol Length Info
     82 0.005064       1.6.0                 host                  USB      28     Unknown type 13 Status

Frame 82: 28 bytes on wire (224 bits), 28 bytes captured (224 bits) on interface 0
USB URB
    [Source: 1.6.0]
    [Destination: host]
    USBPcap pseudoheader length: 28
    IRP ID: 0xffff80030765b010
    IRP USBD_STATUS: USBD_STATUS_SUCCESS (0x00000000)
    URB Function: URB_FUNCTION_CONTROL_TRANSFER (0x0008)
    IRP information: 0x01, Direction: PDO -> FDO
        0000 000. = Reserved: 0x00
        .... ...1 = Direction: PDO -> FDO (0x1)
    URB bus id: 1
    Device address: 6
    Endpoint: 0x00, Direction: OUT
        0... .... = Direction: OUT (0)
        .... 0000 = Endpoint number: 0
    URB transfer type: URB_CONTROL (0x02)
    Packet Data Length: 0
    [Request in: 80]
    [Time from request: 0.000145000 seconds]
    Control transfer stage: Status (2)

No.     Time           Source                Destination           Protocol Length Info
     83 0.005113       host                  1.6.0                 USB      36     URB_CONTROL out

Frame 83: 36 bytes on wire (288 bits), 36 bytes captured (288 bits) on interface 0
USB URB
    [Source: host]
    [Destination: 1.6.0]
    USBPcap pseudoheader length: 28
    IRP ID: 0xffff80030765b010
    IRP USBD_STATUS: USBD_STATUS_SUCCESS (0x00000000)
    URB Function: URB_FUNCTION_CONTROL_TRANSFER (0x0008)
    IRP information: 0x00, Direction: FDO -> PDO
        0000 000. = Reserved: 0x00
        .... ...0 = Direction: FDO -> PDO (0x0)
    URB bus id: 1
    Device address: 6
    Endpoint: 0x00, Direction: OUT
        0... .... = Direction: OUT (0)
        .... 0000 = Endpoint number: 0
    URB transfer type: URB_CONTROL (0x02)
    Packet Data Length: 8
    [Response in: 84]
    Control transfer stage: Setup (0)
    [bInterfaceClass: Unknown (0xffff)]
URB setup
    bmRequestType: 0x41
    bRequest: 30
    wValue: 0x0000
    wIndex: 0 (0x0000)
    wLength: 4

No.     Time           Source                Destination           Protocol Length Info
     84 0.005337       1.6.0                 host                  USB      32     URB_CONTROL out

Frame 84: 32 bytes on wire (256 bits), 32 bytes captured (256 bits) on interface 0
USB URB
    [Source: 1.6.0]
    [Destination: host]
    USBPcap pseudoheader length: 28
    IRP ID: 0xffff80030765b010
    IRP USBD_STATUS: USBD_STATUS_SUCCESS (0x00000000)
    URB Function: URB_FUNCTION_CONTROL_TRANSFER (0x0008)
    IRP information: 0x01, Direction: PDO -> FDO
        0000 000. = Reserved: 0x00
        .... ...1 = Direction: PDO -> FDO (0x1)
    URB bus id: 1
    Device address: 6
    Endpoint: 0x00, Direction: OUT
        0... .... = Direction: OUT (0)
        .... 0000 = Endpoint number: 0
    URB transfer type: URB_CONTROL (0x02)
    Packet Data Length: 4
    [Request in: 83]
    [Time from request: 0.000224000 seconds]
    Control transfer stage: Data (1)
    [bInterfaceClass: Unknown (0xffff)]
CONTROL response data: 00e10000

No.     Time           Source                Destination           Protocol Length Info
     85 0.005337       1.6.0                 host                  USB      28     Unknown type 1e Status

Frame 85: 28 bytes on wire (224 bits), 28 bytes captured (224 bits) on interface 0
USB URB
    [Source: 1.6.0]
    [Destination: host]
    USBPcap pseudoheader length: 28
    IRP ID: 0xffff80030765b010
    IRP USBD_STATUS: USBD_STATUS_SUCCESS (0x00000000)
    URB Function: URB_FUNCTION_CONTROL_TRANSFER (0x0008)
    IRP information: 0x01, Direction: PDO -> FDO
        0000 000. = Reserved: 0x00
        .... ...1 = Direction: PDO -> FDO (0x1)
    URB bus id: 1
    Device address: 6
    Endpoint: 0x00, Direction: OUT
        0... .... = Direction: OUT (0)
        .... 0000 = Endpoint number: 0
    URB transfer type: URB_CONTROL (0x02)
    Packet Data Length: 0
    [Request in: 83]
    [Time from request: 0.000224000 seconds]
    Control transfer stage: Status (2)

No.     Time           Source                Destination           Protocol Length Info
     86 0.005347       host                  1.6.0                 USB      36     URB_CONTROL out

Frame 86: 36 bytes on wire (288 bits), 36 bytes captured (288 bits) on interface 0
USB URB
    [Source: host]
    [Destination: 1.6.0]
    USBPcap pseudoheader length: 28
    IRP ID: 0xffff80030765b010
    IRP USBD_STATUS: USBD_STATUS_SUCCESS (0x00000000)
    URB Function: URB_FUNCTION_CONTROL_TRANSFER (0x0008)
    IRP information: 0x00, Direction: FDO -> PDO
        0000 000. = Reserved: 0x00
        .... ...0 = Direction: FDO -> PDO (0x0)
    URB bus id: 1
    Device address: 6
    Endpoint: 0x00, Direction: OUT
        0... .... = Direction: OUT (0)
        .... 0000 = Endpoint number: 0
    URB transfer type: URB_CONTROL (0x02)
    Packet Data Length: 8
    [Response in: 87]
    Control transfer stage: Setup (0)
    [bInterfaceClass: Unknown (0xffff)]
URB setup
    bmRequestType: 0x41
    bRequest: 7
    wValue: 0x0200
    wIndex: 0 (0x0000)
    wLength: 0

No.     Time           Source                Destination           Protocol Length Info
     87 0.005387       1.6.0                 host                  USB      28     SET DESCRIPTOR Status

Frame 87: 28 bytes on wire (224 bits), 28 bytes captured (224 bits) on interface 0
USB URB
    [Source: 1.6.0]
    [Destination: host]
    USBPcap pseudoheader length: 28
    IRP ID: 0xffff80030765b010
    IRP USBD_STATUS: USBD_STATUS_SUCCESS (0x00000000)
    URB Function: URB_FUNCTION_CONTROL_TRANSFER (0x0008)
    IRP information: 0x01, Direction: PDO -> FDO
        0000 000. = Reserved: 0x00
        .... ...1 = Direction: PDO -> FDO (0x1)
    URB bus id: 1
    Device address: 6
    Endpoint: 0x00, Direction: OUT
        0... .... = Direction: OUT (0)
        .... 0000 = Endpoint number: 0
    URB transfer type: URB_CONTROL (0x02)
    Packet Data Length: 0
    [Request in: 86]
    [Time from request: 0.000040000 seconds]
    Control transfer stage: Status (2)

No.     Time           Source                Destination           Protocol Length Info
     88 0.005393       host                  1.6.0                 USB      36     URB_CONTROL in

Frame 88: 36 bytes on wire (288 bits), 36 bytes captured (288 bits) on interface 0
USB URB
    [Source: host]
    [Destination: 1.6.0]
    USBPcap pseudoheader length: 28
    IRP ID: 0xffff800307a97690
    IRP USBD_STATUS: USBD_STATUS_SUCCESS (0x00000000)
    URB Function: URB_FUNCTION_CONTROL_TRANSFER (0x0008)
    IRP information: 0x00, Direction: FDO -> PDO
        0000 000. = Reserved: 0x00
        .... ...0 = Direction: FDO -> PDO (0x0)
    URB bus id: 1
    Device address: 6
    Endpoint: 0x80, Direction: IN
        1... .... = Direction: IN (1)
        .... 0000 = Endpoint number: 0
    URB transfer type: URB_CONTROL (0x02)
    Packet Data Length: 8
    [Response in: 90]
    Control transfer stage: Setup (0)
    [bInterfaceClass: Unknown (0xffff)]
URB setup
    bmRequestType: 0xc1
    bRequest: 8
    wValue: 0x0000
    wIndex: 0 (0x0000)
    wLength: 4

No.     Time           Source                Destination           Protocol Length Info
     89 0.005398       host                  1.6.0                 USB      36     URB_CONTROL out

Frame 89: 36 bytes on wire (288 bits), 36 bytes captured (288 bits) on interface 0
USB URB
    [Source: host]
    [Destination: 1.6.0]
    USBPcap pseudoheader length: 28
    IRP ID: 0xffff80030765b010
    IRP USBD_STATUS: USBD_STATUS_SUCCESS (0x00000000)
    URB Function: URB_FUNCTION_CONTROL_TRANSFER (0x0008)
    IRP information: 0x00, Direction: FDO -> PDO
        0000 000. = Reserved: 0x00
        .... ...0 = Direction: FDO -> PDO (0x0)
    URB bus id: 1
    Device address: 6
    Endpoint: 0x00, Direction: OUT
        0... .... = Direction: OUT (0)
        .... 0000 = Endpoint number: 0
    URB transfer type: URB_CONTROL (0x02)
    Packet Data Length: 8
    [Response in: 92]
    Control transfer stage: Setup (0)
    [bInterfaceClass: Unknown (0xffff)]
URB setup
    bmRequestType: 0x41
    bRequest: 7
    wValue: 0x0100
    wIndex: 0 (0x0000)
    wLength: 0

No.     Time           Source                Destination           Protocol Length Info
     90 0.005506       1.6.0                 host                  USB      29     URB_CONTROL in

Frame 90: 29 bytes on wire (232 bits), 29 bytes captured (232 bits) on interface 0
USB URB
    [Source: 1.6.0]
    [Destination: host]
    USBPcap pseudoheader length: 28
    IRP ID: 0xffff800307a97690
    IRP USBD_STATUS: USBD_STATUS_SUCCESS (0x00000000)
    URB Function: URB_FUNCTION_CONTROL_TRANSFER (0x0008)
    IRP information: 0x01, Direction: PDO -> FDO
        0000 000. = Reserved: 0x00
        .... ...1 = Direction: PDO -> FDO (0x1)
    URB bus id: 1
    Device address: 6
    Endpoint: 0x80, Direction: IN
        1... .... = Direction: IN (1)
        .... 0000 = Endpoint number: 0
    URB transfer type: URB_CONTROL (0x02)
    Packet Data Length: 1
    [Request in: 88]
    [Time from request: 0.000113000 seconds]
    Control transfer stage: Data (1)
    [bInterfaceClass: Unknown (0xffff)]
CONTROL response data: 00

No.     Time           Source                Destination           Protocol Length Info
     91 0.005506       1.6.0                 host                  USB      28     GET CONFIGURATION Status

Frame 91: 28 bytes on wire (224 bits), 28 bytes captured (224 bits) on interface 0
USB URB
    [Source: 1.6.0]
    [Destination: host]
    USBPcap pseudoheader length: 28
    IRP ID: 0xffff800307a97690
    IRP USBD_STATUS: USBD_STATUS_SUCCESS (0x00000000)
    URB Function: URB_FUNCTION_CONTROL_TRANSFER (0x0008)
    IRP information: 0x01, Direction: PDO -> FDO
        0000 000. = Reserved: 0x00
        .... ...1 = Direction: PDO -> FDO (0x1)
    URB bus id: 1
    Device address: 6
    Endpoint: 0x80, Direction: IN
        1... .... = Direction: IN (1)
        .... 0000 = Endpoint number: 0
    URB transfer type: URB_CONTROL (0x02)
    Packet Data Length: 0
    [Request in: 88]
    [Time from request: 0.000113000 seconds]
    Control transfer stage: Status (2)

No.     Time           Source                Destination           Protocol Length Info
     92 0.005556       1.6.0                 host                  USB      28     SET DESCRIPTOR Status

Frame 92: 28 bytes on wire (224 bits), 28 bytes captured (224 bits) on interface 0
USB URB
    [Source: 1.6.0]
    [Destination: host]
    USBPcap pseudoheader length: 28
    IRP ID: 0xffff80030765b010
    IRP USBD_STATUS: USBD_STATUS_SUCCESS (0x00000000)
    URB Function: URB_FUNCTION_CONTROL_TRANSFER (0x0008)
    IRP information: 0x01, Direction: PDO -> FDO
        0000 000. = Reserved: 0x00
        .... ...1 = Direction: PDO -> FDO (0x1)
    URB bus id: 1
    Device address: 6
    Endpoint: 0x00, Direction: OUT
        0... .... = Direction: OUT (0)
        .... 0000 = Endpoint number: 0
    URB transfer type: URB_CONTROL (0x02)
    Packet Data Length: 0
    [Request in: 89]
    [Time from request: 0.000158000 seconds]
    Control transfer stage: Status (2)

No.     Time           Source                Destination           Protocol Length Info
     93 0.005562       host                  1.6.0                 USB      36     URB_CONTROL in

Frame 93: 36 bytes on wire (288 bits), 36 bytes captured (288 bits) on interface 0
USB URB
    [Source: host]
    [Destination: 1.6.0]
    USBPcap pseudoheader length: 28
    IRP ID: 0xffff800307a97690
    IRP USBD_STATUS: USBD_STATUS_SUCCESS (0x00000000)
    URB Function: URB_FUNCTION_CONTROL_TRANSFER (0x0008)
    IRP information: 0x00, Direction: FDO -> PDO
        0000 000. = Reserved: 0x00
        .... ...0 = Direction: FDO -> PDO (0x0)
    URB bus id: 1
    Device address: 6
    Endpoint: 0x80, Direction: IN
        1... .... = Direction: IN (1)
        .... 0000 = Endpoint number: 0
    URB transfer type: URB_CONTROL (0x02)
    Packet Data Length: 8
    [Response in: 95]
    Control transfer stage: Setup (0)
    [bInterfaceClass: Unknown (0xffff)]
URB setup
    bmRequestType: 0xc1
    bRequest: 8
    wValue: 0x0000
    wIndex: 0 (0x0000)
    wLength: 4

No.     Time           Source                Destination           Protocol Length Info
     94 0.005569       host                  1.6.0                 USB      36     URB_CONTROL out

Frame 94: 36 bytes on wire (288 bits), 36 bytes captured (288 bits) on interface 0
USB URB
    [Source: host]
    [Destination: 1.6.0]
    USBPcap pseudoheader length: 28
    IRP ID: 0xffff800307b3f010
    IRP USBD_STATUS: USBD_STATUS_SUCCESS (0x00000000)
    URB Function: URB_FUNCTION_CONTROL_TRANSFER (0x0008)
    IRP information: 0x00, Direction: FDO -> PDO
        0000 000. = Reserved: 0x00
        .... ...0 = Direction: FDO -> PDO (0x0)
    URB bus id: 1
    Device address: 6
    Endpoint: 0x00, Direction: OUT
        0... .... = Direction: OUT (0)
        .... 0000 = Endpoint number: 0
    URB transfer type: URB_CONTROL (0x02)
    Packet Data Length: 8
    [Response in: 97]
    Control transfer stage: Setup (0)
    [bInterfaceClass: Unknown (0xffff)]
URB setup
    bmRequestType: 0x41
    bRequest: 3
    wValue: 0x0800
    wIndex: 0 (0x0000)
    wLength: 0

No.     Time           Source                Destination           Protocol Length Info
     95 0.005682       1.6.0                 host                  USB      29     URB_CONTROL in

Frame 95: 29 bytes on wire (232 bits), 29 bytes captured (232 bits) on interface 0
USB URB
    [Source: 1.6.0]
    [Destination: host]
    USBPcap pseudoheader length: 28
    IRP ID: 0xffff800307a97690
    IRP USBD_STATUS: USBD_STATUS_SUCCESS (0x00000000)
    URB Function: URB_FUNCTION_CONTROL_TRANSFER (0x0008)
    IRP information: 0x01, Direction: PDO -> FDO
        0000 000. = Reserved: 0x00
        .... ...1 = Direction: PDO -> FDO (0x1)
    URB bus id: 1
    Device address: 6
    Endpoint: 0x80, Direction: IN
        1... .... = Direction: IN (1)
        .... 0000 = Endpoint number: 0
    URB transfer type: URB_CONTROL (0x02)
    Packet Data Length: 1
    [Request in: 93]
    [Time from request: 0.000120000 seconds]
    Control transfer stage: Data (1)
    [bInterfaceClass: Unknown (0xffff)]
CONTROL response data: 00

No.     Time           Source                Destination           Protocol Length Info
     96 0.005682       1.6.0                 host                  USB      28     GET CONFIGURATION Status

Frame 96: 28 bytes on wire (224 bits), 28 bytes captured (224 bits) on interface 0
USB URB
    [Source: 1.6.0]
    [Destination: host]
    USBPcap pseudoheader length: 28
    IRP ID: 0xffff800307a97690
    IRP USBD_STATUS: USBD_STATUS_SUCCESS (0x00000000)
    URB Function: URB_FUNCTION_CONTROL_TRANSFER (0x0008)
    IRP information: 0x01, Direction: PDO -> FDO
        0000 000. = Reserved: 0x00
        .... ...1 = Direction: PDO -> FDO (0x1)
    URB bus id: 1
    Device address: 6
    Endpoint: 0x80, Direction: IN
        1... .... = Direction: IN (1)
        .... 0000 = Endpoint number: 0
    URB transfer type: URB_CONTROL (0x02)
    Packet Data Length: 0
    [Request in: 93]
    [Time from request: 0.000120000 seconds]
    Control transfer stage: Status (2)

No.     Time           Source                Destination           Protocol Length Info
     97 0.005813       1.6.0                 host                  USB      28     SET FEATURE Status

Frame 97: 28 bytes on wire (224 bits), 28 bytes captured (224 bits) on interface 0
USB URB
    [Source: 1.6.0]
    [Destination: host]
    USBPcap pseudoheader length: 28
    IRP ID: 0xffff800307b3f010
    IRP USBD_STATUS: USBD_STATUS_SUCCESS (0x00000000)
    URB Function: URB_FUNCTION_CONTROL_TRANSFER (0x0008)
    IRP information: 0x01, Direction: PDO -> FDO
        0000 000. = Reserved: 0x00
        .... ...1 = Direction: PDO -> FDO (0x1)
    URB bus id: 1
    Device address: 6
    Endpoint: 0x00, Direction: OUT
        0... .... = Direction: OUT (0)
        .... 0000 = Endpoint number: 0
    URB transfer type: URB_CONTROL (0x02)
    Packet Data Length: 0
    [Request in: 94]
    [Time from request: 0.000244000 seconds]
    Control transfer stage: Status (2)

No.     Time           Source                Destination           Protocol Length Info
     98 0.005826       host                  1.6.0                 USB      36     URB_CONTROL out

Frame 98: 36 bytes on wire (288 bits), 36 bytes captured (288 bits) on interface 0
USB URB
    [Source: host]
    [Destination: 1.6.0]
    USBPcap pseudoheader length: 28
    IRP ID: 0xffff80030765b010
    IRP USBD_STATUS: USBD_STATUS_SUCCESS (0x00000000)
    URB Function: URB_FUNCTION_CONTROL_TRANSFER (0x0008)
    IRP information: 0x00, Direction: FDO -> PDO
        0000 000. = Reserved: 0x00
        .... ...0 = Direction: FDO -> PDO (0x0)
    URB bus id: 1
    Device address: 6
    Endpoint: 0x00, Direction: OUT
        0... .... = Direction: OUT (0)
        .... 0000 = Endpoint number: 0
    URB transfer type: URB_CONTROL (0x02)
    Packet Data Length: 8
    [Response in: 99]
    Control transfer stage: Setup (0)
    [bInterfaceClass: Unknown (0xffff)]
URB setup
    bmRequestType: 0x41
    bRequest: 25
    wValue: 0x0000
    wIndex: 0 (0x0000)
    wLength: 6

No.     Time           Source                Destination           Protocol Length Info
     99 0.005955       1.6.0                 host                  USB      34     URB_CONTROL out

Frame 99: 34 bytes on wire (272 bits), 34 bytes captured (272 bits) on interface 0
USB URB
    [Source: 1.6.0]
    [Destination: host]
    USBPcap pseudoheader length: 28
    IRP ID: 0xffff80030765b010
    IRP USBD_STATUS: USBD_STATUS_SUCCESS (0x00000000)
    URB Function: URB_FUNCTION_CONTROL_TRANSFER (0x0008)
    IRP information: 0x01, Direction: PDO -> FDO
        0000 000. = Reserved: 0x00
        .... ...1 = Direction: PDO -> FDO (0x1)
    URB bus id: 1
    Device address: 6
    Endpoint: 0x00, Direction: OUT
        0... .... = Direction: OUT (0)
        .... 0000 = Endpoint number: 0
    URB transfer type: URB_CONTROL (0x02)
    Packet Data Length: 6
    [Request in: 98]
    [Time from request: 0.000129000 seconds]
    Control transfer stage: Data (1)
    [bInterfaceClass: Unknown (0xffff)]
CONTROL response data: 000000001113

No.     Time           Source                Destination           Protocol Length Info
    100 0.005955       1.6.0                 host                  USB      28     Unknown type 19 Status

Frame 100: 28 bytes on wire (224 bits), 28 bytes captured (224 bits) on interface 0
USB URB
    [Source: 1.6.0]
    [Destination: host]
    USBPcap pseudoheader length: 28
    IRP ID: 0xffff80030765b010
    IRP USBD_STATUS: USBD_STATUS_SUCCESS (0x00000000)
    URB Function: URB_FUNCTION_CONTROL_TRANSFER (0x0008)
    IRP information: 0x01, Direction: PDO -> FDO
        0000 000. = Reserved: 0x00
        .... ...1 = Direction: PDO -> FDO (0x1)
    URB bus id: 1
    Device address: 6
    Endpoint: 0x00, Direction: OUT
        0... .... = Direction: OUT (0)
        .... 0000 = Endpoint number: 0
    URB transfer type: URB_CONTROL (0x02)
    Packet Data Length: 0
    [Request in: 98]
    [Time from request: 0.000129000 seconds]
    Control transfer stage: Status (2)

No.     Time           Source                Destination           Protocol Length Info
    101 0.005967       host                  1.6.0                 USB      36     URB_CONTROL out

Frame 101: 36 bytes on wire (288 bits), 36 bytes captured (288 bits) on interface 0
USB URB
    [Source: host]
    [Destination: 1.6.0]
    USBPcap pseudoheader length: 28
    IRP ID: 0xffff800307b3f010
    IRP USBD_STATUS: USBD_STATUS_SUCCESS (0x00000000)
    URB Function: URB_FUNCTION_CONTROL_TRANSFER (0x0008)
    IRP information: 0x00, Direction: FDO -> PDO
        0000 000. = Reserved: 0x00
        .... ...0 = Direction: FDO -> PDO (0x0)
    URB bus id: 1
    Device address: 6
    Endpoint: 0x00, Direction: OUT
        0... .... = Direction: OUT (0)
        .... 0000 = Endpoint number: 0
    URB transfer type: URB_CONTROL (0x02)
    Packet Data Length: 8
    [Response in: 102]
    Control transfer stage: Setup (0)
    [bInterfaceClass: Unknown (0xffff)]
URB setup
    bmRequestType: 0x41
    bRequest: 19
    wValue: 0x0000
    wIndex: 0 (0x0000)
    wLength: 16

No.     Time           Source                Destination           Protocol Length Info
    102 0.006073       1.6.0                 host                  USB      44     URB_CONTROL out

Frame 102: 44 bytes on wire (352 bits), 44 bytes captured (352 bits) on interface 0
USB URB
    [Source: 1.6.0]
    [Destination: host]
    USBPcap pseudoheader length: 28
    IRP ID: 0xffff800307b3f010
    IRP USBD_STATUS: USBD_STATUS_SUCCESS (0x00000000)
    URB Function: URB_FUNCTION_CONTROL_TRANSFER (0x0008)
    IRP information: 0x01, Direction: PDO -> FDO
        0000 000. = Reserved: 0x00
        .... ...1 = Direction: PDO -> FDO (0x1)
    URB bus id: 1
    Device address: 6
    Endpoint: 0x00, Direction: OUT
        0... .... = Direction: OUT (0)
        .... 0000 = Endpoint number: 0
    URB transfer type: URB_CONTROL (0x02)
    Packet Data Length: 16
    [Request in: 101]
    [Time from request: 0.000106000 seconds]
    Control transfer stage: Data (1)
    [bInterfaceClass: Unknown (0xffff)]
CONTROL response data: 00000000000000003200000034000000

No.     Time           Source                Destination           Protocol Length Info
    103 0.006073       1.6.0                 host                  USB      28     Unknown type 13 Status

Frame 103: 28 bytes on wire (224 bits), 28 bytes captured (224 bits) on interface 0
USB URB
    [Source: 1.6.0]
    [Destination: host]
    USBPcap pseudoheader length: 28
    IRP ID: 0xffff800307b3f010
    IRP USBD_STATUS: USBD_STATUS_SUCCESS (0x00000000)
    URB Function: URB_FUNCTION_CONTROL_TRANSFER (0x0008)
    IRP information: 0x01, Direction: PDO -> FDO
        0000 000. = Reserved: 0x00
        .... ...1 = Direction: PDO -> FDO (0x1)
    URB bus id: 1
    Device address: 6
    Endpoint: 0x00, Direction: OUT
        0... .... = Direction: OUT (0)
        .... 0000 = Endpoint number: 0
    URB transfer type: URB_CONTROL (0x02)
    Packet Data Length: 0
    [Request in: 101]
    [Time from request: 0.000106000 seconds]
    Control transfer stage: Status (2)

No.     Time           Source                Destination           Protocol Length Info
    104 0.006105       host                  1.6.0                 USB      36     URB_CONTROL out

Frame 104: 36 bytes on wire (288 bits), 36 bytes captured (288 bits) on interface 0
USB URB
    [Source: host]
    [Destination: 1.6.0]
    USBPcap pseudoheader length: 28
    IRP ID: 0xffff800307a97690
    IRP USBD_STATUS: USBD_STATUS_SUCCESS (0x00000000)
    URB Function: URB_FUNCTION_CONTROL_TRANSFER (0x0008)
    IRP information: 0x00, Direction: FDO -> PDO
        0000 000. = Reserved: 0x00
        .... ...0 = Direction: FDO -> PDO (0x0)
    URB bus id: 1
    Device address: 6
    Endpoint: 0x00, Direction: OUT
        0... .... = Direction: OUT (0)
        .... 0000 = Endpoint number: 0
    URB transfer type: URB_CONTROL (0x02)
    Packet Data Length: 8
    [Response in: 105]
    Control transfer stage: Setup (0)
    [bInterfaceClass: Unknown (0xffff)]
URB setup
    bmRequestType: 0x41
    bRequest: 7
    wValue: 0x0101
    wIndex: 0 (0x0000)
    wLength: 0

No.     Time           Source                Destination           Protocol Length Info
    105 0.006171       1.6.0                 host                  USB      28     SET DESCRIPTOR Status

Frame 105: 28 bytes on wire (224 bits), 28 bytes captured (224 bits) on interface 0
USB URB
    [Source: 1.6.0]
    [Destination: host]
    USBPcap pseudoheader length: 28
    IRP ID: 0xffff800307a97690
    IRP USBD_STATUS: USBD_STATUS_SUCCESS (0x00000000)
    URB Function: URB_FUNCTION_CONTROL_TRANSFER (0x0008)
    IRP information: 0x01, Direction: PDO -> FDO
        0000 000. = Reserved: 0x00
        .... ...1 = Direction: PDO -> FDO (0x1)
    URB bus id: 1
    Device address: 6
    Endpoint: 0x00, Direction: OUT
        0... .... = Direction: OUT (0)
        .... 0000 = Endpoint number: 0
    URB transfer type: URB_CONTROL (0x02)
    Packet Data Length: 0
    [Request in: 104]
    [Time from request: 0.000066000 seconds]
    Control transfer stage: Status (2)

No.     Time           Source                Destination           Protocol Length Info
    106 0.006181       host                  1.6.0                 USB      36     URB_CONTROL in

Frame 106: 36 bytes on wire (288 bits), 36 bytes captured (288 bits) on interface 0
USB URB
    [Source: host]
    [Destination: 1.6.0]
    USBPcap pseudoheader length: 28
    IRP ID: 0xffff800307a97690
    IRP USBD_STATUS: USBD_STATUS_SUCCESS (0x00000000)
    URB Function: URB_FUNCTION_CONTROL_TRANSFER (0x0008)
    IRP information: 0x00, Direction: FDO -> PDO
        0000 000. = Reserved: 0x00
        .... ...0 = Direction: FDO -> PDO (0x0)
    URB bus id: 1
    Device address: 6
    Endpoint: 0x80, Direction: IN
        1... .... = Direction: IN (1)
        .... 0000 = Endpoint number: 0
    URB transfer type: URB_CONTROL (0x02)
    Packet Data Length: 8
    [Response in: 108]
    Control transfer stage: Setup (0)
    [bInterfaceClass: Unknown (0xffff)]
URB setup
    bmRequestType: 0xc1
    bRequest: 8
    wValue: 0x0000
    wIndex: 0 (0x0000)
    wLength: 4

No.     Time           Source                Destination           Protocol Length Info
    107 0.006188       host                  1.6.0                 USB      36     URB_CONTROL out

Frame 107: 36 bytes on wire (288 bits), 36 bytes captured (288 bits) on interface 0
USB URB
    [Source: host]
    [Destination: 1.6.0]
    USBPcap pseudoheader length: 28
    IRP ID: 0xffff800307b3f010
    IRP USBD_STATUS: USBD_STATUS_SUCCESS (0x00000000)
    URB Function: URB_FUNCTION_CONTROL_TRANSFER (0x0008)
    IRP information: 0x00, Direction: FDO -> PDO
        0000 000. = Reserved: 0x00
        .... ...0 = Direction: FDO -> PDO (0x0)
    URB bus id: 1
    Device address: 6
    Endpoint: 0x00, Direction: OUT
        0... .... = Direction: OUT (0)
        .... 0000 = Endpoint number: 0
    URB transfer type: URB_CONTROL (0x02)
    Packet Data Length: 8
    [Response in: 110]
    Control transfer stage: Setup (0)
    [bInterfaceClass: Unknown (0xffff)]
URB setup
    bmRequestType: 0x41
    bRequest: 7
    wValue: 0x0202
    wIndex: 0 (0x0000)
    wLength: 0

No.     Time           Source                Destination           Protocol Length Info
    108 0.006301       1.6.0                 host                  USB      29     URB_CONTROL in

Frame 108: 29 bytes on wire (232 bits), 29 bytes captured (232 bits) on interface 0
USB URB
    [Source: 1.6.0]
    [Destination: host]
    USBPcap pseudoheader length: 28
    IRP ID: 0xffff800307a97690
    IRP USBD_STATUS: USBD_STATUS_SUCCESS (0x00000000)
    URB Function: URB_FUNCTION_CONTROL_TRANSFER (0x0008)
    IRP information: 0x01, Direction: PDO -> FDO
        0000 000. = Reserved: 0x00
        .... ...1 = Direction: PDO -> FDO (0x1)
    URB bus id: 1
    Device address: 6
    Endpoint: 0x80, Direction: IN
        1... .... = Direction: IN (1)
        .... 0000 = Endpoint number: 0
    URB transfer type: URB_CONTROL (0x02)
    Packet Data Length: 1
    [Request in: 106]
    [Time from request: 0.000120000 seconds]
    Control transfer stage: Data (1)
    [bInterfaceClass: Unknown (0xffff)]
CONTROL response data: 01

No.     Time           Source                Destination           Protocol Length Info
    109 0.006301       1.6.0                 host                  USB      28     GET CONFIGURATION Status

Frame 109: 28 bytes on wire (224 bits), 28 bytes captured (224 bits) on interface 0
USB URB
    [Source: 1.6.0]
    [Destination: host]
    USBPcap pseudoheader length: 28
    IRP ID: 0xffff800307a97690
    IRP USBD_STATUS: USBD_STATUS_SUCCESS (0x00000000)
    URB Function: URB_FUNCTION_CONTROL_TRANSFER (0x0008)
    IRP information: 0x01, Direction: PDO -> FDO
        0000 000. = Reserved: 0x00
        .... ...1 = Direction: PDO -> FDO (0x1)
    URB bus id: 1
    Device address: 6
    Endpoint: 0x80, Direction: IN
        1... .... = Direction: IN (1)
        .... 0000 = Endpoint number: 0
    URB transfer type: URB_CONTROL (0x02)
    Packet Data Length: 0
    [Request in: 106]
    [Time from request: 0.000120000 seconds]
    Control transfer stage: Status (2)

No.     Time           Source                Destination           Protocol Length Info
    110 0.006393       1.6.0                 host                  USB      28     SET DESCRIPTOR Status

Frame 110: 28 bytes on wire (224 bits), 28 bytes captured (224 bits) on interface 0
USB URB
    [Source: 1.6.0]
    [Destination: host]
    USBPcap pseudoheader length: 28
    IRP ID: 0xffff800307b3f010
    IRP USBD_STATUS: USBD_STATUS_SUCCESS (0x00000000)
    URB Function: URB_FUNCTION_CONTROL_TRANSFER (0x0008)
    IRP information: 0x01, Direction: PDO -> FDO
        0000 000. = Reserved: 0x00
        .... ...1 = Direction: PDO -> FDO (0x1)
    URB bus id: 1
    Device address: 6
    Endpoint: 0x00, Direction: OUT
        0... .... = Direction: OUT (0)
        .... 0000 = Endpoint number: 0
    URB transfer type: URB_CONTROL (0x02)
    Packet Data Length: 0
    [Request in: 107]
    [Time from request: 0.000205000 seconds]
    Control transfer stage: Status (2)

No.     Time           Source                Destination           Protocol Length Info
    111 0.006401       host                  1.6.0                 USB      36     URB_CONTROL in

Frame 111: 36 bytes on wire (288 bits), 36 bytes captured (288 bits) on interface 0
USB URB
    [Source: host]
    [Destination: 1.6.0]
    USBPcap pseudoheader length: 28
    IRP ID: 0xffff800307a97690
    IRP USBD_STATUS: USBD_STATUS_SUCCESS (0x00000000)
    URB Function: URB_FUNCTION_CONTROL_TRANSFER (0x0008)
    IRP information: 0x00, Direction: FDO -> PDO
        0000 000. = Reserved: 0x00
        .... ...0 = Direction: FDO -> PDO (0x0)
    URB bus id: 1
    Device address: 6
    Endpoint: 0x80, Direction: IN
        1... .... = Direction: IN (1)
        .... 0000 = Endpoint number: 0
    URB transfer type: URB_CONTROL (0x02)
    Packet Data Length: 8
    [Response in: 112]
    Control transfer stage: Setup (0)
    [bInterfaceClass: Unknown (0xffff)]
URB setup
    bmRequestType: 0xc1
    bRequest: 8
    wValue: 0x0000
    wIndex: 0 (0x0000)
    wLength: 4

No.     Time           Source                Destination           Protocol Length Info
    112 0.006521       1.6.0                 host                  USB      29     URB_CONTROL in

Frame 112: 29 bytes on wire (232 bits), 29 bytes captured (232 bits) on interface 0
USB URB
    [Source: 1.6.0]
    [Destination: host]
    USBPcap pseudoheader length: 28
    IRP ID: 0xffff800307a97690
    IRP USBD_STATUS: USBD_STATUS_SUCCESS (0x00000000)
    URB Function: URB_FUNCTION_CONTROL_TRANSFER (0x0008)
    IRP information: 0x01, Direction: PDO -> FDO
        0000 000. = Reserved: 0x00
        .... ...1 = Direction: PDO -> FDO (0x1)
    URB bus id: 1
    Device address: 6
    Endpoint: 0x80, Direction: IN
        1... .... = Direction: IN (1)
        .... 0000 = Endpoint number: 0
    URB transfer type: URB_CONTROL (0x02)
    Packet Data Length: 1
    [Request in: 111]
    [Time from request: 0.000120000 seconds]
    Control transfer stage: Data (1)
    [bInterfaceClass: Unknown (0xffff)]
CONTROL response data: 03

No.     Time           Source                Destination           Protocol Length Info
    113 0.006547       1.6.0                 host                  USB      28     GET CONFIGURATION Status

Frame 113: 28 bytes on wire (224 bits), 28 bytes captured (224 bits) on interface 0
USB URB
    [Source: 1.6.0]
    [Destination: host]
    USBPcap pseudoheader length: 28
    IRP ID: 0xffff800307a97690
    IRP USBD_STATUS: USBD_STATUS_SUCCESS (0x00000000)
    URB Function: URB_FUNCTION_CONTROL_TRANSFER (0x0008)
    IRP information: 0x01, Direction: PDO -> FDO
        0000 000. = Reserved: 0x00
        .... ...1 = Direction: PDO -> FDO (0x1)
    URB bus id: 1
    Device address: 6
    Endpoint: 0x80, Direction: IN
        1... .... = Direction: IN (1)
        .... 0000 = Endpoint number: 0
    URB transfer type: URB_CONTROL (0x02)
    Packet Data Length: 0
    [Request in: 111]
    [Time from request: 0.000146000 seconds]
    Control transfer stage: Status (2)

No.     Time           Source                Destination           Protocol Length Info
    114 0.080438       host                  1.6.0                 USB      36     URB_CONTROL in

Frame 114: 36 bytes on wire (288 bits), 36 bytes captured (288 bits) on interface 0
USB URB
    [Source: host]
    [Destination: 1.6.0]
    USBPcap pseudoheader length: 28
    IRP ID: 0xffff800307a97690
    IRP USBD_STATUS: USBD_STATUS_SUCCESS (0x00000000)
    URB Function: URB_FUNCTION_CONTROL_TRANSFER (0x0008)
    IRP information: 0x00, Direction: FDO -> PDO
        0000 000. = Reserved: 0x00
        .... ...0 = Direction: FDO -> PDO (0x0)
    URB bus id: 1
    Device address: 6
    Endpoint: 0x80, Direction: IN
        1... .... = Direction: IN (1)
        .... 0000 = Endpoint number: 0
    URB transfer type: URB_CONTROL (0x02)
    Packet Data Length: 8
    [Response in: 115]
    Control transfer stage: Setup (0)
    [bInterfaceClass: Unknown (0xffff)]
URB setup
    bmRequestType: 0xc1
    bRequest: 8
    wValue: 0x0000
    wIndex: 0 (0x0000)
    wLength: 4

No.     Time           Source                Destination           Protocol Length Info
    115 0.080594       1.6.0                 host                  USB      29     URB_CONTROL in

Frame 115: 29 bytes on wire (232 bits), 29 bytes captured (232 bits) on interface 0
USB URB
    [Source: 1.6.0]
    [Destination: host]
    USBPcap pseudoheader length: 28
    IRP ID: 0xffff800307a97690
    IRP USBD_STATUS: USBD_STATUS_SUCCESS (0x00000000)
    URB Function: URB_FUNCTION_CONTROL_TRANSFER (0x0008)
    IRP information: 0x01, Direction: PDO -> FDO
        0000 000. = Reserved: 0x00
        .... ...1 = Direction: PDO -> FDO (0x1)
    URB bus id: 1
    Device address: 6
    Endpoint: 0x80, Direction: IN
        1... .... = Direction: IN (1)
        .... 0000 = Endpoint number: 0
    URB transfer type: URB_CONTROL (0x02)
    Packet Data Length: 1
    [Request in: 114]
    [Time from request: 0.000156000 seconds]
    Control transfer stage: Data (1)
    [bInterfaceClass: Unknown (0xffff)]
CONTROL response data: 03

No.     Time           Source                Destination           Protocol Length Info
    116 0.080618       1.6.0                 host                  USB      28     GET CONFIGURATION Status

Frame 116: 28 bytes on wire (224 bits), 28 bytes captured (224 bits) on interface 0
USB URB
    [Source: 1.6.0]
    [Destination: host]
    USBPcap pseudoheader length: 28
    IRP ID: 0xffff800307a97690
    IRP USBD_STATUS: USBD_STATUS_SUCCESS (0x00000000)
    URB Function: URB_FUNCTION_CONTROL_TRANSFER (0x0008)
    IRP information: 0x01, Direction: PDO -> FDO
        0000 000. = Reserved: 0x00
        .... ...1 = Direction: PDO -> FDO (0x1)
    URB bus id: 1
    Device address: 6
    Endpoint: 0x80, Direction: IN
        1... .... = Direction: IN (1)
        .... 0000 = Endpoint number: 0
    URB transfer type: URB_CONTROL (0x02)
    Packet Data Length: 0
    [Request in: 114]
    [Time from request: 0.000180000 seconds]
    Control transfer stage: Status (2)

No.     Time           Source                Destination           Protocol Length Info
    117 0.160450       host                  1.6.0                 USB      36     URB_CONTROL in

Frame 117: 36 bytes on wire (288 bits), 36 bytes captured (288 bits) on interface 0
USB URB
    [Source: host]
    [Destination: 1.6.0]
    USBPcap pseudoheader length: 28
    IRP ID: 0xffff800307a97690
    IRP USBD_STATUS: USBD_STATUS_SUCCESS (0x00000000)
    URB Function: URB_FUNCTION_CONTROL_TRANSFER (0x0008)
    IRP information: 0x00, Direction: FDO -> PDO
        0000 000. = Reserved: 0x00
        .... ...0 = Direction: FDO -> PDO (0x0)
    URB bus id: 1
    Device address: 6
    Endpoint: 0x80, Direction: IN
        1... .... = Direction: IN (1)
        .... 0000 = Endpoint number: 0
    URB transfer type: URB_CONTROL (0x02)
    Packet Data Length: 8
    [Response in: 118]
    Control transfer stage: Setup (0)
    [bInterfaceClass: Unknown (0xffff)]
URB setup
    bmRequestType: 0xc1
    bRequest: 8
    wValue: 0x0000
    wIndex: 0 (0x0000)
    wLength: 4

No.     Time           Source                Destination           Protocol Length Info
    118 0.160663       1.6.0                 host                  USB      29     URB_CONTROL in

Frame 118: 29 bytes on wire (232 bits), 29 bytes captured (232 bits) on interface 0
USB URB
    [Source: 1.6.0]
    [Destination: host]
    USBPcap pseudoheader length: 28
    IRP ID: 0xffff800307a97690
    IRP USBD_STATUS: USBD_STATUS_SUCCESS (0x00000000)
    URB Function: URB_FUNCTION_CONTROL_TRANSFER (0x0008)
    IRP information: 0x01, Direction: PDO -> FDO
        0000 000. = Reserved: 0x00
        .... ...1 = Direction: PDO -> FDO (0x1)
    URB bus id: 1
    Device address: 6
    Endpoint: 0x80, Direction: IN
        1... .... = Direction: IN (1)
        .... 0000 = Endpoint number: 0
    URB transfer type: URB_CONTROL (0x02)
    Packet Data Length: 1
    [Request in: 117]
    [Time from request: 0.000213000 seconds]
    Control transfer stage: Data (1)
    [bInterfaceClass: Unknown (0xffff)]
CONTROL response data: 03

No.     Time           Source                Destination           Protocol Length Info
    119 0.160663       1.6.0                 host                  USB      28     GET CONFIGURATION Status

Frame 119: 28 bytes on wire (224 bits), 28 bytes captured (224 bits) on interface 0
USB URB
    [Source: 1.6.0]
    [Destination: host]
    USBPcap pseudoheader length: 28
    IRP ID: 0xffff800307a97690
    IRP USBD_STATUS: USBD_STATUS_SUCCESS (0x00000000)
    URB Function: URB_FUNCTION_CONTROL_TRANSFER (0x0008)
    IRP information: 0x01, Direction: PDO -> FDO
        0000 000. = Reserved: 0x00
        .... ...1 = Direction: PDO -> FDO (0x1)
    URB bus id: 1
    Device address: 6
    Endpoint: 0x80, Direction: IN
        1... .... = Direction: IN (1)
        .... 0000 = Endpoint number: 0
    URB transfer type: URB_CONTROL (0x02)
    Packet Data Length: 0
    [Request in: 117]
    [Time from request: 0.000213000 seconds]
    Control transfer stage: Status (2)

No.     Time           Source                Destination           Protocol Length Info
    120 0.204420       host                  1.6.0                 USB      36     URB_CONTROL out

Frame 120: 36 bytes on wire (288 bits), 36 bytes captured (288 bits) on interface 0
USB URB
    [Source: host]
    [Destination: 1.6.0]
    USBPcap pseudoheader length: 28
    IRP ID: 0xffff800307881010
    IRP USBD_STATUS: USBD_STATUS_SUCCESS (0x00000000)
    URB Function: URB_FUNCTION_CONTROL_TRANSFER (0x0008)
    IRP information: 0x00, Direction: FDO -> PDO
        0000 000. = Reserved: 0x00
        .... ...0 = Direction: FDO -> PDO (0x0)
    URB bus id: 1
    Device address: 6
    Endpoint: 0x00, Direction: OUT
        0... .... = Direction: OUT (0)
        .... 0000 = Endpoint number: 0
    URB transfer type: URB_CONTROL (0x02)
    Packet Data Length: 8
    [Response in: 122]
    Control transfer stage: Setup (0)
    [bInterfaceClass: Unknown (0xffff)]
URB setup
    bmRequestType: 0x41
    bRequest: 18
    wValue: 0x0005
    wIndex: 0 (0x0000)
    wLength: 0

No.     Time           Source                Destination           Protocol Length Info
    121 0.204475       host                  1.6.0                 USB      36     URB_CONTROL out

Frame 121: 36 bytes on wire (288 bits), 36 bytes captured (288 bits) on interface 0
USB URB
    [Source: host]
    [Destination: 1.6.0]
    USBPcap pseudoheader length: 28
    IRP ID: 0xffff800307a97690
    IRP USBD_STATUS: USBD_STATUS_SUCCESS (0x00000000)
    URB Function: URB_FUNCTION_CONTROL_TRANSFER (0x0008)
    IRP information: 0x00, Direction: FDO -> PDO
        0000 000. = Reserved: 0x00
        .... ...0 = Direction: FDO -> PDO (0x0)
    URB bus id: 1
    Device address: 6
    Endpoint: 0x00, Direction: OUT
        0... .... = Direction: OUT (0)
        .... 0000 = Endpoint number: 0
    URB transfer type: URB_CONTROL (0x02)
    Packet Data Length: 8
    [Response in: 123]
    Control transfer stage: Setup (0)
    [bInterfaceClass: Unknown (0xffff)]
URB setup
    bmRequestType: 0x41
    bRequest: 18
    wValue: 0x0005
    wIndex: 0 (0x0000)
    wLength: 0

No.     Time           Source                Destination           Protocol Length Info
    122 0.204540       1.6.0                 host                  USB      28     Unknown type 12 Status

Frame 122: 28 bytes on wire (224 bits), 28 bytes captured (224 bits) on interface 0
USB URB
    [Source: 1.6.0]
    [Destination: host]
    USBPcap pseudoheader length: 28
    IRP ID: 0xffff800307881010
    IRP USBD_STATUS: USBD_STATUS_SUCCESS (0x00000000)
    URB Function: URB_FUNCTION_CONTROL_TRANSFER (0x0008)
    IRP information: 0x01, Direction: PDO -> FDO
        0000 000. = Reserved: 0x00
        .... ...1 = Direction: PDO -> FDO (0x1)
    URB bus id: 1
    Device address: 6
    Endpoint: 0x00, Direction: OUT
        0... .... = Direction: OUT (0)
        .... 0000 = Endpoint number: 0
    URB transfer type: URB_CONTROL (0x02)
    Packet Data Length: 0
    [Request in: 120]
    [Time from request: 0.000120000 seconds]
    Control transfer stage: Status (2)

No.     Time           Source                Destination           Protocol Length Info
    123 0.204614       1.6.0                 host                  USB      28     Unknown type 12 Status

Frame 123: 28 bytes on wire (224 bits), 28 bytes captured (224 bits) on interface 0
USB URB
    [Source: 1.6.0]
    [Destination: host]
    USBPcap pseudoheader length: 28
    IRP ID: 0xffff800307a97690
    IRP USBD_STATUS: USBD_STATUS_SUCCESS (0x00000000)
    URB Function: URB_FUNCTION_CONTROL_TRANSFER (0x0008)
    IRP information: 0x01, Direction: PDO -> FDO
        0000 000. = Reserved: 0x00
        .... ...1 = Direction: PDO -> FDO (0x1)
    URB bus id: 1
    Device address: 6
    Endpoint: 0x00, Direction: OUT
        0... .... = Direction: OUT (0)
        .... 0000 = Endpoint number: 0
    URB transfer type: URB_CONTROL (0x02)
    Packet Data Length: 0
    [Request in: 121]
    [Time from request: 0.000139000 seconds]
    Control transfer stage: Status (2)

No.     Time           Source                Destination           Protocol Length Info
    124 0.204917       host                  1.6.0                 USB      36     URB_CONTROL out

Frame 124: 36 bytes on wire (288 bits), 36 bytes captured (288 bits) on interface 0
USB URB
    [Source: host]
    [Destination: 1.6.0]
    USBPcap pseudoheader length: 28
    IRP ID: 0xffff800307881010
    IRP USBD_STATUS: USBD_STATUS_SUCCESS (0x00000000)
    URB Function: URB_FUNCTION_CONTROL_TRANSFER (0x0008)
    IRP information: 0x00, Direction: FDO -> PDO
        0000 000. = Reserved: 0x00
        .... ...0 = Direction: FDO -> PDO (0x0)
    URB bus id: 1
    Device address: 6
    Endpoint: 0x00, Direction: OUT
        0... .... = Direction: OUT (0)
        .... 0000 = Endpoint number: 0
    URB transfer type: URB_CONTROL (0x02)
    Packet Data Length: 8
    [Response in: 125]
    Control transfer stage: Setup (0)
    [bInterfaceClass: Unknown (0xffff)]
URB setup
    bmRequestType: 0x41
    bRequest: 18
    wValue: 0x000a
    wIndex: 0 (0x0000)
    wLength: 0

No.     Time           Source                Destination           Protocol Length Info
    125 0.205010       1.6.0                 host                  USB      28     Unknown type 12 Status

Frame 125: 28 bytes on wire (224 bits), 28 bytes captured (224 bits) on interface 0
USB URB
    [Source: 1.6.0]
    [Destination: host]
    USBPcap pseudoheader length: 28
    IRP ID: 0xffff800307881010
    IRP USBD_STATUS: USBD_STATUS_SUCCESS (0x00000000)
    URB Function: URB_FUNCTION_CONTROL_TRANSFER (0x0008)
    IRP information: 0x01, Direction: PDO -> FDO
        0000 000. = Reserved: 0x00
        .... ...1 = Direction: PDO -> FDO (0x1)
    URB bus id: 1
    Device address: 6
    Endpoint: 0x00, Direction: OUT
        0... .... = Direction: OUT (0)
        .... 0000 = Endpoint number: 0
    URB transfer type: URB_CONTROL (0x02)
    Packet Data Length: 0
    [Request in: 124]
    [Time from request: 0.000093000 seconds]
    Control transfer stage: Status (2)

No.     Time           Source                Destination           Protocol Length Info
    126 0.205055       host                  1.6.0                 USB      36     URB_CONTROL out

Frame 126: 36 bytes on wire (288 bits), 36 bytes captured (288 bits) on interface 0
USB URB
    [Source: host]
    [Destination: 1.6.0]
    USBPcap pseudoheader length: 28
    IRP ID: 0xffff800307a97690
    IRP USBD_STATUS: USBD_STATUS_SUCCESS (0x00000000)
    URB Function: URB_FUNCTION_CONTROL_TRANSFER (0x0008)
    IRP information: 0x00, Direction: FDO -> PDO
        0000 000. = Reserved: 0x00
        .... ...0 = Direction: FDO -> PDO (0x0)
    URB bus id: 1
    Device address: 6
    Endpoint: 0x00, Direction: OUT
        0... .... = Direction: OUT (0)
        .... 0000 = Endpoint number: 0
    URB transfer type: URB_CONTROL (0x02)
    Packet Data Length: 8
    [Response in: 127]
    Control transfer stage: Setup (0)
    [bInterfaceClass: Unknown (0xffff)]
URB setup
    bmRequestType: 0x41
    bRequest: 7
    wValue: 0x0100
    wIndex: 0 (0x0000)
    wLength: 0

No.     Time           Source                Destination           Protocol Length Info
    127 0.205104       1.6.0                 host                  USB      28     SET DESCRIPTOR Status

Frame 127: 28 bytes on wire (224 bits), 28 bytes captured (224 bits) on interface 0
USB URB
    [Source: 1.6.0]
    [Destination: host]
    USBPcap pseudoheader length: 28
    IRP ID: 0xffff800307a97690
    IRP USBD_STATUS: USBD_STATUS_SUCCESS (0x00000000)
    URB Function: URB_FUNCTION_CONTROL_TRANSFER (0x0008)
    IRP information: 0x01, Direction: PDO -> FDO
        0000 000. = Reserved: 0x00
        .... ...1 = Direction: PDO -> FDO (0x1)
    URB bus id: 1
    Device address: 6
    Endpoint: 0x00, Direction: OUT
        0... .... = Direction: OUT (0)
        .... 0000 = Endpoint number: 0
    URB transfer type: URB_CONTROL (0x02)
    Packet Data Length: 0
    [Request in: 126]
    [Time from request: 0.000049000 seconds]
    Control transfer stage: Status (2)

No.     Time           Source                Destination           Protocol Length Info
    128 0.205118       host                  1.6.0                 USB      36     URB_CONTROL in

Frame 128: 36 bytes on wire (288 bits), 36 bytes captured (288 bits) on interface 0
USB URB
    [Source: host]
    [Destination: 1.6.0]
    USBPcap pseudoheader length: 28
    IRP ID: 0xffff800307a97690
    IRP USBD_STATUS: USBD_STATUS_SUCCESS (0x00000000)
    URB Function: URB_FUNCTION_CONTROL_TRANSFER (0x0008)
    IRP information: 0x00, Direction: FDO -> PDO
        0000 000. = Reserved: 0x00
        .... ...0 = Direction: FDO -> PDO (0x0)
    URB bus id: 1
    Device address: 6
    Endpoint: 0x80, Direction: IN
        1... .... = Direction: IN (1)
        .... 0000 = Endpoint number: 0
    URB transfer type: URB_CONTROL (0x02)
    Packet Data Length: 8
    [Response in: 130]
    Control transfer stage: Setup (0)
    [bInterfaceClass: Unknown (0xffff)]
URB setup
    bmRequestType: 0xc1
    bRequest: 8
    wValue: 0x0000
    wIndex: 0 (0x0000)
    wLength: 4

No.     Time           Source                Destination           Protocol Length Info
    129 0.205126       host                  1.6.0                 USB      36     URB_CONTROL out

Frame 129: 36 bytes on wire (288 bits), 36 bytes captured (288 bits) on interface 0
USB URB
    [Source: host]
    [Destination: 1.6.0]
    USBPcap pseudoheader length: 28
    IRP ID: 0xffff800307881010
    IRP USBD_STATUS: USBD_STATUS_SUCCESS (0x00000000)
    URB Function: URB_FUNCTION_CONTROL_TRANSFER (0x0008)
    IRP information: 0x00, Direction: FDO -> PDO
        0000 000. = Reserved: 0x00
        .... ...0 = Direction: FDO -> PDO (0x0)
    URB bus id: 1
    Device address: 6
    Endpoint: 0x00, Direction: OUT
        0... .... = Direction: OUT (0)
        .... 0000 = Endpoint number: 0
    URB transfer type: URB_CONTROL (0x02)
    Packet Data Length: 8
    [Response in: 132]
    Control transfer stage: Setup (0)
    [bInterfaceClass: Unknown (0xffff)]
URB setup
    bmRequestType: 0x41
    bRequest: 7
    wValue: 0x0200
    wIndex: 0 (0x0000)
    wLength: 0

No.     Time           Source                Destination           Protocol Length Info
    130 0.205240       1.6.0                 host                  USB      29     URB_CONTROL in

Frame 130: 29 bytes on wire (232 bits), 29 bytes captured (232 bits) on interface 0
USB URB
    [Source: 1.6.0]
    [Destination: host]
    USBPcap pseudoheader length: 28
    IRP ID: 0xffff800307a97690
    IRP USBD_STATUS: USBD_STATUS_SUCCESS (0x00000000)
    URB Function: URB_FUNCTION_CONTROL_TRANSFER (0x0008)
    IRP information: 0x01, Direction: PDO -> FDO
        0000 000. = Reserved: 0x00
        .... ...1 = Direction: PDO -> FDO (0x1)
    URB bus id: 1
    Device address: 6
    Endpoint: 0x80, Direction: IN
        1... .... = Direction: IN (1)
        .... 0000 = Endpoint number: 0
    URB transfer type: URB_CONTROL (0x02)
    Packet Data Length: 1
    [Request in: 128]
    [Time from request: 0.000122000 seconds]
    Control transfer stage: Data (1)
    [bInterfaceClass: Unknown (0xffff)]
CONTROL response data: 02

No.     Time           Source                Destination           Protocol Length Info
    131 0.205241       1.6.0                 host                  USB      28     GET CONFIGURATION Status

Frame 131: 28 bytes on wire (224 bits), 28 bytes captured (224 bits) on interface 0
USB URB
    [Source: 1.6.0]
    [Destination: host]
    USBPcap pseudoheader length: 28
    IRP ID: 0xffff800307a97690
    IRP USBD_STATUS: USBD_STATUS_SUCCESS (0x00000000)
    URB Function: URB_FUNCTION_CONTROL_TRANSFER (0x0008)
    IRP information: 0x01, Direction: PDO -> FDO
        0000 000. = Reserved: 0x00
        .... ...1 = Direction: PDO -> FDO (0x1)
    URB bus id: 1
    Device address: 6
    Endpoint: 0x80, Direction: IN
        1... .... = Direction: IN (1)
        .... 0000 = Endpoint number: 0
    URB transfer type: URB_CONTROL (0x02)
    Packet Data Length: 0
    [Request in: 128]
    [Time from request: 0.000123000 seconds]
    Control transfer stage: Status (2)

No.     Time           Source                Destination           Protocol Length Info
    132 0.205346       1.6.0                 host                  USB      28     SET DESCRIPTOR Status

Frame 132: 28 bytes on wire (224 bits), 28 bytes captured (224 bits) on interface 0
USB URB
    [Source: 1.6.0]
    [Destination: host]
    USBPcap pseudoheader length: 28
    IRP ID: 0xffff800307881010
    IRP USBD_STATUS: USBD_STATUS_SUCCESS (0x00000000)
    URB Function: URB_FUNCTION_CONTROL_TRANSFER (0x0008)
    IRP information: 0x01, Direction: PDO -> FDO
        0000 000. = Reserved: 0x00
        .... ...1 = Direction: PDO -> FDO (0x1)
    URB bus id: 1
    Device address: 6
    Endpoint: 0x00, Direction: OUT
        0... .... = Direction: OUT (0)
        .... 0000 = Endpoint number: 0
    URB transfer type: URB_CONTROL (0x02)
    Packet Data Length: 0
    [Request in: 129]
    [Time from request: 0.000220000 seconds]
    Control transfer stage: Status (2)

No.     Time           Source                Destination           Protocol Length Info
    133 0.205355       host                  1.6.0                 USB      36     URB_CONTROL in

Frame 133: 36 bytes on wire (288 bits), 36 bytes captured (288 bits) on interface 0
USB URB
    [Source: host]
    [Destination: 1.6.0]
    USBPcap pseudoheader length: 28
    IRP ID: 0xffff80030c18daf0
    IRP USBD_STATUS: USBD_STATUS_SUCCESS (0x00000000)
    URB Function: URB_FUNCTION_CONTROL_TRANSFER (0x0008)
    IRP information: 0x00, Direction: FDO -> PDO
        0000 000. = Reserved: 0x00
        .... ...0 = Direction: FDO -> PDO (0x0)
    URB bus id: 1
    Device address: 6
    Endpoint: 0x80, Direction: IN
        1... .... = Direction: IN (1)
        .... 0000 = Endpoint number: 0
    URB transfer type: URB_CONTROL (0x02)
    Packet Data Length: 8
    [Response in: 135]
    Control transfer stage: Setup (0)
    [bInterfaceClass: Unknown (0xffff)]
URB setup
    bmRequestType: 0xc1
    bRequest: 8
    wValue: 0x0000
    wIndex: 0 (0x0000)
    wLength: 4

No.     Time           Source                Destination           Protocol Length Info
    134 0.205417       host                  1.6.0                 USB      36     URB_CONTROL out

Frame 134: 36 bytes on wire (288 bits), 36 bytes captured (288 bits) on interface 0
USB URB
    [Source: host]
    [Destination: 1.6.0]
    USBPcap pseudoheader length: 28
    IRP ID: 0xffff800307a97690
    IRP USBD_STATUS: USBD_STATUS_SUCCESS (0x00000000)
    URB Function: URB_FUNCTION_CONTROL_TRANSFER (0x0008)
    IRP information: 0x00, Direction: FDO -> PDO
        0000 000. = Reserved: 0x00
        .... ...0 = Direction: FDO -> PDO (0x0)
    URB bus id: 1
    Device address: 6
    Endpoint: 0x00, Direction: OUT
        0... .... = Direction: OUT (0)
        .... 0000 = Endpoint number: 0
    URB transfer type: URB_CONTROL (0x02)
    Packet Data Length: 8
    [Response in: 137]
    Control transfer stage: Setup (0)
    [bInterfaceClass: Unknown (0xffff)]
URB setup
    bmRequestType: 0x41
    bRequest: 30
    wValue: 0x0000
    wIndex: 0 (0x0000)
    wLength: 4

No.     Time           Source                Destination           Protocol Length Info
    135 0.205485       1.6.0                 host                  USB      29     URB_CONTROL in

Frame 135: 29 bytes on wire (232 bits), 29 bytes captured (232 bits) on interface 0
USB URB
    [Source: 1.6.0]
    [Destination: host]
    USBPcap pseudoheader length: 28
    IRP ID: 0xffff80030c18daf0
    IRP USBD_STATUS: USBD_STATUS_SUCCESS (0x00000000)
    URB Function: URB_FUNCTION_CONTROL_TRANSFER (0x0008)
    IRP information: 0x01, Direction: PDO -> FDO
        0000 000. = Reserved: 0x00
        .... ...1 = Direction: PDO -> FDO (0x1)
    URB bus id: 1
    Device address: 6
    Endpoint: 0x80, Direction: IN
        1... .... = Direction: IN (1)
        .... 0000 = Endpoint number: 0
    URB transfer type: URB_CONTROL (0x02)
    Packet Data Length: 1
    [Request in: 133]
    [Time from request: 0.000130000 seconds]
    Control transfer stage: Data (1)
    [bInterfaceClass: Unknown (0xffff)]
CONTROL response data: 00

No.     Time           Source                Destination           Protocol Length Info
    136 0.205486       1.6.0                 host                  USB      28     GET CONFIGURATION Status

Frame 136: 28 bytes on wire (224 bits), 28 bytes captured (224 bits) on interface 0
USB URB
    [Source: 1.6.0]
    [Destination: host]
    USBPcap pseudoheader length: 28
    IRP ID: 0xffff80030c18daf0
    IRP USBD_STATUS: USBD_STATUS_SUCCESS (0x00000000)
    URB Function: URB_FUNCTION_CONTROL_TRANSFER (0x0008)
    IRP information: 0x01, Direction: PDO -> FDO
        0000 000. = Reserved: 0x00
        .... ...1 = Direction: PDO -> FDO (0x1)
    URB bus id: 1
    Device address: 6
    Endpoint: 0x80, Direction: IN
        1... .... = Direction: IN (1)
        .... 0000 = Endpoint number: 0
    URB transfer type: URB_CONTROL (0x02)
    Packet Data Length: 0
    [Request in: 133]
    [Time from request: 0.000131000 seconds]
    Control transfer stage: Status (2)

No.     Time           Source                Destination           Protocol Length Info
    137 0.205632       1.6.0                 host                  USB      32     URB_CONTROL out

Frame 137: 32 bytes on wire (256 bits), 32 bytes captured (256 bits) on interface 0
USB URB
    [Source: 1.6.0]
    [Destination: host]
    USBPcap pseudoheader length: 28
    IRP ID: 0xffff800307a97690
    IRP USBD_STATUS: USBD_STATUS_SUCCESS (0x00000000)
    URB Function: URB_FUNCTION_CONTROL_TRANSFER (0x0008)
    IRP information: 0x01, Direction: PDO -> FDO
        0000 000. = Reserved: 0x00
        .... ...1 = Direction: PDO -> FDO (0x1)
    URB bus id: 1
    Device address: 6
    Endpoint: 0x00, Direction: OUT
        0... .... = Direction: OUT (0)
        .... 0000 = Endpoint number: 0
    URB transfer type: URB_CONTROL (0x02)
    Packet Data Length: 4
    [Request in: 134]
    [Time from request: 0.000215000 seconds]
    Control transfer stage: Data (1)
    [bInterfaceClass: Unknown (0xffff)]
CONTROL response data: b0040000

No.     Time           Source                Destination           Protocol Length Info
    138 0.205658       1.6.0                 host                  USB      28     Unknown type 1e Status

Frame 138: 28 bytes on wire (224 bits), 28 bytes captured (224 bits) on interface 0
USB URB
    [Source: 1.6.0]
    [Destination: host]
    USBPcap pseudoheader length: 28
    IRP ID: 0xffff800307a97690
    IRP USBD_STATUS: USBD_STATUS_SUCCESS (0x00000000)
    URB Function: URB_FUNCTION_CONTROL_TRANSFER (0x0008)
    IRP information: 0x01, Direction: PDO -> FDO
        0000 000. = Reserved: 0x00
        .... ...1 = Direction: PDO -> FDO (0x1)
    URB bus id: 1
    Device address: 6
    Endpoint: 0x00, Direction: OUT
        0... .... = Direction: OUT (0)
        .... 0000 = Endpoint number: 0
    URB transfer type: URB_CONTROL (0x02)
    Packet Data Length: 0
    [Request in: 134]
    [Time from request: 0.000241000 seconds]
    Control transfer stage: Status (2)

No.     Time           Source                Destination           Protocol Length Info
    139 0.205673       host                  1.6.0                 USB      36     URB_CONTROL out

Frame 139: 36 bytes on wire (288 bits), 36 bytes captured (288 bits) on interface 0
USB URB
    [Source: host]
    [Destination: 1.6.0]
    USBPcap pseudoheader length: 28
    IRP ID: 0xffff800307a97690
    IRP USBD_STATUS: USBD_STATUS_SUCCESS (0x00000000)
    URB Function: URB_FUNCTION_CONTROL_TRANSFER (0x0008)
    IRP information: 0x00, Direction: FDO -> PDO
        0000 000. = Reserved: 0x00
        .... ...0 = Direction: FDO -> PDO (0x0)
    URB bus id: 1
    Device address: 6
    Endpoint: 0x00, Direction: OUT
        0... .... = Direction: OUT (0)
        .... 0000 = Endpoint number: 0
    URB transfer type: URB_CONTROL (0x02)
    Packet Data Length: 8
    [Response in: 140]
    Control transfer stage: Setup (0)
    [bInterfaceClass: Unknown (0xffff)]
URB setup
    bmRequestType: 0x41
    bRequest: 7
    wValue: 0x0200
    wIndex: 0 (0x0000)
    wLength: 0

No.     Time           Source                Destination           Protocol Length Info
    140 0.205739       1.6.0                 host                  USB      28     SET DESCRIPTOR Status

Frame 140: 28 bytes on wire (224 bits), 28 bytes captured (224 bits) on interface 0
USB URB
    [Source: 1.6.0]
    [Destination: host]
    USBPcap pseudoheader length: 28
    IRP ID: 0xffff800307a97690
    IRP USBD_STATUS: USBD_STATUS_SUCCESS (0x00000000)
    URB Function: URB_FUNCTION_CONTROL_TRANSFER (0x0008)
    IRP information: 0x01, Direction: PDO -> FDO
        0000 000. = Reserved: 0x00
        .... ...1 = Direction: PDO -> FDO (0x1)
    URB bus id: 1
    Device address: 6
    Endpoint: 0x00, Direction: OUT
        0... .... = Direction: OUT (0)
        .... 0000 = Endpoint number: 0
    URB transfer type: URB_CONTROL (0x02)
    Packet Data Length: 0
    [Request in: 139]
    [Time from request: 0.000066000 seconds]
    Control transfer stage: Status (2)

No.     Time           Source                Destination           Protocol Length Info
    141 0.205747       host                  1.6.0                 USB      36     URB_CONTROL in

Frame 141: 36 bytes on wire (288 bits), 36 bytes captured (288 bits) on interface 0
USB URB
    [Source: host]
    [Destination: 1.6.0]
    USBPcap pseudoheader length: 28
    IRP ID: 0xffff800307a97690
    IRP USBD_STATUS: USBD_STATUS_SUCCESS (0x00000000)
    URB Function: URB_FUNCTION_CONTROL_TRANSFER (0x0008)
    IRP information: 0x00, Direction: FDO -> PDO
        0000 000. = Reserved: 0x00
        .... ...0 = Direction: FDO -> PDO (0x0)
    URB bus id: 1
    Device address: 6
    Endpoint: 0x80, Direction: IN
        1... .... = Direction: IN (1)
        .... 0000 = Endpoint number: 0
    URB transfer type: URB_CONTROL (0x02)
    Packet Data Length: 8
    [Response in: 143]
    Control transfer stage: Setup (0)
    [bInterfaceClass: Unknown (0xffff)]
URB setup
    bmRequestType: 0xc1
    bRequest: 8
    wValue: 0x0000
    wIndex: 0 (0x0000)
    wLength: 4

No.     Time           Source                Destination           Protocol Length Info
    142 0.205761       host                  1.6.0                 USB      36     URB_CONTROL out

Frame 142: 36 bytes on wire (288 bits), 36 bytes captured (288 bits) on interface 0
USB URB
    [Source: host]
    [Destination: 1.6.0]
    USBPcap pseudoheader length: 28
    IRP ID: 0xffff80030c18daf0
    IRP USBD_STATUS: USBD_STATUS_SUCCESS (0x00000000)
    URB Function: URB_FUNCTION_CONTROL_TRANSFER (0x0008)
    IRP information: 0x00, Direction: FDO -> PDO
        0000 000. = Reserved: 0x00
        .... ...0 = Direction: FDO -> PDO (0x0)
    URB bus id: 1
    Device address: 6
    Endpoint: 0x00, Direction: OUT
        0... .... = Direction: OUT (0)
        .... 0000 = Endpoint number: 0
    URB transfer type: URB_CONTROL (0x02)
    Packet Data Length: 8
    [Response in: 145]
    Control transfer stage: Setup (0)
    [bInterfaceClass: Unknown (0xffff)]
URB setup
    bmRequestType: 0x41
    bRequest: 7
    wValue: 0x0100
    wIndex: 0 (0x0000)
    wLength: 0

No.     Time           Source                Destination           Protocol Length Info
    143 0.205867       1.6.0                 host                  USB      29     URB_CONTROL in

Frame 143: 29 bytes on wire (232 bits), 29 bytes captured (232 bits) on interface 0
USB URB
    [Source: 1.6.0]
    [Destination: host]
    USBPcap pseudoheader length: 28
    IRP ID: 0xffff800307a97690
    IRP USBD_STATUS: USBD_STATUS_SUCCESS (0x00000000)
    URB Function: URB_FUNCTION_CONTROL_TRANSFER (0x0008)
    IRP information: 0x01, Direction: PDO -> FDO
        0000 000. = Reserved: 0x00
        .... ...1 = Direction: PDO -> FDO (0x1)
    URB bus id: 1
    Device address: 6
    Endpoint: 0x80, Direction: IN
        1... .... = Direction: IN (1)
        .... 0000 = Endpoint number: 0
    URB transfer type: URB_CONTROL (0x02)
    Packet Data Length: 1
    [Request in: 141]
    [Time from request: 0.000120000 seconds]
    Control transfer stage: Data (1)
    [bInterfaceClass: Unknown (0xffff)]
CONTROL response data: 00

No.     Time           Source                Destination           Protocol Length Info
    144 0.205867       1.6.0                 host                  USB      28     GET CONFIGURATION Status

Frame 144: 28 bytes on wire (224 bits), 28 bytes captured (224 bits) on interface 0
USB URB
    [Source: 1.6.0]
    [Destination: host]
    USBPcap pseudoheader length: 28
    IRP ID: 0xffff800307a97690
    IRP USBD_STATUS: USBD_STATUS_SUCCESS (0x00000000)
    URB Function: URB_FUNCTION_CONTROL_TRANSFER (0x0008)
    IRP information: 0x01, Direction: PDO -> FDO
        0000 000. = Reserved: 0x00
        .... ...1 = Direction: PDO -> FDO (0x1)
    URB bus id: 1
    Device address: 6
    Endpoint: 0x80, Direction: IN
        1... .... = Direction: IN (1)
        .... 0000 = Endpoint number: 0
    URB transfer type: URB_CONTROL (0x02)
    Packet Data Length: 0
    [Request in: 141]
    [Time from request: 0.000120000 seconds]
    Control transfer stage: Status (2)

No.     Time           Source                Destination           Protocol Length Info
    145 0.205916       1.6.0                 host                  USB      28     SET DESCRIPTOR Status

Frame 145: 28 bytes on wire (224 bits), 28 bytes captured (224 bits) on interface 0
USB URB
    [Source: 1.6.0]
    [Destination: host]
    USBPcap pseudoheader length: 28
    IRP ID: 0xffff80030c18daf0
    IRP USBD_STATUS: USBD_STATUS_SUCCESS (0x00000000)
    URB Function: URB_FUNCTION_CONTROL_TRANSFER (0x0008)
    IRP information: 0x01, Direction: PDO -> FDO
        0000 000. = Reserved: 0x00
        .... ...1 = Direction: PDO -> FDO (0x1)
    URB bus id: 1
    Device address: 6
    Endpoint: 0x00, Direction: OUT
        0... .... = Direction: OUT (0)
        .... 0000 = Endpoint number: 0
    URB transfer type: URB_CONTROL (0x02)
    Packet Data Length: 0
    [Request in: 142]
    [Time from request: 0.000155000 seconds]
    Control transfer stage: Status (2)

No.     Time           Source                Destination           Protocol Length Info
    146 0.205923       host                  1.6.0                 USB      36     URB_CONTROL in

Frame 146: 36 bytes on wire (288 bits), 36 bytes captured (288 bits) on interface 0
USB URB
    [Source: host]
    [Destination: 1.6.0]
    USBPcap pseudoheader length: 28
    IRP ID: 0xffff80030c18daf0
    IRP USBD_STATUS: USBD_STATUS_SUCCESS (0x00000000)
    URB Function: URB_FUNCTION_CONTROL_TRANSFER (0x0008)
    IRP information: 0x00, Direction: FDO -> PDO
        0000 000. = Reserved: 0x00
        .... ...0 = Direction: FDO -> PDO (0x0)
    URB bus id: 1
    Device address: 6
    Endpoint: 0x80, Direction: IN
        1... .... = Direction: IN (1)
        .... 0000 = Endpoint number: 0
    URB transfer type: URB_CONTROL (0x02)
    Packet Data Length: 8
    [Response in: 148]
    Control transfer stage: Setup (0)
    [bInterfaceClass: Unknown (0xffff)]
URB setup
    bmRequestType: 0xc1
    bRequest: 8
    wValue: 0x0000
    wIndex: 0 (0x0000)
    wLength: 4

No.     Time           Source                Destination           Protocol Length Info
    147 0.205935       host                  1.6.0                 USB      36     URB_CONTROL out

Frame 147: 36 bytes on wire (288 bits), 36 bytes captured (288 bits) on interface 0
USB URB
    [Source: host]
    [Destination: 1.6.0]
    USBPcap pseudoheader length: 28
    IRP ID: 0xffff800307a97690
    IRP USBD_STATUS: USBD_STATUS_SUCCESS (0x00000000)
    URB Function: URB_FUNCTION_CONTROL_TRANSFER (0x0008)
    IRP information: 0x00, Direction: FDO -> PDO
        0000 000. = Reserved: 0x00
        .... ...0 = Direction: FDO -> PDO (0x0)
    URB bus id: 1
    Device address: 6
    Endpoint: 0x00, Direction: OUT
        0... .... = Direction: OUT (0)
        .... 0000 = Endpoint number: 0
    URB transfer type: URB_CONTROL (0x02)
    Packet Data Length: 8
    [Response in: 150]
    Control transfer stage: Setup (0)
    [bInterfaceClass: Unknown (0xffff)]
URB setup
    bmRequestType: 0x41
    bRequest: 3
    wValue: 0x0700
    wIndex: 0 (0x0000)
    wLength: 0

No.     Time           Source                Destination           Protocol Length Info
    148 0.206043       1.6.0                 host                  USB      29     URB_CONTROL in

Frame 148: 29 bytes on wire (232 bits), 29 bytes captured (232 bits) on interface 0
USB URB
    [Source: 1.6.0]
    [Destination: host]
    USBPcap pseudoheader length: 28
    IRP ID: 0xffff80030c18daf0
    IRP USBD_STATUS: USBD_STATUS_SUCCESS (0x00000000)
    URB Function: URB_FUNCTION_CONTROL_TRANSFER (0x0008)
    IRP information: 0x01, Direction: PDO -> FDO
        0000 000. = Reserved: 0x00
        .... ...1 = Direction: PDO -> FDO (0x1)
    URB bus id: 1
    Device address: 6
    Endpoint: 0x80, Direction: IN
        1... .... = Direction: IN (1)
        .... 0000 = Endpoint number: 0
    URB transfer type: URB_CONTROL (0x02)
    Packet Data Length: 1
    [Request in: 146]
    [Time from request: 0.000120000 seconds]
    Control transfer stage: Data (1)
    [bInterfaceClass: Unknown (0xffff)]
CONTROL response data: 00

No.     Time           Source                Destination           Protocol Length Info
    149 0.206043       1.6.0                 host                  USB      28     GET CONFIGURATION Status

Frame 149: 28 bytes on wire (224 bits), 28 bytes captured (224 bits) on interface 0
USB URB
    [Source: 1.6.0]
    [Destination: host]
    USBPcap pseudoheader length: 28
    IRP ID: 0xffff80030c18daf0
    IRP USBD_STATUS: USBD_STATUS_SUCCESS (0x00000000)
    URB Function: URB_FUNCTION_CONTROL_TRANSFER (0x0008)
    IRP information: 0x01, Direction: PDO -> FDO
        0000 000. = Reserved: 0x00
        .... ...1 = Direction: PDO -> FDO (0x1)
    URB bus id: 1
    Device address: 6
    Endpoint: 0x80, Direction: IN
        1... .... = Direction: IN (1)
        .... 0000 = Endpoint number: 0
    URB transfer type: URB_CONTROL (0x02)
    Packet Data Length: 0
    [Request in: 146]
    [Time from request: 0.000120000 seconds]
    Control transfer stage: Status (2)

No.     Time           Source                Destination           Protocol Length Info
    150 0.206143       1.6.0                 host                  USB      28     SET FEATURE Status

Frame 150: 28 bytes on wire (224 bits), 28 bytes captured (224 bits) on interface 0
USB URB
    [Source: 1.6.0]
    [Destination: host]
    USBPcap pseudoheader length: 28
    IRP ID: 0xffff800307a97690
    IRP USBD_STATUS: USBD_STATUS_SUCCESS (0x00000000)
    URB Function: URB_FUNCTION_CONTROL_TRANSFER (0x0008)
    IRP information: 0x01, Direction: PDO -> FDO
        0000 000. = Reserved: 0x00
        .... ...1 = Direction: PDO -> FDO (0x1)
    URB bus id: 1
    Device address: 6
    Endpoint: 0x00, Direction: OUT
        0... .... = Direction: OUT (0)
        .... 0000 = Endpoint number: 0
    URB transfer type: URB_CONTROL (0x02)
    Packet Data Length: 0
    [Request in: 147]
    [Time from request: 0.000208000 seconds]
    Control transfer stage: Status (2)

No.     Time           Source                Destination           Protocol Length Info
    151 0.206159       host                  1.6.0                 USB      36     URB_CONTROL out

Frame 151: 36 bytes on wire (288 bits), 36 bytes captured (288 bits) on interface 0
USB URB
    [Source: host]
    [Destination: 1.6.0]
    USBPcap pseudoheader length: 28
    IRP ID: 0xffff800307a97690
    IRP USBD_STATUS: USBD_STATUS_SUCCESS (0x00000000)
    URB Function: URB_FUNCTION_CONTROL_TRANSFER (0x0008)
    IRP information: 0x00, Direction: FDO -> PDO
        0000 000. = Reserved: 0x00
        .... ...0 = Direction: FDO -> PDO (0x0)
    URB bus id: 1
    Device address: 6
    Endpoint: 0x00, Direction: OUT
        0... .... = Direction: OUT (0)
        .... 0000 = Endpoint number: 0
    URB transfer type: URB_CONTROL (0x02)
    Packet Data Length: 8
    [Response in: 152]
    Control transfer stage: Setup (0)
    [bInterfaceClass: Unknown (0xffff)]
URB setup
    bmRequestType: 0x41
    bRequest: 25
    wValue: 0x0000
    wIndex: 0 (0x0000)
    wLength: 6

No.     Time           Source                Destination           Protocol Length Info
    152 0.206337       1.6.0                 host                  USB      34     URB_CONTROL out

Frame 152: 34 bytes on wire (272 bits), 34 bytes captured (272 bits) on interface 0
USB URB
    [Source: 1.6.0]
    [Destination: host]
    USBPcap pseudoheader length: 28
    IRP ID: 0xffff800307a97690
    IRP USBD_STATUS: USBD_STATUS_SUCCESS (0x00000000)
    URB Function: URB_FUNCTION_CONTROL_TRANSFER (0x0008)
    IRP information: 0x01, Direction: PDO -> FDO
        0000 000. = Reserved: 0x00
        .... ...1 = Direction: PDO -> FDO (0x1)
    URB bus id: 1
    Device address: 6
    Endpoint: 0x00, Direction: OUT
        0... .... = Direction: OUT (0)
        .... 0000 = Endpoint number: 0
    URB transfer type: URB_CONTROL (0x02)
    Packet Data Length: 6
    [Request in: 151]
    [Time from request: 0.000178000 seconds]
    Control transfer stage: Data (1)
    [bInterfaceClass: Unknown (0xffff)]
CONTROL response data: 000000001113

No.     Time           Source                Destination           Protocol Length Info
    153 0.206362       1.6.0                 host                  USB      28     Unknown type 19 Status

Frame 153: 28 bytes on wire (224 bits), 28 bytes captured (224 bits) on interface 0
USB URB
    [Source: 1.6.0]
    [Destination: host]
    USBPcap pseudoheader length: 28
    IRP ID: 0xffff800307a97690
    IRP USBD_STATUS: USBD_STATUS_SUCCESS (0x00000000)
    URB Function: URB_FUNCTION_CONTROL_TRANSFER (0x0008)
    IRP information: 0x01, Direction: PDO -> FDO
        0000 000. = Reserved: 0x00
        .... ...1 = Direction: PDO -> FDO (0x1)
    URB bus id: 1
    Device address: 6
    Endpoint: 0x00, Direction: OUT
        0... .... = Direction: OUT (0)
        .... 0000 = Endpoint number: 0
    URB transfer type: URB_CONTROL (0x02)
    Packet Data Length: 0
    [Request in: 151]
    [Time from request: 0.000203000 seconds]
    Control transfer stage: Status (2)

No.     Time           Source                Destination           Protocol Length Info
    154 0.206374       host                  1.6.0                 USB      36     URB_CONTROL out

Frame 154: 36 bytes on wire (288 bits), 36 bytes captured (288 bits) on interface 0
USB URB
    [Source: host]
    [Destination: 1.6.0]
    USBPcap pseudoheader length: 28
    IRP ID: 0xffff800307a97690
    IRP USBD_STATUS: USBD_STATUS_SUCCESS (0x00000000)
    URB Function: URB_FUNCTION_CONTROL_TRANSFER (0x0008)
    IRP information: 0x00, Direction: FDO -> PDO
        0000 000. = Reserved: 0x00
        .... ...0 = Direction: FDO -> PDO (0x0)
    URB bus id: 1
    Device address: 6
    Endpoint: 0x00, Direction: OUT
        0... .... = Direction: OUT (0)
        .... 0000 = Endpoint number: 0
    URB transfer type: URB_CONTROL (0x02)
    Packet Data Length: 8
    [Response in: 155]
    Control transfer stage: Setup (0)
    [bInterfaceClass: Unknown (0xffff)]
URB setup
    bmRequestType: 0x41
    bRequest: 19
    wValue: 0x0000
    wIndex: 0 (0x0000)
    wLength: 16

No.     Time           Source                Destination           Protocol Length Info
    155 0.206524       1.6.0                 host                  USB      44     URB_CONTROL out

Frame 155: 44 bytes on wire (352 bits), 44 bytes captured (352 bits) on interface 0
USB URB
    [Source: 1.6.0]
    [Destination: host]
    USBPcap pseudoheader length: 28
    IRP ID: 0xffff800307a97690
    IRP USBD_STATUS: USBD_STATUS_SUCCESS (0x00000000)
    URB Function: URB_FUNCTION_CONTROL_TRANSFER (0x0008)
    IRP information: 0x01, Direction: PDO -> FDO
        0000 000. = Reserved: 0x00
        .... ...1 = Direction: PDO -> FDO (0x1)
    URB bus id: 1
    Device address: 6
    Endpoint: 0x00, Direction: OUT
        0... .... = Direction: OUT (0)
        .... 0000 = Endpoint number: 0
    URB transfer type: URB_CONTROL (0x02)
    Packet Data Length: 16
    [Request in: 154]
    [Time from request: 0.000150000 seconds]
    Control transfer stage: Data (1)
    [bInterfaceClass: Unknown (0xffff)]
CONTROL response data: 00000000000000000080000000200000

No.     Time           Source                Destination           Protocol Length Info
    156 0.206524       1.6.0                 host                  USB      28     Unknown type 13 Status

Frame 156: 28 bytes on wire (224 bits), 28 bytes captured (224 bits) on interface 0
USB URB
    [Source: 1.6.0]
    [Destination: host]
    USBPcap pseudoheader length: 28
    IRP ID: 0xffff800307a97690
    IRP USBD_STATUS: USBD_STATUS_SUCCESS (0x00000000)
    URB Function: URB_FUNCTION_CONTROL_TRANSFER (0x0008)
    IRP information: 0x01, Direction: PDO -> FDO
        0000 000. = Reserved: 0x00
        .... ...1 = Direction: PDO -> FDO (0x1)
    URB bus id: 1
    Device address: 6
    Endpoint: 0x00, Direction: OUT
        0... .... = Direction: OUT (0)
        .... 0000 = Endpoint number: 0
    URB transfer type: URB_CONTROL (0x02)
    Packet Data Length: 0
    [Request in: 154]
    [Time from request: 0.000150000 seconds]
    Control transfer stage: Status (2)

No.     Time           Source                Destination           Protocol Length Info
    157 0.206558       host                  1.6.0                 USB      36     URB_CONTROL out

Frame 157: 36 bytes on wire (288 bits), 36 bytes captured (288 bits) on interface 0
USB URB
    [Source: host]
    [Destination: 1.6.0]
    USBPcap pseudoheader length: 28
    IRP ID: 0xffff800307a97690
    IRP USBD_STATUS: USBD_STATUS_SUCCESS (0x00000000)
    URB Function: URB_FUNCTION_CONTROL_TRANSFER (0x0008)
    IRP information: 0x00, Direction: FDO -> PDO
        0000 000. = Reserved: 0x00
        .... ...0 = Direction: FDO -> PDO (0x0)
    URB bus id: 1
    Device address: 6
    Endpoint: 0x00, Direction: OUT
        0... .... = Direction: OUT (0)
        .... 0000 = Endpoint number: 0
    URB transfer type: URB_CONTROL (0x02)
    Packet Data Length: 8
    [Response in: 158]
    Control transfer stage: Setup (0)
    [bInterfaceClass: Unknown (0xffff)]
URB setup
    bmRequestType: 0x41
    bRequest: 5
    wValue: 0x0000
    wIndex: 0 (0x0000)
    wLength: 0

No.     Time           Source                Destination           Protocol Length Info
    158 0.206623       1.6.0                 host                  USB      28     SET ADDRESS Status

Frame 158: 28 bytes on wire (224 bits), 28 bytes captured (224 bits) on interface 0
USB URB
    [Source: 1.6.0]
    [Destination: host]
    USBPcap pseudoheader length: 28
    IRP ID: 0xffff800307a97690
    IRP USBD_STATUS: USBD_STATUS_SUCCESS (0x00000000)
    URB Function: URB_FUNCTION_CONTROL_TRANSFER (0x0008)
    IRP information: 0x01, Direction: PDO -> FDO
        0000 000. = Reserved: 0x00
        .... ...1 = Direction: PDO -> FDO (0x1)
    URB bus id: 1
    Device address: 6
    Endpoint: 0x00, Direction: OUT
        0... .... = Direction: OUT (0)
        .... 0000 = Endpoint number: 0
    URB transfer type: URB_CONTROL (0x02)
    Packet Data Length: 0
    [Request in: 157]
    [Time from request: 0.000065000 seconds]
    Control transfer stage: Status (2)

No.     Time           Source                Destination           Protocol Length Info
    159 0.206629       host                  1.6.0                 USB      36     URB_CONTROL out

Frame 159: 36 bytes on wire (288 bits), 36 bytes captured (288 bits) on interface 0
USB URB
    [Source: host]
    [Destination: 1.6.0]
    USBPcap pseudoheader length: 28
    IRP ID: 0xffff800307881010
    IRP USBD_STATUS: USBD_STATUS_SUCCESS (0x00000000)
    URB Function: URB_FUNCTION_CONTROL_TRANSFER (0x0008)
    IRP information: 0x00, Direction: FDO -> PDO
        0000 000. = Reserved: 0x00
        .... ...0 = Direction: FDO -> PDO (0x0)
    URB bus id: 1
    Device address: 6
    Endpoint: 0x00, Direction: OUT
        0... .... = Direction: OUT (0)
        .... 0000 = Endpoint number: 0
    URB transfer type: URB_CONTROL (0x02)
    Packet Data Length: 8
    [Response in: 160]
    Control transfer stage: Setup (0)
    [bInterfaceClass: Unknown (0xffff)]
URB setup
    bmRequestType: 0x41
    bRequest: 0
    wValue: 0x0000
    wIndex: 0 (0x0000)
    wLength: 0

No.     Time           Source                Destination           Protocol Length Info
    160 0.206701       1.6.0                 host                  USB      28     GET STATUS Status

Frame 160: 28 bytes on wire (224 bits), 28 bytes captured (224 bits) on interface 0
USB URB
    [Source: 1.6.0]
    [Destination: host]
    USBPcap pseudoheader length: 28
    IRP ID: 0xffff800307881010
    IRP USBD_STATUS: USBD_STATUS_SUCCESS (0x00000000)
    URB Function: URB_FUNCTION_CONTROL_TRANSFER (0x0008)
    IRP information: 0x01, Direction: PDO -> FDO
        0000 000. = Reserved: 0x00
        .... ...1 = Direction: PDO -> FDO (0x1)
    URB bus id: 1
    Device address: 6
    Endpoint: 0x00, Direction: OUT
        0... .... = Direction: OUT (0)
        .... 0000 = Endpoint number: 0
    URB transfer type: URB_CONTROL (0x02)
    Packet Data Length: 0
    [Request in: 159]
    [Time from request: 0.000072000 seconds]
    Control transfer stage: Status (2)

No.     Time           Source                Destination           Protocol Length Info
    161 0.330154       host                  1.6.0                 USB      36     URB_CONTROL out

Frame 161: 36 bytes on wire (288 bits), 36 bytes captured (288 bits) on interface 0
USB URB
    [Source: host]
    [Destination: 1.6.0]
    USBPcap pseudoheader length: 28
    IRP ID: 0xffff800306e436e0
    IRP USBD_STATUS: USBD_STATUS_SUCCESS (0x00000000)
    URB Function: URB_FUNCTION_CONTROL_TRANSFER (0x0008)
    IRP information: 0x00, Direction: FDO -> PDO
        0000 000. = Reserved: 0x00
        .... ...0 = Direction: FDO -> PDO (0x0)
    URB bus id: 1
    Device address: 6
    Endpoint: 0x00, Direction: OUT
        0... .... = Direction: OUT (0)
        .... 0000 = Endpoint number: 0
    URB transfer type: URB_CONTROL (0x02)
    Packet Data Length: 8
    [Response in: 162]
    Control transfer stage: Setup (0)
    [bInterfaceClass: Unknown (0xffff)]
URB setup
    bmRequestType: 0x41
    bRequest: 0
    wValue: 0xffff
    wIndex: 0 (0x0000)
    wLength: 0

No.     Time           Source                Destination           Protocol Length Info
    162 0.330344       1.6.0                 host                  USB      28     GET STATUS Status

Frame 162: 28 bytes on wire (224 bits), 28 bytes captured (224 bits) on interface 0
USB URB
    [Source: 1.6.0]
    [Destination: host]
    USBPcap pseudoheader length: 28
    IRP ID: 0xffff800306e436e0
    IRP USBD_STATUS: USBD_STATUS_SUCCESS (0x00000000)
    URB Function: URB_FUNCTION_CONTROL_TRANSFER (0x0008)
    IRP information: 0x01, Direction: PDO -> FDO
        0000 000. = Reserved: 0x00
        .... ...1 = Direction: PDO -> FDO (0x1)
    URB bus id: 1
    Device address: 6
    Endpoint: 0x00, Direction: OUT
        0... .... = Direction: OUT (0)
        .... 0000 = Endpoint number: 0
    URB transfer type: URB_CONTROL (0x02)
    Packet Data Length: 0
    [Request in: 161]
    [Time from request: 0.000190000 seconds]
    Control transfer stage: Status (2)

No.     Time           Source                Destination           Protocol Length Info
    163 0.330377       host                  1.6.0                 USB      36     URB_CONTROL in

Frame 163: 36 bytes on wire (288 bits), 36 bytes captured (288 bits) on interface 0
USB URB
    [Source: host]
    [Destination: 1.6.0]
    USBPcap pseudoheader length: 28
    IRP ID: 0xffff800307b03af0
    IRP USBD_STATUS: USBD_STATUS_SUCCESS (0x00000000)
    URB Function: URB_FUNCTION_CONTROL_TRANSFER (0x0008)
    IRP information: 0x00, Direction: FDO -> PDO
        0000 000. = Reserved: 0x00
        .... ...0 = Direction: FDO -> PDO (0x0)
    URB bus id: 1
    Device address: 6
    Endpoint: 0x80, Direction: IN
        1... .... = Direction: IN (1)
        .... 0000 = Endpoint number: 0
    URB transfer type: URB_CONTROL (0x02)
    Packet Data Length: 8
    [Response in: 164]
    Control transfer stage: Setup (0)
    [bInterfaceClass: Unknown (0xffff)]
URB setup
    bmRequestType: 0xc1
    bRequest: 8
    wValue: 0x0000
    wIndex: 0 (0x0000)
    wLength: 1

No.     Time           Source                Destination           Protocol Length Info
    164 0.330468       1.6.0                 host                  USB      29     URB_CONTROL in

Frame 164: 29 bytes on wire (232 bits), 29 bytes captured (232 bits) on interface 0
USB URB
    [Source: 1.6.0]
    [Destination: host]
    USBPcap pseudoheader length: 28
    IRP ID: 0xffff800307b03af0
    IRP USBD_STATUS: USBD_STATUS_SUCCESS (0x00000000)
    URB Function: URB_FUNCTION_CONTROL_TRANSFER (0x0008)
    IRP information: 0x01, Direction: PDO -> FDO
        0000 000. = Reserved: 0x00
        .... ...1 = Direction: PDO -> FDO (0x1)
    URB bus id: 1
    Device address: 6
    Endpoint: 0x80, Direction: IN
        1... .... = Direction: IN (1)
        .... 0000 = Endpoint number: 0
    URB transfer type: URB_CONTROL (0x02)
    Packet Data Length: 1
    [Request in: 163]
    [Time from request: 0.000091000 seconds]
    Control transfer stage: Data (1)
    [bInterfaceClass: Unknown (0xffff)]
CONTROL response data: 00

No.     Time           Source                Destination           Protocol Length Info
    165 0.330468       1.6.0                 host                  USB      28     GET CONFIGURATION Status

Frame 165: 28 bytes on wire (224 bits), 28 bytes captured (224 bits) on interface 0
USB URB
    [Source: 1.6.0]
    [Destination: host]
    USBPcap pseudoheader length: 28
    IRP ID: 0xffff800307b03af0
    IRP USBD_STATUS: USBD_STATUS_SUCCESS (0x00000000)
    URB Function: URB_FUNCTION_CONTROL_TRANSFER (0x0008)
    IRP information: 0x01, Direction: PDO -> FDO
        0000 000. = Reserved: 0x00
        .... ...1 = Direction: PDO -> FDO (0x1)
    URB bus id: 1
    Device address: 6
    Endpoint: 0x80, Direction: IN
        1... .... = Direction: IN (1)
        .... 0000 = Endpoint number: 0
    URB transfer type: URB_CONTROL (0x02)
    Packet Data Length: 0
    [Request in: 163]
    [Time from request: 0.000091000 seconds]
    Control transfer stage: Status (2)

No.     Time           Source                Destination           Protocol Length Info
    166 0.330474       host                  1.6.0                 USB      36     URB_CONTROL in

Frame 166: 36 bytes on wire (288 bits), 36 bytes captured (288 bits) on interface 0
USB URB
    [Source: host]
    [Destination: 1.6.0]
    USBPcap pseudoheader length: 28
    IRP ID: 0xffff800306e436e0
    IRP USBD_STATUS: USBD_STATUS_SUCCESS (0x00000000)
    URB Function: URB_FUNCTION_CONTROL_TRANSFER (0x0008)
    IRP information: 0x00, Direction: FDO -> PDO
        0000 000. = Reserved: 0x00
        .... ...0 = Direction: FDO -> PDO (0x0)
    URB bus id: 1
    Device address: 6
    Endpoint: 0x80, Direction: IN
        1... .... = Direction: IN (1)
        .... 0000 = Endpoint number: 0
    URB transfer type: URB_CONTROL (0x02)
    Packet Data Length: 8
    [Response in: 167]
    Control transfer stage: Setup (0)
URB setup
    bmRequestType: 0xc0
    bRequest: 16
    wValue: 0x0000
    wIndex: 0 (0x0000)
    wLength: 20

No.     Time           Source                Destination           Protocol Length Info
    167 0.330640       1.6.0                 host                  USB      47     URB_CONTROL in

Frame 167: 47 bytes on wire (376 bits), 47 bytes captured (376 bits) on interface 0
USB URB
    [Source: 1.6.0]
    [Destination: host]
    USBPcap pseudoheader length: 28
    IRP ID: 0xffff800306e436e0
    IRP USBD_STATUS: USBD_STATUS_SUCCESS (0x00000000)
    URB Function: URB_FUNCTION_CONTROL_TRANSFER (0x0008)
    IRP information: 0x01, Direction: PDO -> FDO
        0000 000. = Reserved: 0x00
        .... ...1 = Direction: PDO -> FDO (0x1)
    URB bus id: 1
    Device address: 6
    Endpoint: 0x80, Direction: IN
        1... .... = Direction: IN (1)
        .... 0000 = Endpoint number: 0
    URB transfer type: URB_CONTROL (0x02)
    Packet Data Length: 19
    [Request in: 166]
    [Time from request: 0.000166000 seconds]
    Control transfer stage: Data (1)
CONTROL response data: 00000000000000000000000000000000000000

No.     Time           Source                Destination           Protocol Length Info
    168 0.330640       1.6.0                 host                  USB      28     Unknown type 10 Status

Frame 168: 28 bytes on wire (224 bits), 28 bytes captured (224 bits) on interface 0
USB URB
    [Source: 1.6.0]
    [Destination: host]
    USBPcap pseudoheader length: 28
    IRP ID: 0xffff800306e436e0
    IRP USBD_STATUS: USBD_STATUS_SUCCESS (0x00000000)
    URB Function: URB_FUNCTION_CONTROL_TRANSFER (0x0008)
    IRP information: 0x01, Direction: PDO -> FDO
        0000 000. = Reserved: 0x00
        .... ...1 = Direction: PDO -> FDO (0x1)
    URB bus id: 1
    Device address: 6
    Endpoint: 0x80, Direction: IN
        1... .... = Direction: IN (1)
        .... 0000 = Endpoint number: 0
    URB transfer type: URB_CONTROL (0x02)
    Packet Data Length: 0
    [Request in: 166]
    [Time from request: 0.000166000 seconds]
    Control transfer stage: Status (2)

No.     Time           Source                Destination           Protocol Length Info
    169 0.330647       host                  1.6.0                 USB      36     URB_CONTROL out

Frame 169: 36 bytes on wire (288 bits), 36 bytes captured (288 bits) on interface 0
USB URB
    [Source: host]
    [Destination: 1.6.0]
    USBPcap pseudoheader length: 28
    IRP ID: 0xffff80030cff8890
    IRP USBD_STATUS: USBD_STATUS_SUCCESS (0x00000000)
    URB Function: URB_FUNCTION_CONTROL_TRANSFER (0x0008)
    IRP information: 0x00, Direction: FDO -> PDO
        0000 000. = Reserved: 0x00
        .... ...0 = Direction: FDO -> PDO (0x0)
    URB bus id: 1
    Device address: 6
    Endpoint: 0x00, Direction: OUT
        0... .... = Direction: OUT (0)
        .... 0000 = Endpoint number: 0
    URB transfer type: URB_CONTROL (0x02)
    Packet Data Length: 8
    [Response in: 170]
    Control transfer stage: Setup (0)
    [bInterfaceClass: Unknown (0xffff)]
URB setup
    bmRequestType: 0x41
    bRequest: 3
    wValue: 0x0700
    wIndex: 0 (0x0000)
    wLength: 0

No.     Time           Source                Destination           Protocol Length Info
    170 0.330749       1.6.0                 host                  USB      28     SET FEATURE Status

Frame 170: 28 bytes on wire (224 bits), 28 bytes captured (224 bits) on interface 0
USB URB
    [Source: 1.6.0]
    [Destination: host]
    USBPcap pseudoheader length: 28
    IRP ID: 0xffff80030cff8890
    IRP USBD_STATUS: USBD_STATUS_SUCCESS (0x00000000)
    URB Function: URB_FUNCTION_CONTROL_TRANSFER (0x0008)
    IRP information: 0x01, Direction: PDO -> FDO
        0000 000. = Reserved: 0x00
        .... ...1 = Direction: PDO -> FDO (0x1)
    URB bus id: 1
    Device address: 6
    Endpoint: 0x00, Direction: OUT
        0... .... = Direction: OUT (0)
        .... 0000 = Endpoint number: 0
    URB transfer type: URB_CONTROL (0x02)
    Packet Data Length: 0
    [Request in: 169]
    [Time from request: 0.000102000 seconds]
    Control transfer stage: Status (2)

No.     Time           Source                Destination           Protocol Length Info
    171 0.330755       host                  1.6.0                 USB      36     URB_CONTROL out

Frame 171: 36 bytes on wire (288 bits), 36 bytes captured (288 bits) on interface 0
USB URB
    [Source: host]
    [Destination: 1.6.0]
    USBPcap pseudoheader length: 28
    IRP ID: 0xffff80030cff8890
    IRP USBD_STATUS: USBD_STATUS_SUCCESS (0x00000000)
    URB Function: URB_FUNCTION_CONTROL_TRANSFER (0x0008)
    IRP information: 0x00, Direction: FDO -> PDO
        0000 000. = Reserved: 0x00
        .... ...0 = Direction: FDO -> PDO (0x0)
    URB bus id: 1
    Device address: 6
    Endpoint: 0x00, Direction: OUT
        0... .... = Direction: OUT (0)
        .... 0000 = Endpoint number: 0
    URB transfer type: URB_CONTROL (0x02)
    Packet Data Length: 8
    [Response in: 172]
    Control transfer stage: Setup (0)
    [bInterfaceClass: Unknown (0xffff)]
URB setup
    bmRequestType: 0x41
    bRequest: 19
    wValue: 0x0000
    wIndex: 0 (0x0000)
    wLength: 16

No.     Time           Source                Destination           Protocol Length Info
    172 0.330859       1.6.0                 host                  USB      44     URB_CONTROL out

Frame 172: 44 bytes on wire (352 bits), 44 bytes captured (352 bits) on interface 0
USB URB
    [Source: 1.6.0]
    [Destination: host]
    USBPcap pseudoheader length: 28
    IRP ID: 0xffff80030cff8890
    IRP USBD_STATUS: USBD_STATUS_SUCCESS (0x00000000)
    URB Function: URB_FUNCTION_CONTROL_TRANSFER (0x0008)
    IRP information: 0x01, Direction: PDO -> FDO
        0000 000. = Reserved: 0x00
        .... ...1 = Direction: PDO -> FDO (0x1)
    URB bus id: 1
    Device address: 6
    Endpoint: 0x00, Direction: OUT
        0... .... = Direction: OUT (0)
        .... 0000 = Endpoint number: 0
    URB transfer type: URB_CONTROL (0x02)
    Packet Data Length: 16
    [Request in: 171]
    [Time from request: 0.000104000 seconds]
    Control transfer stage: Data (1)
    [bInterfaceClass: Unknown (0xffff)]
CONTROL response data: 00000000000000000080000000200000

No.     Time           Source                Destination           Protocol Length Info
    173 0.330883       1.6.0                 host                  USB      28     Unknown type 13 Status

Frame 173: 28 bytes on wire (224 bits), 28 bytes captured (224 bits) on interface 0
USB URB
    [Source: 1.6.0]
    [Destination: host]
    USBPcap pseudoheader length: 28
    IRP ID: 0xffff80030cff8890
    IRP USBD_STATUS: USBD_STATUS_SUCCESS (0x00000000)
    URB Function: URB_FUNCTION_CONTROL_TRANSFER (0x0008)
    IRP information: 0x01, Direction: PDO -> FDO
        0000 000. = Reserved: 0x00
        .... ...1 = Direction: PDO -> FDO (0x1)
    URB bus id: 1
    Device address: 6
    Endpoint: 0x00, Direction: OUT
        0... .... = Direction: OUT (0)
        .... 0000 = Endpoint number: 0
    URB transfer type: URB_CONTROL (0x02)
    Packet Data Length: 0
    [Request in: 171]
    [Time from request: 0.000128000 seconds]
    Control transfer stage: Status (2)

No.     Time           Source                Destination           Protocol Length Info
    174 0.330889       host                  1.6.0                 USB      36     URB_CONTROL out

Frame 174: 36 bytes on wire (288 bits), 36 bytes captured (288 bits) on interface 0
USB URB
    [Source: host]
    [Destination: 1.6.0]
    USBPcap pseudoheader length: 28
    IRP ID: 0xffff800307b03af0
    IRP USBD_STATUS: USBD_STATUS_SUCCESS (0x00000000)
    URB Function: URB_FUNCTION_CONTROL_TRANSFER (0x0008)
    IRP information: 0x00, Direction: FDO -> PDO
        0000 000. = Reserved: 0x00
        .... ...0 = Direction: FDO -> PDO (0x0)
    URB bus id: 1
    Device address: 6
    Endpoint: 0x00, Direction: OUT
        0... .... = Direction: OUT (0)
        .... 0000 = Endpoint number: 0
    URB transfer type: URB_CONTROL (0x02)
    Packet Data Length: 8
    [Response in: 175]
    Control transfer stage: Setup (0)
    [bInterfaceClass: Unknown (0xffff)]
URB setup
    bmRequestType: 0x41
    bRequest: 25
    wValue: 0x0000
    wIndex: 0 (0x0000)
    wLength: 6

No.     Time           Source                Destination           Protocol Length Info
    175 0.331019       1.6.0                 host                  USB      34     URB_CONTROL out

Frame 175: 34 bytes on wire (272 bits), 34 bytes captured (272 bits) on interface 0
USB URB
    [Source: 1.6.0]
    [Destination: host]
    USBPcap pseudoheader length: 28
    IRP ID: 0xffff800307b03af0
    IRP USBD_STATUS: USBD_STATUS_SUCCESS (0x00000000)
    URB Function: URB_FUNCTION_CONTROL_TRANSFER (0x0008)
    IRP information: 0x01, Direction: PDO -> FDO
        0000 000. = Reserved: 0x00
        .... ...1 = Direction: PDO -> FDO (0x1)
    URB bus id: 1
    Device address: 6
    Endpoint: 0x00, Direction: OUT
        0... .... = Direction: OUT (0)
        .... 0000 = Endpoint number: 0
    URB transfer type: URB_CONTROL (0x02)
    Packet Data Length: 6
    [Request in: 174]
    [Time from request: 0.000130000 seconds]
    Control transfer stage: Data (1)
    [bInterfaceClass: Unknown (0xffff)]
CONTROL response data: 000000001113

No.     Time           Source                Destination           Protocol Length Info
    176 0.331019       1.6.0                 host                  USB      28     Unknown type 19 Status

Frame 176: 28 bytes on wire (224 bits), 28 bytes captured (224 bits) on interface 0
USB URB
    [Source: 1.6.0]
    [Destination: host]
    USBPcap pseudoheader length: 28
    IRP ID: 0xffff800307b03af0
    IRP USBD_STATUS: USBD_STATUS_SUCCESS (0x00000000)
    URB Function: URB_FUNCTION_CONTROL_TRANSFER (0x0008)
    IRP information: 0x01, Direction: PDO -> FDO
        0000 000. = Reserved: 0x00
        .... ...1 = Direction: PDO -> FDO (0x1)
    URB bus id: 1
    Device address: 6
    Endpoint: 0x00, Direction: OUT
        0... .... = Direction: OUT (0)
        .... 0000 = Endpoint number: 0
    URB transfer type: URB_CONTROL (0x02)
    Packet Data Length: 0
    [Request in: 174]
    [Time from request: 0.000130000 seconds]
    Control transfer stage: Status (2)

No.     Time           Source                Destination           Protocol Length Info
    177 0.331024       host                  1.6.0                 USB      36     URB_CONTROL out

Frame 177: 36 bytes on wire (288 bits), 36 bytes captured (288 bits) on interface 0
USB URB
    [Source: host]
    [Destination: 1.6.0]
    USBPcap pseudoheader length: 28
    IRP ID: 0xffff800307b03af0
    IRP USBD_STATUS: USBD_STATUS_SUCCESS (0x00000000)
    URB Function: URB_FUNCTION_CONTROL_TRANSFER (0x0008)
    IRP information: 0x00, Direction: FDO -> PDO
        0000 000. = Reserved: 0x00
        .... ...0 = Direction: FDO -> PDO (0x0)
    URB bus id: 1
    Device address: 6
    Endpoint: 0x00, Direction: OUT
        0... .... = Direction: OUT (0)
        .... 0000 = Endpoint number: 0
    URB transfer type: URB_CONTROL (0x02)
    Packet Data Length: 8
    [Response in: 178]
    Control transfer stage: Setup (0)
    [bInterfaceClass: Unknown (0xffff)]
URB setup
    bmRequestType: 0x41
    bRequest: 30
    wValue: 0x0000
    wIndex: 0 (0x0000)
    wLength: 4

No.     Time           Source                Destination           Protocol Length Info
    178 0.331171       1.6.0                 host                  USB      32     URB_CONTROL out

Frame 178: 32 bytes on wire (256 bits), 32 bytes captured (256 bits) on interface 0
USB URB
    [Source: 1.6.0]
    [Destination: host]
    USBPcap pseudoheader length: 28
    IRP ID: 0xffff800307b03af0
    IRP USBD_STATUS: USBD_STATUS_SUCCESS (0x00000000)
    URB Function: URB_FUNCTION_CONTROL_TRANSFER (0x0008)
    IRP information: 0x01, Direction: PDO -> FDO
        0000 000. = Reserved: 0x00
        .... ...1 = Direction: PDO -> FDO (0x1)
    URB bus id: 1
    Device address: 6
    Endpoint: 0x00, Direction: OUT
        0... .... = Direction: OUT (0)
        .... 0000 = Endpoint number: 0
    URB transfer type: URB_CONTROL (0x02)
    Packet Data Length: 4
    [Request in: 177]
    [Time from request: 0.000147000 seconds]
    Control transfer stage: Data (1)
    [bInterfaceClass: Unknown (0xffff)]
CONTROL response data: b0040000

No.     Time           Source                Destination           Protocol Length Info
    179 0.331197       1.6.0                 host                  USB      28     Unknown type 1e Status

Frame 179: 28 bytes on wire (224 bits), 28 bytes captured (224 bits) on interface 0
USB URB
    [Source: 1.6.0]
    [Destination: host]
    USBPcap pseudoheader length: 28
    IRP ID: 0xffff800307b03af0
    IRP USBD_STATUS: USBD_STATUS_SUCCESS (0x00000000)
    URB Function: URB_FUNCTION_CONTROL_TRANSFER (0x0008)
    IRP information: 0x01, Direction: PDO -> FDO
        0000 000. = Reserved: 0x00
        .... ...1 = Direction: PDO -> FDO (0x1)
    URB bus id: 1
    Device address: 6
    Endpoint: 0x00, Direction: OUT
        0... .... = Direction: OUT (0)
        .... 0000 = Endpoint number: 0
    URB transfer type: URB_CONTROL (0x02)
    Packet Data Length: 0
    [Request in: 177]
    [Time from request: 0.000173000 seconds]
    Control transfer stage: Status (2)

No.     Time           Source                Destination           Protocol Length Info
    180 0.331465       host                  1.6.0                 USB      36     URB_CONTROL out

Frame 180: 36 bytes on wire (288 bits), 36 bytes captured (288 bits) on interface 0
USB URB
    [Source: host]
    [Destination: 1.6.0]
    USBPcap pseudoheader length: 28
    IRP ID: 0xffff80030cff8890
    IRP USBD_STATUS: USBD_STATUS_SUCCESS (0x00000000)
    URB Function: URB_FUNCTION_CONTROL_TRANSFER (0x0008)
    IRP information: 0x00, Direction: FDO -> PDO
        0000 000. = Reserved: 0x00
        .... ...0 = Direction: FDO -> PDO (0x0)
    URB bus id: 1
    Device address: 6
    Endpoint: 0x00, Direction: OUT
        0... .... = Direction: OUT (0)
        .... 0000 = Endpoint number: 0
    URB transfer type: URB_CONTROL (0x02)
    Packet Data Length: 8
    [Response in: 181]
    Control transfer stage: Setup (0)
    [bInterfaceClass: Unknown (0xffff)]
URB setup
    bmRequestType: 0x41
    bRequest: 30
    wValue: 0x0000
    wIndex: 0 (0x0000)
    wLength: 4

No.     Time           Source                Destination           Protocol Length Info
    181 0.331645       1.6.0                 host                  USB      32     URB_CONTROL out

Frame 181: 32 bytes on wire (256 bits), 32 bytes captured (256 bits) on interface 0
USB URB
    [Source: 1.6.0]
    [Destination: host]
    USBPcap pseudoheader length: 28
    IRP ID: 0xffff80030cff8890
    IRP USBD_STATUS: USBD_STATUS_SUCCESS (0x00000000)
    URB Function: URB_FUNCTION_CONTROL_TRANSFER (0x0008)
    IRP information: 0x01, Direction: PDO -> FDO
        0000 000. = Reserved: 0x00
        .... ...1 = Direction: PDO -> FDO (0x1)
    URB bus id: 1
    Device address: 6
    Endpoint: 0x00, Direction: OUT
        0... .... = Direction: OUT (0)
        .... 0000 = Endpoint number: 0
    URB transfer type: URB_CONTROL (0x02)
    Packet Data Length: 4
    [Request in: 180]
    [Time from request: 0.000180000 seconds]
    Control transfer stage: Data (1)
    [bInterfaceClass: Unknown (0xffff)]
CONTROL response data: 00e10000

No.     Time           Source                Destination           Protocol Length Info
    182 0.331668       1.6.0                 host                  USB      28     Unknown type 1e Status

Frame 182: 28 bytes on wire (224 bits), 28 bytes captured (224 bits) on interface 0
USB URB
    [Source: 1.6.0]
    [Destination: host]
    USBPcap pseudoheader length: 28
    IRP ID: 0xffff80030cff8890
    IRP USBD_STATUS: USBD_STATUS_SUCCESS (0x00000000)
    URB Function: URB_FUNCTION_CONTROL_TRANSFER (0x0008)
    IRP information: 0x01, Direction: PDO -> FDO
        0000 000. = Reserved: 0x00
        .... ...1 = Direction: PDO -> FDO (0x1)
    URB bus id: 1
    Device address: 6
    Endpoint: 0x00, Direction: OUT
        0... .... = Direction: OUT (0)
        .... 0000 = Endpoint number: 0
    URB transfer type: URB_CONTROL (0x02)
    Packet Data Length: 0
    [Request in: 180]
    [Time from request: 0.000203000 seconds]
    Control transfer stage: Status (2)

No.     Time           Source                Destination           Protocol Length Info
    183 0.331686       host                  1.6.0                 USB      36     URB_CONTROL out

Frame 183: 36 bytes on wire (288 bits), 36 bytes captured (288 bits) on interface 0
USB URB
    [Source: host]
    [Destination: 1.6.0]
    USBPcap pseudoheader length: 28
    IRP ID: 0xffff80030cff8890
    IRP USBD_STATUS: USBD_STATUS_SUCCESS (0x00000000)
    URB Function: URB_FUNCTION_CONTROL_TRANSFER (0x0008)
    IRP information: 0x00, Direction: FDO -> PDO
        0000 000. = Reserved: 0x00
        .... ...0 = Direction: FDO -> PDO (0x0)
    URB bus id: 1
    Device address: 6
    Endpoint: 0x00, Direction: OUT
        0... .... = Direction: OUT (0)
        .... 0000 = Endpoint number: 0
    URB transfer type: URB_CONTROL (0x02)
    Packet Data Length: 8
    [Response in: 184]
    Control transfer stage: Setup (0)
    [bInterfaceClass: Unknown (0xffff)]
URB setup
    bmRequestType: 0x41
    bRequest: 7
    wValue: 0x0200
    wIndex: 0 (0x0000)
    wLength: 0

No.     Time           Source                Destination           Protocol Length Info
    184 0.331753       1.6.0                 host                  USB      28     SET DESCRIPTOR Status

Frame 184: 28 bytes on wire (224 bits), 28 bytes captured (224 bits) on interface 0
USB URB
    [Source: 1.6.0]
    [Destination: host]
    USBPcap pseudoheader length: 28
    IRP ID: 0xffff80030cff8890
    IRP USBD_STATUS: USBD_STATUS_SUCCESS (0x00000000)
    URB Function: URB_FUNCTION_CONTROL_TRANSFER (0x0008)
    IRP information: 0x01, Direction: PDO -> FDO
        0000 000. = Reserved: 0x00
        .... ...1 = Direction: PDO -> FDO (0x1)
    URB bus id: 1
    Device address: 6
    Endpoint: 0x00, Direction: OUT
        0... .... = Direction: OUT (0)
        .... 0000 = Endpoint number: 0
    URB transfer type: URB_CONTROL (0x02)
    Packet Data Length: 0
    [Request in: 183]
    [Time from request: 0.000067000 seconds]
    Control transfer stage: Status (2)

No.     Time           Source                Destination           Protocol Length Info
    185 0.331763       host                  1.6.0                 USB      36     URB_CONTROL in

Frame 185: 36 bytes on wire (288 bits), 36 bytes captured (288 bits) on interface 0
USB URB
    [Source: host]
    [Destination: 1.6.0]
    USBPcap pseudoheader length: 28
    IRP ID: 0xffff80030cff8890
    IRP USBD_STATUS: USBD_STATUS_SUCCESS (0x00000000)
    URB Function: URB_FUNCTION_CONTROL_TRANSFER (0x0008)
    IRP information: 0x00, Direction: FDO -> PDO
        0000 000. = Reserved: 0x00
        .... ...0 = Direction: FDO -> PDO (0x0)
    URB bus id: 1
    Device address: 6
    Endpoint: 0x80, Direction: IN
        1... .... = Direction: IN (1)
        .... 0000 = Endpoint number: 0
    URB transfer type: URB_CONTROL (0x02)
    Packet Data Length: 8
    [Response in: 187]
    Control transfer stage: Setup (0)
    [bInterfaceClass: Unknown (0xffff)]
URB setup
    bmRequestType: 0xc1
    bRequest: 8
    wValue: 0x0000
    wIndex: 0 (0x0000)
    wLength: 4

No.     Time           Source                Destination           Protocol Length Info
    186 0.331771       host                  1.6.0                 USB      36     URB_CONTROL out

Frame 186: 36 bytes on wire (288 bits), 36 bytes captured (288 bits) on interface 0
USB URB
    [Source: host]
    [Destination: 1.6.0]
    USBPcap pseudoheader length: 28
    IRP ID: 0xffff800307b03af0
    IRP USBD_STATUS: USBD_STATUS_SUCCESS (0x00000000)
    URB Function: URB_FUNCTION_CONTROL_TRANSFER (0x0008)
    IRP information: 0x00, Direction: FDO -> PDO
        0000 000. = Reserved: 0x00
        .... ...0 = Direction: FDO -> PDO (0x0)
    URB bus id: 1
    Device address: 6
    Endpoint: 0x00, Direction: OUT
        0... .... = Direction: OUT (0)
        .... 0000 = Endpoint number: 0
    URB transfer type: URB_CONTROL (0x02)
    Packet Data Length: 8
    [Response in: 189]
    Control transfer stage: Setup (0)
    [bInterfaceClass: Unknown (0xffff)]
URB setup
    bmRequestType: 0x41
    bRequest: 7
    wValue: 0x0100
    wIndex: 0 (0x0000)
    wLength: 0

No.     Time           Source                Destination           Protocol Length Info
    187 0.331883       1.6.0                 host                  USB      29     URB_CONTROL in

Frame 187: 29 bytes on wire (232 bits), 29 bytes captured (232 bits) on interface 0
USB URB
    [Source: 1.6.0]
    [Destination: host]
    USBPcap pseudoheader length: 28
    IRP ID: 0xffff80030cff8890
    IRP USBD_STATUS: USBD_STATUS_SUCCESS (0x00000000)
    URB Function: URB_FUNCTION_CONTROL_TRANSFER (0x0008)
    IRP information: 0x01, Direction: PDO -> FDO
        0000 000. = Reserved: 0x00
        .... ...1 = Direction: PDO -> FDO (0x1)
    URB bus id: 1
    Device address: 6
    Endpoint: 0x80, Direction: IN
        1... .... = Direction: IN (1)
        .... 0000 = Endpoint number: 0
    URB transfer type: URB_CONTROL (0x02)
    Packet Data Length: 1
    [Request in: 185]
    [Time from request: 0.000120000 seconds]
    Control transfer stage: Data (1)
    [bInterfaceClass: Unknown (0xffff)]
CONTROL response data: 00

No.     Time           Source                Destination           Protocol Length Info
    188 0.331884       1.6.0                 host                  USB      28     GET CONFIGURATION Status

Frame 188: 28 bytes on wire (224 bits), 28 bytes captured (224 bits) on interface 0
USB URB
    [Source: 1.6.0]
    [Destination: host]
    USBPcap pseudoheader length: 28
    IRP ID: 0xffff80030cff8890
    IRP USBD_STATUS: USBD_STATUS_SUCCESS (0x00000000)
    URB Function: URB_FUNCTION_CONTROL_TRANSFER (0x0008)
    IRP information: 0x01, Direction: PDO -> FDO
        0000 000. = Reserved: 0x00
        .... ...1 = Direction: PDO -> FDO (0x1)
    URB bus id: 1
    Device address: 6
    Endpoint: 0x80, Direction: IN
        1... .... = Direction: IN (1)
        .... 0000 = Endpoint number: 0
    URB transfer type: URB_CONTROL (0x02)
    Packet Data Length: 0
    [Request in: 185]
    [Time from request: 0.000121000 seconds]
    Control transfer stage: Status (2)

No.     Time           Source                Destination           Protocol Length Info
    189 0.331932       1.6.0                 host                  USB      28     SET DESCRIPTOR Status

Frame 189: 28 bytes on wire (224 bits), 28 bytes captured (224 bits) on interface 0
USB URB
    [Source: 1.6.0]
    [Destination: host]
    USBPcap pseudoheader length: 28
    IRP ID: 0xffff800307b03af0
    IRP USBD_STATUS: USBD_STATUS_SUCCESS (0x00000000)
    URB Function: URB_FUNCTION_CONTROL_TRANSFER (0x0008)
    IRP information: 0x01, Direction: PDO -> FDO
        0000 000. = Reserved: 0x00
        .... ...1 = Direction: PDO -> FDO (0x1)
    URB bus id: 1
    Device address: 6
    Endpoint: 0x00, Direction: OUT
        0... .... = Direction: OUT (0)
        .... 0000 = Endpoint number: 0
    URB transfer type: URB_CONTROL (0x02)
    Packet Data Length: 0
    [Request in: 186]
    [Time from request: 0.000161000 seconds]
    Control transfer stage: Status (2)

No.     Time           Source                Destination           Protocol Length Info
    190 0.331940       host                  1.6.0                 USB      36     URB_CONTROL in

Frame 190: 36 bytes on wire (288 bits), 36 bytes captured (288 bits) on interface 0
USB URB
    [Source: host]
    [Destination: 1.6.0]
    USBPcap pseudoheader length: 28
    IRP ID: 0xffff80030cff8890
    IRP USBD_STATUS: USBD_STATUS_SUCCESS (0x00000000)
    URB Function: URB_FUNCTION_CONTROL_TRANSFER (0x0008)
    IRP information: 0x00, Direction: FDO -> PDO
        0000 000. = Reserved: 0x00
        .... ...0 = Direction: FDO -> PDO (0x0)
    URB bus id: 1
    Device address: 6
    Endpoint: 0x80, Direction: IN
        1... .... = Direction: IN (1)
        .... 0000 = Endpoint number: 0
    URB transfer type: URB_CONTROL (0x02)
    Packet Data Length: 8
    [Response in: 192]
    Control transfer stage: Setup (0)
    [bInterfaceClass: Unknown (0xffff)]
URB setup
    bmRequestType: 0xc1
    bRequest: 8
    wValue: 0x0000
    wIndex: 0 (0x0000)
    wLength: 4

No.     Time           Source                Destination           Protocol Length Info
    191 0.331955       host                  1.6.0                 USB      36     URB_CONTROL out

Frame 191: 36 bytes on wire (288 bits), 36 bytes captured (288 bits) on interface 0
USB URB
    [Source: host]
    [Destination: 1.6.0]
    USBPcap pseudoheader length: 28
    IRP ID: 0xffff800307a97690
    IRP USBD_STATUS: USBD_STATUS_SUCCESS (0x00000000)
    URB Function: URB_FUNCTION_CONTROL_TRANSFER (0x0008)
    IRP information: 0x00, Direction: FDO -> PDO
        0000 000. = Reserved: 0x00
        .... ...0 = Direction: FDO -> PDO (0x0)
    URB bus id: 1
    Device address: 6
    Endpoint: 0x00, Direction: OUT
        0... .... = Direction: OUT (0)
        .... 0000 = Endpoint number: 0
    URB transfer type: URB_CONTROL (0x02)
    Packet Data Length: 8
    [Response in: 194]
    Control transfer stage: Setup (0)
    [bInterfaceClass: Unknown (0xffff)]
URB setup
    bmRequestType: 0x41
    bRequest: 3
    wValue: 0x0800
    wIndex: 0 (0x0000)
    wLength: 0

No.     Time           Source                Destination           Protocol Length Info
    192 0.332060       1.6.0                 host                  USB      29     URB_CONTROL in

Frame 192: 29 bytes on wire (232 bits), 29 bytes captured (232 bits) on interface 0
USB URB
    [Source: 1.6.0]
    [Destination: host]
    USBPcap pseudoheader length: 28
    IRP ID: 0xffff80030cff8890
    IRP USBD_STATUS: USBD_STATUS_SUCCESS (0x00000000)
    URB Function: URB_FUNCTION_CONTROL_TRANSFER (0x0008)
    IRP information: 0x01, Direction: PDO -> FDO
        0000 000. = Reserved: 0x00
        .... ...1 = Direction: PDO -> FDO (0x1)
    URB bus id: 1
    Device address: 6
    Endpoint: 0x80, Direction: IN
        1... .... = Direction: IN (1)
        .... 0000 = Endpoint number: 0
    URB transfer type: URB_CONTROL (0x02)
    Packet Data Length: 1
    [Request in: 190]
    [Time from request: 0.000120000 seconds]
    Control transfer stage: Data (1)
    [bInterfaceClass: Unknown (0xffff)]
CONTROL response data: 00

No.     Time           Source                Destination           Protocol Length Info
    193 0.332061       1.6.0                 host                  USB      28     GET CONFIGURATION Status

Frame 193: 28 bytes on wire (224 bits), 28 bytes captured (224 bits) on interface 0
USB URB
    [Source: 1.6.0]
    [Destination: host]
    USBPcap pseudoheader length: 28
    IRP ID: 0xffff80030cff8890
    IRP USBD_STATUS: USBD_STATUS_SUCCESS (0x00000000)
    URB Function: URB_FUNCTION_CONTROL_TRANSFER (0x0008)
    IRP information: 0x01, Direction: PDO -> FDO
        0000 000. = Reserved: 0x00
        .... ...1 = Direction: PDO -> FDO (0x1)
    URB bus id: 1
    Device address: 6
    Endpoint: 0x80, Direction: IN
        1... .... = Direction: IN (1)
        .... 0000 = Endpoint number: 0
    URB transfer type: URB_CONTROL (0x02)
    Packet Data Length: 0
    [Request in: 190]
    [Time from request: 0.000121000 seconds]
    Control transfer stage: Status (2)

No.     Time           Source                Destination           Protocol Length Info
    194 0.332192       1.6.0                 host                  USB      28     SET FEATURE Status

Frame 194: 28 bytes on wire (224 bits), 28 bytes captured (224 bits) on interface 0
USB URB
    [Source: 1.6.0]
    [Destination: host]
    USBPcap pseudoheader length: 28
    IRP ID: 0xffff800307a97690
    IRP USBD_STATUS: USBD_STATUS_SUCCESS (0x00000000)
    URB Function: URB_FUNCTION_CONTROL_TRANSFER (0x0008)
    IRP information: 0x01, Direction: PDO -> FDO
        0000 000. = Reserved: 0x00
        .... ...1 = Direction: PDO -> FDO (0x1)
    URB bus id: 1
    Device address: 6
    Endpoint: 0x00, Direction: OUT
        0... .... = Direction: OUT (0)
        .... 0000 = Endpoint number: 0
    URB transfer type: URB_CONTROL (0x02)
    Packet Data Length: 0
    [Request in: 191]
    [Time from request: 0.000237000 seconds]
    Control transfer stage: Status (2)

No.     Time           Source                Destination           Protocol Length Info
    195 0.332208       host                  1.6.0                 USB      36     URB_CONTROL out

Frame 195: 36 bytes on wire (288 bits), 36 bytes captured (288 bits) on interface 0
USB URB
    [Source: host]
    [Destination: 1.6.0]
    USBPcap pseudoheader length: 28
    IRP ID: 0xffff800307a97690
    IRP USBD_STATUS: USBD_STATUS_SUCCESS (0x00000000)
    URB Function: URB_FUNCTION_CONTROL_TRANSFER (0x0008)
    IRP information: 0x00, Direction: FDO -> PDO
        0000 000. = Reserved: 0x00
        .... ...0 = Direction: FDO -> PDO (0x0)
    URB bus id: 1
    Device address: 6
    Endpoint: 0x00, Direction: OUT
        0... .... = Direction: OUT (0)
        .... 0000 = Endpoint number: 0
    URB transfer type: URB_CONTROL (0x02)
    Packet Data Length: 8
    [Response in: 196]
    Control transfer stage: Setup (0)
    [bInterfaceClass: Unknown (0xffff)]
URB setup
    bmRequestType: 0x41
    bRequest: 25
    wValue: 0x0000
    wIndex: 0 (0x0000)
    wLength: 6

No.     Time           Source                Destination           Protocol Length Info
    196 0.332386       1.6.0                 host                  USB      34     URB_CONTROL out

Frame 196: 34 bytes on wire (272 bits), 34 bytes captured (272 bits) on interface 0
USB URB
    [Source: 1.6.0]
    [Destination: host]
    USBPcap pseudoheader length: 28
    IRP ID: 0xffff800307a97690
    IRP USBD_STATUS: USBD_STATUS_SUCCESS (0x00000000)
    URB Function: URB_FUNCTION_CONTROL_TRANSFER (0x0008)
    IRP information: 0x01, Direction: PDO -> FDO
        0000 000. = Reserved: 0x00
        .... ...1 = Direction: PDO -> FDO (0x1)
    URB bus id: 1
    Device address: 6
    Endpoint: 0x00, Direction: OUT
        0... .... = Direction: OUT (0)
        .... 0000 = Endpoint number: 0
    URB transfer type: URB_CONTROL (0x02)
    Packet Data Length: 6
    [Request in: 195]
    [Time from request: 0.000178000 seconds]
    Control transfer stage: Data (1)
    [bInterfaceClass: Unknown (0xffff)]
CONTROL response data: 000000001113

No.     Time           Source                Destination           Protocol Length Info
    197 0.332411       1.6.0                 host                  USB      28     Unknown type 19 Status

Frame 197: 28 bytes on wire (224 bits), 28 bytes captured (224 bits) on interface 0
USB URB
    [Source: 1.6.0]
    [Destination: host]
    USBPcap pseudoheader length: 28
    IRP ID: 0xffff800307a97690
    IRP USBD_STATUS: USBD_STATUS_SUCCESS (0x00000000)
    URB Function: URB_FUNCTION_CONTROL_TRANSFER (0x0008)
    IRP information: 0x01, Direction: PDO -> FDO
        0000 000. = Reserved: 0x00
        .... ...1 = Direction: PDO -> FDO (0x1)
    URB bus id: 1
    Device address: 6
    Endpoint: 0x00, Direction: OUT
        0... .... = Direction: OUT (0)
        .... 0000 = Endpoint number: 0
    URB transfer type: URB_CONTROL (0x02)
    Packet Data Length: 0
    [Request in: 195]
    [Time from request: 0.000203000 seconds]
    Control transfer stage: Status (2)

No.     Time           Source                Destination           Protocol Length Info
    198 0.332424       host                  1.6.0                 USB      36     URB_CONTROL out

Frame 198: 36 bytes on wire (288 bits), 36 bytes captured (288 bits) on interface 0
USB URB
    [Source: host]
    [Destination: 1.6.0]
    USBPcap pseudoheader length: 28
    IRP ID: 0xffff800307a97690
    IRP USBD_STATUS: USBD_STATUS_SUCCESS (0x00000000)
    URB Function: URB_FUNCTION_CONTROL_TRANSFER (0x0008)
    IRP information: 0x00, Direction: FDO -> PDO
        0000 000. = Reserved: 0x00
        .... ...0 = Direction: FDO -> PDO (0x0)
    URB bus id: 1
    Device address: 6
    Endpoint: 0x00, Direction: OUT
        0... .... = Direction: OUT (0)
        .... 0000 = Endpoint number: 0
    URB transfer type: URB_CONTROL (0x02)
    Packet Data Length: 8
    [Response in: 199]
    Control transfer stage: Setup (0)
    [bInterfaceClass: Unknown (0xffff)]
URB setup
    bmRequestType: 0x41
    bRequest: 19
    wValue: 0x0000
    wIndex: 0 (0x0000)
    wLength: 16

No.     Time           Source                Destination           Protocol Length Info
    199 0.332574       1.6.0                 host                  USB      44     URB_CONTROL out

Frame 199: 44 bytes on wire (352 bits), 44 bytes captured (352 bits) on interface 0
USB URB
    [Source: 1.6.0]
    [Destination: host]
    USBPcap pseudoheader length: 28
    IRP ID: 0xffff800307a97690
    IRP USBD_STATUS: USBD_STATUS_SUCCESS (0x00000000)
    URB Function: URB_FUNCTION_CONTROL_TRANSFER (0x0008)
    IRP information: 0x01, Direction: PDO -> FDO
        0000 000. = Reserved: 0x00
        .... ...1 = Direction: PDO -> FDO (0x1)
    URB bus id: 1
    Device address: 6
    Endpoint: 0x00, Direction: OUT
        0... .... = Direction: OUT (0)
        .... 0000 = Endpoint number: 0
    URB transfer type: URB_CONTROL (0x02)
    Packet Data Length: 16
    [Request in: 198]
    [Time from request: 0.000150000 seconds]
    Control transfer stage: Data (1)
    [bInterfaceClass: Unknown (0xffff)]
CONTROL response data: 00000000000000003200000034000000

No.     Time           Source                Destination           Protocol Length Info
    200 0.332574       1.6.0                 host                  USB      28     Unknown type 13 Status

Frame 200: 28 bytes on wire (224 bits), 28 bytes captured (224 bits) on interface 0
USB URB
    [Source: 1.6.0]
    [Destination: host]
    USBPcap pseudoheader length: 28
    IRP ID: 0xffff800307a97690
    IRP USBD_STATUS: USBD_STATUS_SUCCESS (0x00000000)
    URB Function: URB_FUNCTION_CONTROL_TRANSFER (0x0008)
    IRP information: 0x01, Direction: PDO -> FDO
        0000 000. = Reserved: 0x00
        .... ...1 = Direction: PDO -> FDO (0x1)
    URB bus id: 1
    Device address: 6
    Endpoint: 0x00, Direction: OUT
        0... .... = Direction: OUT (0)
        .... 0000 = Endpoint number: 0
    URB transfer type: URB_CONTROL (0x02)
    Packet Data Length: 0
    [Request in: 198]
    [Time from request: 0.000150000 seconds]
    Control transfer stage: Status (2)

No.     Time           Source                Destination           Protocol Length Info
    201 0.333040       host                  1.6.0                 USB      36     URB_CONTROL out

Frame 201: 36 bytes on wire (288 bits), 36 bytes captured (288 bits) on interface 0
USB URB
    [Source: host]
    [Destination: 1.6.0]
    USBPcap pseudoheader length: 28
    IRP ID: 0xffff800307a97690
    IRP USBD_STATUS: USBD_STATUS_SUCCESS (0x00000000)
    URB Function: URB_FUNCTION_CONTROL_TRANSFER (0x0008)
    IRP information: 0x00, Direction: FDO -> PDO
        0000 000. = Reserved: 0x00
        .... ...0 = Direction: FDO -> PDO (0x0)
    URB bus id: 1
    Device address: 6
    Endpoint: 0x00, Direction: OUT
        0... .... = Direction: OUT (0)
        .... 0000 = Endpoint number: 0
    URB transfer type: URB_CONTROL (0x02)
    Packet Data Length: 8
    [Response in: 202]
    Control transfer stage: Setup (0)
    [bInterfaceClass: Unknown (0xffff)]
URB setup
    bmRequestType: 0x41
    bRequest: 30
    wValue: 0x0000
    wIndex: 0 (0x0000)
    wLength: 4

No.     Time           Source                Destination           Protocol Length Info
    202 0.333220       1.6.0                 host                  USB      32     URB_CONTROL out

Frame 202: 32 bytes on wire (256 bits), 32 bytes captured (256 bits) on interface 0
USB URB
    [Source: 1.6.0]
    [Destination: host]
    USBPcap pseudoheader length: 28
    IRP ID: 0xffff800307a97690
    IRP USBD_STATUS: USBD_STATUS_SUCCESS (0x00000000)
    URB Function: URB_FUNCTION_CONTROL_TRANSFER (0x0008)
    IRP information: 0x01, Direction: PDO -> FDO
        0000 000. = Reserved: 0x00
        .... ...1 = Direction: PDO -> FDO (0x1)
    URB bus id: 1
    Device address: 6
    Endpoint: 0x00, Direction: OUT
        0... .... = Direction: OUT (0)
        .... 0000 = Endpoint number: 0
    URB transfer type: URB_CONTROL (0x02)
    Packet Data Length: 4
    [Request in: 201]
    [Time from request: 0.000180000 seconds]
    Control transfer stage: Data (1)
    [bInterfaceClass: Unknown (0xffff)]
CONTROL response data: 00e10000

No.     Time           Source                Destination           Protocol Length Info
    203 0.333244       1.6.0                 host                  USB      28     Unknown type 1e Status

Frame 203: 28 bytes on wire (224 bits), 28 bytes captured (224 bits) on interface 0
USB URB
    [Source: 1.6.0]
    [Destination: host]
    USBPcap pseudoheader length: 28
    IRP ID: 0xffff800307a97690
    IRP USBD_STATUS: USBD_STATUS_SUCCESS (0x00000000)
    URB Function: URB_FUNCTION_CONTROL_TRANSFER (0x0008)
    IRP information: 0x01, Direction: PDO -> FDO
        0000 000. = Reserved: 0x00
        .... ...1 = Direction: PDO -> FDO (0x1)
    URB bus id: 1
    Device address: 6
    Endpoint: 0x00, Direction: OUT
        0... .... = Direction: OUT (0)
        .... 0000 = Endpoint number: 0
    URB transfer type: URB_CONTROL (0x02)
    Packet Data Length: 0
    [Request in: 201]
    [Time from request: 0.000204000 seconds]
    Control transfer stage: Status (2)

No.     Time           Source                Destination           Protocol Length Info
    204 0.333260       host                  1.6.0                 USB      36     URB_CONTROL out

Frame 204: 36 bytes on wire (288 bits), 36 bytes captured (288 bits) on interface 0
USB URB
    [Source: host]
    [Destination: 1.6.0]
    USBPcap pseudoheader length: 28
    IRP ID: 0xffff800307a97690
    IRP USBD_STATUS: USBD_STATUS_SUCCESS (0x00000000)
    URB Function: URB_FUNCTION_CONTROL_TRANSFER (0x0008)
    IRP information: 0x00, Direction: FDO -> PDO
        0000 000. = Reserved: 0x00
        .... ...0 = Direction: FDO -> PDO (0x0)
    URB bus id: 1
    Device address: 6
    Endpoint: 0x00, Direction: OUT
        0... .... = Direction: OUT (0)
        .... 0000 = Endpoint number: 0
    URB transfer type: URB_CONTROL (0x02)
    Packet Data Length: 8
    [Response in: 205]
    Control transfer stage: Setup (0)
    [bInterfaceClass: Unknown (0xffff)]
URB setup
    bmRequestType: 0x41
    bRequest: 7
    wValue: 0x0200
    wIndex: 0 (0x0000)
    wLength: 0

No.     Time           Source                Destination           Protocol Length Info
    205 0.333394       1.6.0                 host                  USB      28     SET DESCRIPTOR Status

Frame 205: 28 bytes on wire (224 bits), 28 bytes captured (224 bits) on interface 0
USB URB
    [Source: 1.6.0]
    [Destination: host]
    USBPcap pseudoheader length: 28
    IRP ID: 0xffff800307a97690
    IRP USBD_STATUS: USBD_STATUS_SUCCESS (0x00000000)
    URB Function: URB_FUNCTION_CONTROL_TRANSFER (0x0008)
    IRP information: 0x01, Direction: PDO -> FDO
        0000 000. = Reserved: 0x00
        .... ...1 = Direction: PDO -> FDO (0x1)
    URB bus id: 1
    Device address: 6
    Endpoint: 0x00, Direction: OUT
        0... .... = Direction: OUT (0)
        .... 0000 = Endpoint number: 0
    URB transfer type: URB_CONTROL (0x02)
    Packet Data Length: 0
    [Request in: 204]
    [Time from request: 0.000134000 seconds]
    Control transfer stage: Status (2)

No.     Time           Source                Destination           Protocol Length Info
    206 0.333402       host                  1.6.0                 USB      36     URB_CONTROL in

Frame 206: 36 bytes on wire (288 bits), 36 bytes captured (288 bits) on interface 0
USB URB
    [Source: host]
    [Destination: 1.6.0]
    USBPcap pseudoheader length: 28
    IRP ID: 0xffff800307a97690
    IRP USBD_STATUS: USBD_STATUS_SUCCESS (0x00000000)
    URB Function: URB_FUNCTION_CONTROL_TRANSFER (0x0008)
    IRP information: 0x00, Direction: FDO -> PDO
        0000 000. = Reserved: 0x00
        .... ...0 = Direction: FDO -> PDO (0x0)
    URB bus id: 1
    Device address: 6
    Endpoint: 0x80, Direction: IN
        1... .... = Direction: IN (1)
        .... 0000 = Endpoint number: 0
    URB transfer type: URB_CONTROL (0x02)
    Packet Data Length: 8
    [Response in: 208]
    Control transfer stage: Setup (0)
    [bInterfaceClass: Unknown (0xffff)]
URB setup
    bmRequestType: 0xc1
    bRequest: 8
    wValue: 0x0000
    wIndex: 0 (0x0000)
    wLength: 4

No.     Time           Source                Destination           Protocol Length Info
    207 0.333418       host                  1.6.0                 USB      36     URB_CONTROL out

Frame 207: 36 bytes on wire (288 bits), 36 bytes captured (288 bits) on interface 0
USB URB
    [Source: host]
    [Destination: 1.6.0]
    USBPcap pseudoheader length: 28
    IRP ID: 0xffff80030cff8890
    IRP USBD_STATUS: USBD_STATUS_SUCCESS (0x00000000)
    URB Function: URB_FUNCTION_CONTROL_TRANSFER (0x0008)
    IRP information: 0x00, Direction: FDO -> PDO
        0000 000. = Reserved: 0x00
        .... ...0 = Direction: FDO -> PDO (0x0)
    URB bus id: 1
    Device address: 6
    Endpoint: 0x00, Direction: OUT
        0... .... = Direction: OUT (0)
        .... 0000 = Endpoint number: 0
    URB transfer type: URB_CONTROL (0x02)
    Packet Data Length: 8
    [Response in: 210]
    Control transfer stage: Setup (0)
    [bInterfaceClass: Unknown (0xffff)]
URB setup
    bmRequestType: 0x41
    bRequest: 7
    wValue: 0x0100
    wIndex: 0 (0x0000)
    wLength: 0

No.     Time           Source                Destination           Protocol Length Info
    208 0.333522       1.6.0                 host                  USB      29     URB_CONTROL in

Frame 208: 29 bytes on wire (232 bits), 29 bytes captured (232 bits) on interface 0
USB URB
    [Source: 1.6.0]
    [Destination: host]
    USBPcap pseudoheader length: 28
    IRP ID: 0xffff800307a97690
    IRP USBD_STATUS: USBD_STATUS_SUCCESS (0x00000000)
    URB Function: URB_FUNCTION_CONTROL_TRANSFER (0x0008)
    IRP information: 0x01, Direction: PDO -> FDO
        0000 000. = Reserved: 0x00
        .... ...1 = Direction: PDO -> FDO (0x1)
    URB bus id: 1
    Device address: 6
    Endpoint: 0x80, Direction: IN
        1... .... = Direction: IN (1)
        .... 0000 = Endpoint number: 0
    URB transfer type: URB_CONTROL (0x02)
    Packet Data Length: 1
    [Request in: 206]
    [Time from request: 0.000120000 seconds]
    Control transfer stage: Data (1)
    [bInterfaceClass: Unknown (0xffff)]
CONTROL response data: 00

No.     Time           Source                Destination           Protocol Length Info
    209 0.333522       1.6.0                 host                  USB      28     GET CONFIGURATION Status

Frame 209: 28 bytes on wire (224 bits), 28 bytes captured (224 bits) on interface 0
USB URB
    [Source: 1.6.0]
    [Destination: host]
    USBPcap pseudoheader length: 28
    IRP ID: 0xffff800307a97690
    IRP USBD_STATUS: USBD_STATUS_SUCCESS (0x00000000)
    URB Function: URB_FUNCTION_CONTROL_TRANSFER (0x0008)
    IRP information: 0x01, Direction: PDO -> FDO
        0000 000. = Reserved: 0x00
        .... ...1 = Direction: PDO -> FDO (0x1)
    URB bus id: 1
    Device address: 6
    Endpoint: 0x80, Direction: IN
        1... .... = Direction: IN (1)
        .... 0000 = Endpoint number: 0
    URB transfer type: URB_CONTROL (0x02)
    Packet Data Length: 0
    [Request in: 206]
    [Time from request: 0.000120000 seconds]
    Control transfer stage: Status (2)

No.     Time           Source                Destination           Protocol Length Info
    210 0.333572       1.6.0                 host                  USB      28     SET DESCRIPTOR Status

Frame 210: 28 bytes on wire (224 bits), 28 bytes captured (224 bits) on interface 0
USB URB
    [Source: 1.6.0]
    [Destination: host]
    USBPcap pseudoheader length: 28
    IRP ID: 0xffff80030cff8890
    IRP USBD_STATUS: USBD_STATUS_SUCCESS (0x00000000)
    URB Function: URB_FUNCTION_CONTROL_TRANSFER (0x0008)
    IRP information: 0x01, Direction: PDO -> FDO
        0000 000. = Reserved: 0x00
        .... ...1 = Direction: PDO -> FDO (0x1)
    URB bus id: 1
    Device address: 6
    Endpoint: 0x00, Direction: OUT
        0... .... = Direction: OUT (0)
        .... 0000 = Endpoint number: 0
    URB transfer type: URB_CONTROL (0x02)
    Packet Data Length: 0
    [Request in: 207]
    [Time from request: 0.000154000 seconds]
    Control transfer stage: Status (2)

No.     Time           Source                Destination           Protocol Length Info
    211 0.333579       host                  1.6.0                 USB      36     URB_CONTROL in

Frame 211: 36 bytes on wire (288 bits), 36 bytes captured (288 bits) on interface 0
USB URB
    [Source: host]
    [Destination: 1.6.0]
    USBPcap pseudoheader length: 28
    IRP ID: 0xffff80030cff8890
    IRP USBD_STATUS: USBD_STATUS_SUCCESS (0x00000000)
    URB Function: URB_FUNCTION_CONTROL_TRANSFER (0x0008)
    IRP information: 0x00, Direction: FDO -> PDO
        0000 000. = Reserved: 0x00
        .... ...0 = Direction: FDO -> PDO (0x0)
    URB bus id: 1
    Device address: 6
    Endpoint: 0x80, Direction: IN
        1... .... = Direction: IN (1)
        .... 0000 = Endpoint number: 0
    URB transfer type: URB_CONTROL (0x02)
    Packet Data Length: 8
    [Response in: 213]
    Control transfer stage: Setup (0)
    [bInterfaceClass: Unknown (0xffff)]
URB setup
    bmRequestType: 0xc1
    bRequest: 8
    wValue: 0x0000
    wIndex: 0 (0x0000)
    wLength: 4

No.     Time           Source                Destination           Protocol Length Info
    212 0.333591       host                  1.6.0                 USB      36     URB_CONTROL out

Frame 212: 36 bytes on wire (288 bits), 36 bytes captured (288 bits) on interface 0
USB URB
    [Source: host]
    [Destination: 1.6.0]
    USBPcap pseudoheader length: 28
    IRP ID: 0xffff800307a97690
    IRP USBD_STATUS: USBD_STATUS_SUCCESS (0x00000000)
    URB Function: URB_FUNCTION_CONTROL_TRANSFER (0x0008)
    IRP information: 0x00, Direction: FDO -> PDO
        0000 000. = Reserved: 0x00
        .... ...0 = Direction: FDO -> PDO (0x0)
    URB bus id: 1
    Device address: 6
    Endpoint: 0x00, Direction: OUT
        0... .... = Direction: OUT (0)
        .... 0000 = Endpoint number: 0
    URB transfer type: URB_CONTROL (0x02)
    Packet Data Length: 8
    [Response in: 215]
    Control transfer stage: Setup (0)
    [bInterfaceClass: Unknown (0xffff)]
URB setup
    bmRequestType: 0x41
    bRequest: 3
    wValue: 0x0800
    wIndex: 0 (0x0000)
    wLength: 0

No.     Time           Source                Destination           Protocol Length Info
    213 0.333699       1.6.0                 host                  USB      29     URB_CONTROL in

Frame 213: 29 bytes on wire (232 bits), 29 bytes captured (232 bits) on interface 0
USB URB
    [Source: 1.6.0]
    [Destination: host]
    USBPcap pseudoheader length: 28
    IRP ID: 0xffff80030cff8890
    IRP USBD_STATUS: USBD_STATUS_SUCCESS (0x00000000)
    URB Function: URB_FUNCTION_CONTROL_TRANSFER (0x0008)
    IRP information: 0x01, Direction: PDO -> FDO
        0000 000. = Reserved: 0x00
        .... ...1 = Direction: PDO -> FDO (0x1)
    URB bus id: 1
    Device address: 6
    Endpoint: 0x80, Direction: IN
        1... .... = Direction: IN (1)
        .... 0000 = Endpoint number: 0
    URB transfer type: URB_CONTROL (0x02)
    Packet Data Length: 1
    [Request in: 211]
    [Time from request: 0.000120000 seconds]
    Control transfer stage: Data (1)
    [bInterfaceClass: Unknown (0xffff)]
CONTROL response data: 00

No.     Time           Source                Destination           Protocol Length Info
    214 0.333699       1.6.0                 host                  USB      28     GET CONFIGURATION Status

Frame 214: 28 bytes on wire (224 bits), 28 bytes captured (224 bits) on interface 0
USB URB
    [Source: 1.6.0]
    [Destination: host]
    USBPcap pseudoheader length: 28
    IRP ID: 0xffff80030cff8890
    IRP USBD_STATUS: USBD_STATUS_SUCCESS (0x00000000)
    URB Function: URB_FUNCTION_CONTROL_TRANSFER (0x0008)
    IRP information: 0x01, Direction: PDO -> FDO
        0000 000. = Reserved: 0x00
        .... ...1 = Direction: PDO -> FDO (0x1)
    URB bus id: 1
    Device address: 6
    Endpoint: 0x80, Direction: IN
        1... .... = Direction: IN (1)
        .... 0000 = Endpoint number: 0
    URB transfer type: URB_CONTROL (0x02)
    Packet Data Length: 0
    [Request in: 211]
    [Time from request: 0.000120000 seconds]
    Control transfer stage: Status (2)

No.     Time           Source                Destination           Protocol Length Info
    215 0.333830       1.6.0                 host                  USB      28     SET FEATURE Status

Frame 215: 28 bytes on wire (224 bits), 28 bytes captured (224 bits) on interface 0
USB URB
    [Source: 1.6.0]
    [Destination: host]
    USBPcap pseudoheader length: 28
    IRP ID: 0xffff800307a97690
    IRP USBD_STATUS: USBD_STATUS_SUCCESS (0x00000000)
    URB Function: URB_FUNCTION_CONTROL_TRANSFER (0x0008)
    IRP information: 0x01, Direction: PDO -> FDO
        0000 000. = Reserved: 0x00
        .... ...1 = Direction: PDO -> FDO (0x1)
    URB bus id: 1
    Device address: 6
    Endpoint: 0x00, Direction: OUT
        0... .... = Direction: OUT (0)
        .... 0000 = Endpoint number: 0
    URB transfer type: URB_CONTROL (0x02)
    Packet Data Length: 0
    [Request in: 212]
    [Time from request: 0.000239000 seconds]
    Control transfer stage: Status (2)

No.     Time           Source                Destination           Protocol Length Info
    216 0.333867       host                  1.6.0                 USB      36     URB_CONTROL out

Frame 216: 36 bytes on wire (288 bits), 36 bytes captured (288 bits) on interface 0
USB URB
    [Source: host]
    [Destination: 1.6.0]
    USBPcap pseudoheader length: 28
    IRP ID: 0xffff800307a97690
    IRP USBD_STATUS: USBD_STATUS_SUCCESS (0x00000000)
    URB Function: URB_FUNCTION_CONTROL_TRANSFER (0x0008)
    IRP information: 0x00, Direction: FDO -> PDO
        0000 000. = Reserved: 0x00
        .... ...0 = Direction: FDO -> PDO (0x0)
    URB bus id: 1
    Device address: 6
    Endpoint: 0x00, Direction: OUT
        0... .... = Direction: OUT (0)
        .... 0000 = Endpoint number: 0
    URB transfer type: URB_CONTROL (0x02)
    Packet Data Length: 8
    [Response in: 217]
    Control transfer stage: Setup (0)
    [bInterfaceClass: Unknown (0xffff)]
URB setup
    bmRequestType: 0x41
    bRequest: 25
    wValue: 0x0000
    wIndex: 0 (0x0000)
    wLength: 6

No.     Time           Source                Destination           Protocol Length Info
    217 0.333998       1.6.0                 host                  USB      34     URB_CONTROL out

Frame 217: 34 bytes on wire (272 bits), 34 bytes captured (272 bits) on interface 0
USB URB
    [Source: 1.6.0]
    [Destination: host]
    USBPcap pseudoheader length: 28
    IRP ID: 0xffff800307a97690
    IRP USBD_STATUS: USBD_STATUS_SUCCESS (0x00000000)
    URB Function: URB_FUNCTION_CONTROL_TRANSFER (0x0008)
    IRP information: 0x01, Direction: PDO -> FDO
        0000 000. = Reserved: 0x00
        .... ...1 = Direction: PDO -> FDO (0x1)
    URB bus id: 1
    Device address: 6
    Endpoint: 0x00, Direction: OUT
        0... .... = Direction: OUT (0)
        .... 0000 = Endpoint number: 0
    URB transfer type: URB_CONTROL (0x02)
    Packet Data Length: 6
    [Request in: 216]
    [Time from request: 0.000131000 seconds]
    Control transfer stage: Data (1)
    [bInterfaceClass: Unknown (0xffff)]
CONTROL response data: 000000001113

No.     Time           Source                Destination           Protocol Length Info
    218 0.333999       1.6.0                 host                  USB      28     Unknown type 19 Status

Frame 218: 28 bytes on wire (224 bits), 28 bytes captured (224 bits) on interface 0
USB URB
    [Source: 1.6.0]
    [Destination: host]
    USBPcap pseudoheader length: 28
    IRP ID: 0xffff800307a97690
    IRP USBD_STATUS: USBD_STATUS_SUCCESS (0x00000000)
    URB Function: URB_FUNCTION_CONTROL_TRANSFER (0x0008)
    IRP information: 0x01, Direction: PDO -> FDO
        0000 000. = Reserved: 0x00
        .... ...1 = Direction: PDO -> FDO (0x1)
    URB bus id: 1
    Device address: 6
    Endpoint: 0x00, Direction: OUT
        0... .... = Direction: OUT (0)
        .... 0000 = Endpoint number: 0
    URB transfer type: URB_CONTROL (0x02)
    Packet Data Length: 0
    [Request in: 216]
    [Time from request: 0.000132000 seconds]
    Control transfer stage: Status (2)

No.     Time           Source                Destination           Protocol Length Info
    219 0.334011       host                  1.6.0                 USB      36     URB_CONTROL out

Frame 219: 36 bytes on wire (288 bits), 36 bytes captured (288 bits) on interface 0
USB URB
    [Source: host]
    [Destination: 1.6.0]
    USBPcap pseudoheader length: 28
    IRP ID: 0xffff800307a97690
    IRP USBD_STATUS: USBD_STATUS_SUCCESS (0x00000000)
    URB Function: URB_FUNCTION_CONTROL_TRANSFER (0x0008)
    IRP information: 0x00, Direction: FDO -> PDO
        0000 000. = Reserved: 0x00
        .... ...0 = Direction: FDO -> PDO (0x0)
    URB bus id: 1
    Device address: 6
    Endpoint: 0x00, Direction: OUT
        0... .... = Direction: OUT (0)
        .... 0000 = Endpoint number: 0
    URB transfer type: URB_CONTROL (0x02)
    Packet Data Length: 8
    [Response in: 220]
    Control transfer stage: Setup (0)
    [bInterfaceClass: Unknown (0xffff)]
URB setup
    bmRequestType: 0x41
    bRequest: 19
    wValue: 0x0000
    wIndex: 0 (0x0000)
    wLength: 16

No.     Time           Source                Destination           Protocol Length Info
    220 0.334117       1.6.0                 host                  USB      44     URB_CONTROL out

Frame 220: 44 bytes on wire (352 bits), 44 bytes captured (352 bits) on interface 0
USB URB
    [Source: 1.6.0]
    [Destination: host]
    USBPcap pseudoheader length: 28
    IRP ID: 0xffff800307a97690
    IRP USBD_STATUS: USBD_STATUS_SUCCESS (0x00000000)
    URB Function: URB_FUNCTION_CONTROL_TRANSFER (0x0008)
    IRP information: 0x01, Direction: PDO -> FDO
        0000 000. = Reserved: 0x00
        .... ...1 = Direction: PDO -> FDO (0x1)
    URB bus id: 1
    Device address: 6
    Endpoint: 0x00, Direction: OUT
        0... .... = Direction: OUT (0)
        .... 0000 = Endpoint number: 0
    URB transfer type: URB_CONTROL (0x02)
    Packet Data Length: 16
    [Request in: 219]
    [Time from request: 0.000106000 seconds]
    Control transfer stage: Data (1)
    [bInterfaceClass: Unknown (0xffff)]
CONTROL response data: 00000000000000003200000034000000

No.     Time           Source                Destination           Protocol Length Info
    221 0.334117       1.6.0                 host                  USB      28     Unknown type 13 Status

Frame 221: 28 bytes on wire (224 bits), 28 bytes captured (224 bits) on interface 0
USB URB
    [Source: 1.6.0]
    [Destination: host]
    USBPcap pseudoheader length: 28
    IRP ID: 0xffff800307a97690
    IRP USBD_STATUS: USBD_STATUS_SUCCESS (0x00000000)
    URB Function: URB_FUNCTION_CONTROL_TRANSFER (0x0008)
    IRP information: 0x01, Direction: PDO -> FDO
        0000 000. = Reserved: 0x00
        .... ...1 = Direction: PDO -> FDO (0x1)
    URB bus id: 1
    Device address: 6
    Endpoint: 0x00, Direction: OUT
        0... .... = Direction: OUT (0)
        .... 0000 = Endpoint number: 0
    URB transfer type: URB_CONTROL (0x02)
    Packet Data Length: 0
    [Request in: 219]
    [Time from request: 0.000106000 seconds]
    Control transfer stage: Status (2)

No.     Time           Source                Destination           Protocol Length Info
    222 0.334209       host                  1.6.0                 USB      36     URB_CONTROL out

Frame 222: 36 bytes on wire (288 bits), 36 bytes captured (288 bits) on interface 0
USB URB
    [Source: host]
    [Destination: 1.6.0]
    USBPcap pseudoheader length: 28
    IRP ID: 0xffff800306e436e0
    IRP USBD_STATUS: USBD_STATUS_SUCCESS (0x00000000)
    URB Function: URB_FUNCTION_CONTROL_TRANSFER (0x0008)
    IRP information: 0x00, Direction: FDO -> PDO
        0000 000. = Reserved: 0x00
        .... ...0 = Direction: FDO -> PDO (0x0)
    URB bus id: 1
    Device address: 6
    Endpoint: 0x00, Direction: OUT
        0... .... = Direction: OUT (0)
        .... 0000 = Endpoint number: 0
    URB transfer type: URB_CONTROL (0x02)
    Packet Data Length: 8
    [Response in: 223]
    Control transfer stage: Setup (0)
    [bInterfaceClass: Unknown (0xffff)]
URB setup
    bmRequestType: 0x41
    bRequest: 30
    wValue: 0x0000
    wIndex: 0 (0x0000)
    wLength: 4

No.     Time           Source                Destination           Protocol Length Info
    223 0.334352       1.6.0                 host                  USB      32     URB_CONTROL out

Frame 223: 32 bytes on wire (256 bits), 32 bytes captured (256 bits) on interface 0
USB URB
    [Source: 1.6.0]
    [Destination: host]
    USBPcap pseudoheader length: 28
    IRP ID: 0xffff800306e436e0
    IRP USBD_STATUS: USBD_STATUS_SUCCESS (0x00000000)
    URB Function: URB_FUNCTION_CONTROL_TRANSFER (0x0008)
    IRP information: 0x01, Direction: PDO -> FDO
        0000 000. = Reserved: 0x00
        .... ...1 = Direction: PDO -> FDO (0x1)
    URB bus id: 1
    Device address: 6
    Endpoint: 0x00, Direction: OUT
        0... .... = Direction: OUT (0)
        .... 0000 = Endpoint number: 0
    URB transfer type: URB_CONTROL (0x02)
    Packet Data Length: 4
    [Request in: 222]
    [Time from request: 0.000143000 seconds]
    Control transfer stage: Data (1)
    [bInterfaceClass: Unknown (0xffff)]
CONTROL response data: 00e10000

No.     Time           Source                Destination           Protocol Length Info
    224 0.334371       1.6.0                 host                  USB      28     Unknown type 1e Status

Frame 224: 28 bytes on wire (224 bits), 28 bytes captured (224 bits) on interface 0
USB URB
    [Source: 1.6.0]
    [Destination: host]
    USBPcap pseudoheader length: 28
    IRP ID: 0xffff800306e436e0
    IRP USBD_STATUS: USBD_STATUS_SUCCESS (0x00000000)
    URB Function: URB_FUNCTION_CONTROL_TRANSFER (0x0008)
    IRP information: 0x01, Direction: PDO -> FDO
        0000 000. = Reserved: 0x00
        .... ...1 = Direction: PDO -> FDO (0x1)
    URB bus id: 1
    Device address: 6
    Endpoint: 0x00, Direction: OUT
        0... .... = Direction: OUT (0)
        .... 0000 = Endpoint number: 0
    URB transfer type: URB_CONTROL (0x02)
    Packet Data Length: 0
    [Request in: 222]
    [Time from request: 0.000162000 seconds]
    Control transfer stage: Status (2)

No.     Time           Source                Destination           Protocol Length Info
    225 0.334385       host                  1.6.0                 USB      36     URB_CONTROL out

Frame 225: 36 bytes on wire (288 bits), 36 bytes captured (288 bits) on interface 0
USB URB
    [Source: host]
    [Destination: 1.6.0]
    USBPcap pseudoheader length: 28
    IRP ID: 0xffff800307b03af0
    IRP USBD_STATUS: USBD_STATUS_SUCCESS (0x00000000)
    URB Function: URB_FUNCTION_CONTROL_TRANSFER (0x0008)
    IRP information: 0x00, Direction: FDO -> PDO
        0000 000. = Reserved: 0x00
        .... ...0 = Direction: FDO -> PDO (0x0)
    URB bus id: 1
    Device address: 6
    Endpoint: 0x00, Direction: OUT
        0... .... = Direction: OUT (0)
        .... 0000 = Endpoint number: 0
    URB transfer type: URB_CONTROL (0x02)
    Packet Data Length: 8
    [Response in: 226]
    Control transfer stage: Setup (0)
    [bInterfaceClass: Unknown (0xffff)]
URB setup
    bmRequestType: 0x41
    bRequest: 7
    wValue: 0x0200
    wIndex: 0 (0x0000)
    wLength: 0

No.     Time           Source                Destination           Protocol Length Info
    226 0.334425       1.6.0                 host                  USB      28     SET DESCRIPTOR Status

Frame 226: 28 bytes on wire (224 bits), 28 bytes captured (224 bits) on interface 0
USB URB
    [Source: 1.6.0]
    [Destination: host]
    USBPcap pseudoheader length: 28
    IRP ID: 0xffff800307b03af0
    IRP USBD_STATUS: USBD_STATUS_SUCCESS (0x00000000)
    URB Function: URB_FUNCTION_CONTROL_TRANSFER (0x0008)
    IRP information: 0x01, Direction: PDO -> FDO
        0000 000. = Reserved: 0x00
        .... ...1 = Direction: PDO -> FDO (0x1)
    URB bus id: 1
    Device address: 6
    Endpoint: 0x00, Direction: OUT
        0... .... = Direction: OUT (0)
        .... 0000 = Endpoint number: 0
    URB transfer type: URB_CONTROL (0x02)
    Packet Data Length: 0
    [Request in: 225]
    [Time from request: 0.000040000 seconds]
    Control transfer stage: Status (2)

No.     Time           Source                Destination           Protocol Length Info
    227 0.334434       host                  1.6.0                 USB      36     URB_CONTROL in

Frame 227: 36 bytes on wire (288 bits), 36 bytes captured (288 bits) on interface 0
USB URB
    [Source: host]
    [Destination: 1.6.0]
    USBPcap pseudoheader length: 28
    IRP ID: 0xffff800307a97690
    IRP USBD_STATUS: USBD_STATUS_SUCCESS (0x00000000)
    URB Function: URB_FUNCTION_CONTROL_TRANSFER (0x0008)
    IRP information: 0x00, Direction: FDO -> PDO
        0000 000. = Reserved: 0x00
        .... ...0 = Direction: FDO -> PDO (0x0)
    URB bus id: 1
    Device address: 6
    Endpoint: 0x80, Direction: IN
        1... .... = Direction: IN (1)
        .... 0000 = Endpoint number: 0
    URB transfer type: URB_CONTROL (0x02)
    Packet Data Length: 8
    [Response in: 229]
    Control transfer stage: Setup (0)
    [bInterfaceClass: Unknown (0xffff)]
URB setup
    bmRequestType: 0xc1
    bRequest: 8
    wValue: 0x0000
    wIndex: 0 (0x0000)
    wLength: 4

No.     Time           Source                Destination           Protocol Length Info
    228 0.334441       host                  1.6.0                 USB      36     URB_CONTROL out

Frame 228: 36 bytes on wire (288 bits), 36 bytes captured (288 bits) on interface 0
USB URB
    [Source: host]
    [Destination: 1.6.0]
    USBPcap pseudoheader length: 28
    IRP ID: 0xffff800307b03af0
    IRP USBD_STATUS: USBD_STATUS_SUCCESS (0x00000000)
    URB Function: URB_FUNCTION_CONTROL_TRANSFER (0x0008)
    IRP information: 0x00, Direction: FDO -> PDO
        0000 000. = Reserved: 0x00
        .... ...0 = Direction: FDO -> PDO (0x0)
    URB bus id: 1
    Device address: 6
    Endpoint: 0x00, Direction: OUT
        0... .... = Direction: OUT (0)
        .... 0000 = Endpoint number: 0
    URB transfer type: URB_CONTROL (0x02)
    Packet Data Length: 8
    [Response in: 231]
    Control transfer stage: Setup (0)
    [bInterfaceClass: Unknown (0xffff)]
URB setup
    bmRequestType: 0x41
    bRequest: 7
    wValue: 0x0100
    wIndex: 0 (0x0000)
    wLength: 0

No.     Time           Source                Destination           Protocol Length Info
    229 0.334550       1.6.0                 host                  USB      29     URB_CONTROL in

Frame 229: 29 bytes on wire (232 bits), 29 bytes captured (232 bits) on interface 0
USB URB
    [Source: 1.6.0]
    [Destination: host]
    USBPcap pseudoheader length: 28
    IRP ID: 0xffff800307a97690
    IRP USBD_STATUS: USBD_STATUS_SUCCESS (0x00000000)
    URB Function: URB_FUNCTION_CONTROL_TRANSFER (0x0008)
    IRP information: 0x01, Direction: PDO -> FDO
        0000 000. = Reserved: 0x00
        .... ...1 = Direction: PDO -> FDO (0x1)
    URB bus id: 1
    Device address: 6
    Endpoint: 0x80, Direction: IN
        1... .... = Direction: IN (1)
        .... 0000 = Endpoint number: 0
    URB transfer type: URB_CONTROL (0x02)
    Packet Data Length: 1
    [Request in: 227]
    [Time from request: 0.000116000 seconds]
    Control transfer stage: Data (1)
    [bInterfaceClass: Unknown (0xffff)]
CONTROL response data: 00

No.     Time           Source                Destination           Protocol Length Info
    230 0.334551       1.6.0                 host                  USB      28     GET CONFIGURATION Status

Frame 230: 28 bytes on wire (224 bits), 28 bytes captured (224 bits) on interface 0
USB URB
    [Source: 1.6.0]
    [Destination: host]
    USBPcap pseudoheader length: 28
    IRP ID: 0xffff800307a97690
    IRP USBD_STATUS: USBD_STATUS_SUCCESS (0x00000000)
    URB Function: URB_FUNCTION_CONTROL_TRANSFER (0x0008)
    IRP information: 0x01, Direction: PDO -> FDO
        0000 000. = Reserved: 0x00
        .... ...1 = Direction: PDO -> FDO (0x1)
    URB bus id: 1
    Device address: 6
    Endpoint: 0x80, Direction: IN
        1... .... = Direction: IN (1)
        .... 0000 = Endpoint number: 0
    URB transfer type: URB_CONTROL (0x02)
    Packet Data Length: 0
    [Request in: 227]
    [Time from request: 0.000117000 seconds]
    Control transfer stage: Status (2)

No.     Time           Source                Destination           Protocol Length Info
    231 0.334598       1.6.0                 host                  USB      28     SET DESCRIPTOR Status

Frame 231: 28 bytes on wire (224 bits), 28 bytes captured (224 bits) on interface 0
USB URB
    [Source: 1.6.0]
    [Destination: host]
    USBPcap pseudoheader length: 28
    IRP ID: 0xffff800307b03af0
    IRP USBD_STATUS: USBD_STATUS_SUCCESS (0x00000000)
    URB Function: URB_FUNCTION_CONTROL_TRANSFER (0x0008)
    IRP information: 0x01, Direction: PDO -> FDO
        0000 000. = Reserved: 0x00
        .... ...1 = Direction: PDO -> FDO (0x1)
    URB bus id: 1
    Device address: 6
    Endpoint: 0x00, Direction: OUT
        0... .... = Direction: OUT (0)
        .... 0000 = Endpoint number: 0
    URB transfer type: URB_CONTROL (0x02)
    Packet Data Length: 0
    [Request in: 228]
    [Time from request: 0.000157000 seconds]
    Control transfer stage: Status (2)

No.     Time           Source                Destination           Protocol Length Info
    232 0.334606       host                  1.6.0                 USB      36     URB_CONTROL in

Frame 232: 36 bytes on wire (288 bits), 36 bytes captured (288 bits) on interface 0
USB URB
    [Source: host]
    [Destination: 1.6.0]
    USBPcap pseudoheader length: 28
    IRP ID: 0xffff800307a97690
    IRP USBD_STATUS: USBD_STATUS_SUCCESS (0x00000000)
    URB Function: URB_FUNCTION_CONTROL_TRANSFER (0x0008)
    IRP information: 0x00, Direction: FDO -> PDO
        0000 000. = Reserved: 0x00
        .... ...0 = Direction: FDO -> PDO (0x0)
    URB bus id: 1
    Device address: 6
    Endpoint: 0x80, Direction: IN
        1... .... = Direction: IN (1)
        .... 0000 = Endpoint number: 0
    URB transfer type: URB_CONTROL (0x02)
    Packet Data Length: 8
    [Response in: 234]
    Control transfer stage: Setup (0)
    [bInterfaceClass: Unknown (0xffff)]
URB setup
    bmRequestType: 0xc1
    bRequest: 8
    wValue: 0x0000
    wIndex: 0 (0x0000)
    wLength: 4

No.     Time           Source                Destination           Protocol Length Info
    233 0.334615       host                  1.6.0                 USB      36     URB_CONTROL out

Frame 233: 36 bytes on wire (288 bits), 36 bytes captured (288 bits) on interface 0
USB URB
    [Source: host]
    [Destination: 1.6.0]
    USBPcap pseudoheader length: 28
    IRP ID: 0xffff800307637af0
    IRP USBD_STATUS: USBD_STATUS_SUCCESS (0x00000000)
    URB Function: URB_FUNCTION_CONTROL_TRANSFER (0x0008)
    IRP information: 0x00, Direction: FDO -> PDO
        0000 000. = Reserved: 0x00
        .... ...0 = Direction: FDO -> PDO (0x0)
    URB bus id: 1
    Device address: 6
    Endpoint: 0x00, Direction: OUT
        0... .... = Direction: OUT (0)
        .... 0000 = Endpoint number: 0
    URB transfer type: URB_CONTROL (0x02)
    Packet Data Length: 8
    [Response in: 236]
    Control transfer stage: Setup (0)
    [bInterfaceClass: Unknown (0xffff)]
URB setup
    bmRequestType: 0x41
    bRequest: 3
    wValue: 0x0800
    wIndex: 0 (0x0000)
    wLength: 0

No.     Time           Source                Destination           Protocol Length Info
    234 0.334726       1.6.0                 host                  USB      29     URB_CONTROL in

Frame 234: 29 bytes on wire (232 bits), 29 bytes captured (232 bits) on interface 0
USB URB
    [Source: 1.6.0]
    [Destination: host]
    USBPcap pseudoheader length: 28
    IRP ID: 0xffff800307a97690
    IRP USBD_STATUS: USBD_STATUS_SUCCESS (0x00000000)
    URB Function: URB_FUNCTION_CONTROL_TRANSFER (0x0008)
    IRP information: 0x01, Direction: PDO -> FDO
        0000 000. = Reserved: 0x00
        .... ...1 = Direction: PDO -> FDO (0x1)
    URB bus id: 1
    Device address: 6
    Endpoint: 0x80, Direction: IN
        1... .... = Direction: IN (1)
        .... 0000 = Endpoint number: 0
    URB transfer type: URB_CONTROL (0x02)
    Packet Data Length: 1
    [Request in: 232]
    [Time from request: 0.000120000 seconds]
    Control transfer stage: Data (1)
    [bInterfaceClass: Unknown (0xffff)]
CONTROL response data: 00

No.     Time           Source                Destination           Protocol Length Info
    235 0.334727       1.6.0                 host                  USB      28     GET CONFIGURATION Status

Frame 235: 28 bytes on wire (224 bits), 28 bytes captured (224 bits) on interface 0
USB URB
    [Source: 1.6.0]
    [Destination: host]
    USBPcap pseudoheader length: 28
    IRP ID: 0xffff800307a97690
    IRP USBD_STATUS: USBD_STATUS_SUCCESS (0x00000000)
    URB Function: URB_FUNCTION_CONTROL_TRANSFER (0x0008)
    IRP information: 0x01, Direction: PDO -> FDO
        0000 000. = Reserved: 0x00
        .... ...1 = Direction: PDO -> FDO (0x1)
    URB bus id: 1
    Device address: 6
    Endpoint: 0x80, Direction: IN
        1... .... = Direction: IN (1)
        .... 0000 = Endpoint number: 0
    URB transfer type: URB_CONTROL (0x02)
    Packet Data Length: 0
    [Request in: 232]
    [Time from request: 0.000121000 seconds]
    Control transfer stage: Status (2)

No.     Time           Source                Destination           Protocol Length Info
    236 0.334858       1.6.0                 host                  USB      28     SET FEATURE Status

Frame 236: 28 bytes on wire (224 bits), 28 bytes captured (224 bits) on interface 0
USB URB
    [Source: 1.6.0]
    [Destination: host]
    USBPcap pseudoheader length: 28
    IRP ID: 0xffff800307637af0
    IRP USBD_STATUS: USBD_STATUS_SUCCESS (0x00000000)
    URB Function: URB_FUNCTION_CONTROL_TRANSFER (0x0008)
    IRP information: 0x01, Direction: PDO -> FDO
        0000 000. = Reserved: 0x00
        .... ...1 = Direction: PDO -> FDO (0x1)
    URB bus id: 1
    Device address: 6
    Endpoint: 0x00, Direction: OUT
        0... .... = Direction: OUT (0)
        .... 0000 = Endpoint number: 0
    URB transfer type: URB_CONTROL (0x02)
    Packet Data Length: 0
    [Request in: 233]
    [Time from request: 0.000243000 seconds]
    Control transfer stage: Status (2)

No.     Time           Source                Destination           Protocol Length Info
    237 0.334897       host                  1.6.0                 USB      36     URB_CONTROL out

Frame 237: 36 bytes on wire (288 bits), 36 bytes captured (288 bits) on interface 0
USB URB
    [Source: host]
    [Destination: 1.6.0]
    USBPcap pseudoheader length: 28
    IRP ID: 0xffff800307a97690
    IRP USBD_STATUS: USBD_STATUS_SUCCESS (0x00000000)
    URB Function: URB_FUNCTION_CONTROL_TRANSFER (0x0008)
    IRP information: 0x00, Direction: FDO -> PDO
        0000 000. = Reserved: 0x00
        .... ...0 = Direction: FDO -> PDO (0x0)
    URB bus id: 1
    Device address: 6
    Endpoint: 0x00, Direction: OUT
        0... .... = Direction: OUT (0)
        .... 0000 = Endpoint number: 0
    URB transfer type: URB_CONTROL (0x02)
    Packet Data Length: 8
    [Response in: 238]
    Control transfer stage: Setup (0)
    [bInterfaceClass: Unknown (0xffff)]
URB setup
    bmRequestType: 0x41
    bRequest: 25
    wValue: 0x0000
    wIndex: 0 (0x0000)
    wLength: 6

No.     Time           Source                Destination           Protocol Length Info
    238 0.335025       1.6.0                 host                  USB      34     URB_CONTROL out

Frame 238: 34 bytes on wire (272 bits), 34 bytes captured (272 bits) on interface 0
USB URB
    [Source: 1.6.0]
    [Destination: host]
    USBPcap pseudoheader length: 28
    IRP ID: 0xffff800307a97690
    IRP USBD_STATUS: USBD_STATUS_SUCCESS (0x00000000)
    URB Function: URB_FUNCTION_CONTROL_TRANSFER (0x0008)
    IRP information: 0x01, Direction: PDO -> FDO
        0000 000. = Reserved: 0x00
        .... ...1 = Direction: PDO -> FDO (0x1)
    URB bus id: 1
    Device address: 6
    Endpoint: 0x00, Direction: OUT
        0... .... = Direction: OUT (0)
        .... 0000 = Endpoint number: 0
    URB transfer type: URB_CONTROL (0x02)
    Packet Data Length: 6
    [Request in: 237]
    [Time from request: 0.000128000 seconds]
    Control transfer stage: Data (1)
    [bInterfaceClass: Unknown (0xffff)]
CONTROL response data: 000000001113

No.     Time           Source                Destination           Protocol Length Info
    239 0.335026       1.6.0                 host                  USB      28     Unknown type 19 Status

Frame 239: 28 bytes on wire (224 bits), 28 bytes captured (224 bits) on interface 0
USB URB
    [Source: 1.6.0]
    [Destination: host]
    USBPcap pseudoheader length: 28
    IRP ID: 0xffff800307a97690
    IRP USBD_STATUS: USBD_STATUS_SUCCESS (0x00000000)
    URB Function: URB_FUNCTION_CONTROL_TRANSFER (0x0008)
    IRP information: 0x01, Direction: PDO -> FDO
        0000 000. = Reserved: 0x00
        .... ...1 = Direction: PDO -> FDO (0x1)
    URB bus id: 1
    Device address: 6
    Endpoint: 0x00, Direction: OUT
        0... .... = Direction: OUT (0)
        .... 0000 = Endpoint number: 0
    URB transfer type: URB_CONTROL (0x02)
    Packet Data Length: 0
    [Request in: 237]
    [Time from request: 0.000129000 seconds]
    Control transfer stage: Status (2)

No.     Time           Source                Destination           Protocol Length Info
    240 0.335039       host                  1.6.0                 USB      36     URB_CONTROL out

Frame 240: 36 bytes on wire (288 bits), 36 bytes captured (288 bits) on interface 0
USB URB
    [Source: host]
    [Destination: 1.6.0]
    USBPcap pseudoheader length: 28
    IRP ID: 0xffff800307a97690
    IRP USBD_STATUS: USBD_STATUS_SUCCESS (0x00000000)
    URB Function: URB_FUNCTION_CONTROL_TRANSFER (0x0008)
    IRP information: 0x00, Direction: FDO -> PDO
        0000 000. = Reserved: 0x00
        .... ...0 = Direction: FDO -> PDO (0x0)
    URB bus id: 1
    Device address: 6
    Endpoint: 0x00, Direction: OUT
        0... .... = Direction: OUT (0)
        .... 0000 = Endpoint number: 0
    URB transfer type: URB_CONTROL (0x02)
    Packet Data Length: 8
    [Response in: 241]
    Control transfer stage: Setup (0)
    [bInterfaceClass: Unknown (0xffff)]
URB setup
    bmRequestType: 0x41
    bRequest: 19
    wValue: 0x0000
    wIndex: 0 (0x0000)
    wLength: 16

No.     Time           Source                Destination           Protocol Length Info
    241 0.335144       1.6.0                 host                  USB      44     URB_CONTROL out

Frame 241: 44 bytes on wire (352 bits), 44 bytes captured (352 bits) on interface 0
USB URB
    [Source: 1.6.0]
    [Destination: host]
    USBPcap pseudoheader length: 28
    IRP ID: 0xffff800307a97690
    IRP USBD_STATUS: USBD_STATUS_SUCCESS (0x00000000)
    URB Function: URB_FUNCTION_CONTROL_TRANSFER (0x0008)
    IRP information: 0x01, Direction: PDO -> FDO
        0000 000. = Reserved: 0x00
        .... ...1 = Direction: PDO -> FDO (0x1)
    URB bus id: 1
    Device address: 6
    Endpoint: 0x00, Direction: OUT
        0... .... = Direction: OUT (0)
        .... 0000 = Endpoint number: 0
    URB transfer type: URB_CONTROL (0x02)
    Packet Data Length: 16
    [Request in: 240]
    [Time from request: 0.000105000 seconds]
    Control transfer stage: Data (1)
    [bInterfaceClass: Unknown (0xffff)]
CONTROL response data: 00000000000000003200000034000000

No.     Time           Source                Destination           Protocol Length Info
    242 0.335170       1.6.0                 host                  USB      28     Unknown type 13 Status

Frame 242: 28 bytes on wire (224 bits), 28 bytes captured (224 bits) on interface 0
USB URB
    [Source: 1.6.0]
    [Destination: host]
    USBPcap pseudoheader length: 28
    IRP ID: 0xffff800307a97690
    IRP USBD_STATUS: USBD_STATUS_SUCCESS (0x00000000)
    URB Function: URB_FUNCTION_CONTROL_TRANSFER (0x0008)
    IRP information: 0x01, Direction: PDO -> FDO
        0000 000. = Reserved: 0x00
        .... ...1 = Direction: PDO -> FDO (0x1)
    URB bus id: 1
    Device address: 6
    Endpoint: 0x00, Direction: OUT
        0... .... = Direction: OUT (0)
        .... 0000 = Endpoint number: 0
    URB transfer type: URB_CONTROL (0x02)
    Packet Data Length: 0
    [Request in: 240]
    [Time from request: 0.000131000 seconds]
    Control transfer stage: Status (2)

No.     Time           Source                Destination           Protocol Length Info
    243 0.335224       host                  1.6.0                 USB      36     URB_CONTROL out

Frame 243: 36 bytes on wire (288 bits), 36 bytes captured (288 bits) on interface 0
USB URB
    [Source: host]
    [Destination: 1.6.0]
    USBPcap pseudoheader length: 28
    IRP ID: 0xffff800307a97690
    IRP USBD_STATUS: USBD_STATUS_SUCCESS (0x00000000)
    URB Function: URB_FUNCTION_CONTROL_TRANSFER (0x0008)
    IRP information: 0x00, Direction: FDO -> PDO
        0000 000. = Reserved: 0x00
        .... ...0 = Direction: FDO -> PDO (0x0)
    URB bus id: 1
    Device address: 6
    Endpoint: 0x00, Direction: OUT
        0... .... = Direction: OUT (0)
        .... 0000 = Endpoint number: 0
    URB transfer type: URB_CONTROL (0x02)
    Packet Data Length: 8
    [Response in: 244]
    Control transfer stage: Setup (0)
    [bInterfaceClass: Unknown (0xffff)]
URB setup
    bmRequestType: 0x41
    bRequest: 30
    wValue: 0x0000
    wIndex: 0 (0x0000)
    wLength: 4

No.     Time           Source                Destination           Protocol Length Info
    244 0.335408       1.6.0                 host                  USB      32     URB_CONTROL out

Frame 244: 32 bytes on wire (256 bits), 32 bytes captured (256 bits) on interface 0
USB URB
    [Source: 1.6.0]
    [Destination: host]
    USBPcap pseudoheader length: 28
    IRP ID: 0xffff800307a97690
    IRP USBD_STATUS: USBD_STATUS_SUCCESS (0x00000000)
    URB Function: URB_FUNCTION_CONTROL_TRANSFER (0x0008)
    IRP information: 0x01, Direction: PDO -> FDO
        0000 000. = Reserved: 0x00
        .... ...1 = Direction: PDO -> FDO (0x1)
    URB bus id: 1
    Device address: 6
    Endpoint: 0x00, Direction: OUT
        0... .... = Direction: OUT (0)
        .... 0000 = Endpoint number: 0
    URB transfer type: URB_CONTROL (0x02)
    Packet Data Length: 4
    [Request in: 243]
    [Time from request: 0.000184000 seconds]
    Control transfer stage: Data (1)
    [bInterfaceClass: Unknown (0xffff)]
CONTROL response data: 00e10000

No.     Time           Source                Destination           Protocol Length Info
    245 0.335431       1.6.0                 host                  USB      28     Unknown type 1e Status

Frame 245: 28 bytes on wire (224 bits), 28 bytes captured (224 bits) on interface 0
USB URB
    [Source: 1.6.0]
    [Destination: host]
    USBPcap pseudoheader length: 28
    IRP ID: 0xffff800307a97690
    IRP USBD_STATUS: USBD_STATUS_SUCCESS (0x00000000)
    URB Function: URB_FUNCTION_CONTROL_TRANSFER (0x0008)
    IRP information: 0x01, Direction: PDO -> FDO
        0000 000. = Reserved: 0x00
        .... ...1 = Direction: PDO -> FDO (0x1)
    URB bus id: 1
    Device address: 6
    Endpoint: 0x00, Direction: OUT
        0... .... = Direction: OUT (0)
        .... 0000 = Endpoint number: 0
    URB transfer type: URB_CONTROL (0x02)
    Packet Data Length: 0
    [Request in: 243]
    [Time from request: 0.000207000 seconds]
    Control transfer stage: Status (2)

No.     Time           Source                Destination           Protocol Length Info
    246 0.335445       host                  1.6.0                 USB      36     URB_CONTROL out

Frame 246: 36 bytes on wire (288 bits), 36 bytes captured (288 bits) on interface 0
USB URB
    [Source: host]
    [Destination: 1.6.0]
    USBPcap pseudoheader length: 28
    IRP ID: 0xffff800307a97690
    IRP USBD_STATUS: USBD_STATUS_SUCCESS (0x00000000)
    URB Function: URB_FUNCTION_CONTROL_TRANSFER (0x0008)
    IRP information: 0x00, Direction: FDO -> PDO
        0000 000. = Reserved: 0x00
        .... ...0 = Direction: FDO -> PDO (0x0)
    URB bus id: 1
    Device address: 6
    Endpoint: 0x00, Direction: OUT
        0... .... = Direction: OUT (0)
        .... 0000 = Endpoint number: 0
    URB transfer type: URB_CONTROL (0x02)
    Packet Data Length: 8
    [Response in: 247]
    Control transfer stage: Setup (0)
    [bInterfaceClass: Unknown (0xffff)]
URB setup
    bmRequestType: 0x41
    bRequest: 7
    wValue: 0x0200
    wIndex: 0 (0x0000)
    wLength: 0

No.     Time           Source                Destination           Protocol Length Info
    247 0.335482       1.6.0                 host                  USB      28     SET DESCRIPTOR Status

Frame 247: 28 bytes on wire (224 bits), 28 bytes captured (224 bits) on interface 0
USB URB
    [Source: 1.6.0]
    [Destination: host]
    USBPcap pseudoheader length: 28
    IRP ID: 0xffff800307a97690
    IRP USBD_STATUS: USBD_STATUS_SUCCESS (0x00000000)
    URB Function: URB_FUNCTION_CONTROL_TRANSFER (0x0008)
    IRP information: 0x01, Direction: PDO -> FDO
        0000 000. = Reserved: 0x00
        .... ...1 = Direction: PDO -> FDO (0x1)
    URB bus id: 1
    Device address: 6
    Endpoint: 0x00, Direction: OUT
        0... .... = Direction: OUT (0)
        .... 0000 = Endpoint number: 0
    URB transfer type: URB_CONTROL (0x02)
    Packet Data Length: 0
    [Request in: 246]
    [Time from request: 0.000037000 seconds]
    Control transfer stage: Status (2)

No.     Time           Source                Destination           Protocol Length Info
    248 0.335489       host                  1.6.0                 USB      36     URB_CONTROL in

Frame 248: 36 bytes on wire (288 bits), 36 bytes captured (288 bits) on interface 0
USB URB
    [Source: host]
    [Destination: 1.6.0]
    USBPcap pseudoheader length: 28
    IRP ID: 0xffff800307a97690
    IRP USBD_STATUS: USBD_STATUS_SUCCESS (0x00000000)
    URB Function: URB_FUNCTION_CONTROL_TRANSFER (0x0008)
    IRP information: 0x00, Direction: FDO -> PDO
        0000 000. = Reserved: 0x00
        .... ...0 = Direction: FDO -> PDO (0x0)
    URB bus id: 1
    Device address: 6
    Endpoint: 0x80, Direction: IN
        1... .... = Direction: IN (1)
        .... 0000 = Endpoint number: 0
    URB transfer type: URB_CONTROL (0x02)
    Packet Data Length: 8
    [Response in: 250]
    Control transfer stage: Setup (0)
    [bInterfaceClass: Unknown (0xffff)]
URB setup
    bmRequestType: 0xc1
    bRequest: 8
    wValue: 0x0000
    wIndex: 0 (0x0000)
    wLength: 4

No.     Time           Source                Destination           Protocol Length Info
    249 0.335503       host                  1.6.0                 USB      36     URB_CONTROL out

Frame 249: 36 bytes on wire (288 bits), 36 bytes captured (288 bits) on interface 0
USB URB
    [Source: host]
    [Destination: 1.6.0]
    USBPcap pseudoheader length: 28
    IRP ID: 0xffff80030cff8890
    IRP USBD_STATUS: USBD_STATUS_SUCCESS (0x00000000)
    URB Function: URB_FUNCTION_CONTROL_TRANSFER (0x0008)
    IRP information: 0x00, Direction: FDO -> PDO
        0000 000. = Reserved: 0x00
        .... ...0 = Direction: FDO -> PDO (0x0)
    URB bus id: 1
    Device address: 6
    Endpoint: 0x00, Direction: OUT
        0... .... = Direction: OUT (0)
        .... 0000 = Endpoint number: 0
    URB transfer type: URB_CONTROL (0x02)
    Packet Data Length: 8
    [Response in: 252]
    Control transfer stage: Setup (0)
    [bInterfaceClass: Unknown (0xffff)]
URB setup
    bmRequestType: 0x41
    bRequest: 7
    wValue: 0x0100
    wIndex: 0 (0x0000)
    wLength: 0

No.     Time           Source                Destination           Protocol Length Info
    250 0.335605       1.6.0                 host                  USB      29     URB_CONTROL in

Frame 250: 29 bytes on wire (232 bits), 29 bytes captured (232 bits) on interface 0
USB URB
    [Source: 1.6.0]
    [Destination: host]
    USBPcap pseudoheader length: 28
    IRP ID: 0xffff800307a97690
    IRP USBD_STATUS: USBD_STATUS_SUCCESS (0x00000000)
    URB Function: URB_FUNCTION_CONTROL_TRANSFER (0x0008)
    IRP information: 0x01, Direction: PDO -> FDO
        0000 000. = Reserved: 0x00
        .... ...1 = Direction: PDO -> FDO (0x1)
    URB bus id: 1
    Device address: 6
    Endpoint: 0x80, Direction: IN
        1... .... = Direction: IN (1)
        .... 0000 = Endpoint number: 0
    URB transfer type: URB_CONTROL (0x02)
    Packet Data Length: 1
    [Request in: 248]
    [Time from request: 0.000116000 seconds]
    Control transfer stage: Data (1)
    [bInterfaceClass: Unknown (0xffff)]
CONTROL response data: 00

No.     Time           Source                Destination           Protocol Length Info
    251 0.335606       1.6.0                 host                  USB      28     GET CONFIGURATION Status

Frame 251: 28 bytes on wire (224 bits), 28 bytes captured (224 bits) on interface 0
USB URB
    [Source: 1.6.0]
    [Destination: host]
    USBPcap pseudoheader length: 28
    IRP ID: 0xffff800307a97690
    IRP USBD_STATUS: USBD_STATUS_SUCCESS (0x00000000)
    URB Function: URB_FUNCTION_CONTROL_TRANSFER (0x0008)
    IRP information: 0x01, Direction: PDO -> FDO
        0000 000. = Reserved: 0x00
        .... ...1 = Direction: PDO -> FDO (0x1)
    URB bus id: 1
    Device address: 6
    Endpoint: 0x80, Direction: IN
        1... .... = Direction: IN (1)
        .... 0000 = Endpoint number: 0
    URB transfer type: URB_CONTROL (0x02)
    Packet Data Length: 0
    [Request in: 248]
    [Time from request: 0.000117000 seconds]
    Control transfer stage: Status (2)

No.     Time           Source                Destination           Protocol Length Info
    252 0.335656       1.6.0                 host                  USB      28     SET DESCRIPTOR Status

Frame 252: 28 bytes on wire (224 bits), 28 bytes captured (224 bits) on interface 0
USB URB
    [Source: 1.6.0]
    [Destination: host]
    USBPcap pseudoheader length: 28
    IRP ID: 0xffff80030cff8890
    IRP USBD_STATUS: USBD_STATUS_SUCCESS (0x00000000)
    URB Function: URB_FUNCTION_CONTROL_TRANSFER (0x0008)
    IRP information: 0x01, Direction: PDO -> FDO
        0000 000. = Reserved: 0x00
        .... ...1 = Direction: PDO -> FDO (0x1)
    URB bus id: 1
    Device address: 6
    Endpoint: 0x00, Direction: OUT
        0... .... = Direction: OUT (0)
        .... 0000 = Endpoint number: 0
    URB transfer type: URB_CONTROL (0x02)
    Packet Data Length: 0
    [Request in: 249]
    [Time from request: 0.000153000 seconds]
    Control transfer stage: Status (2)

No.     Time           Source                Destination           Protocol Length Info
    253 0.335662       host                  1.6.0                 USB      36     URB_CONTROL in

Frame 253: 36 bytes on wire (288 bits), 36 bytes captured (288 bits) on interface 0
USB URB
    [Source: host]
    [Destination: 1.6.0]
    USBPcap pseudoheader length: 28
    IRP ID: 0xffff80030cff8890
    IRP USBD_STATUS: USBD_STATUS_SUCCESS (0x00000000)
    URB Function: URB_FUNCTION_CONTROL_TRANSFER (0x0008)
    IRP information: 0x00, Direction: FDO -> PDO
        0000 000. = Reserved: 0x00
        .... ...0 = Direction: FDO -> PDO (0x0)
    URB bus id: 1
    Device address: 6
    Endpoint: 0x80, Direction: IN
        1... .... = Direction: IN (1)
        .... 0000 = Endpoint number: 0
    URB transfer type: URB_CONTROL (0x02)
    Packet Data Length: 8
    [Response in: 255]
    Control transfer stage: Setup (0)
    [bInterfaceClass: Unknown (0xffff)]
URB setup
    bmRequestType: 0xc1
    bRequest: 8
    wValue: 0x0000
    wIndex: 0 (0x0000)
    wLength: 4

No.     Time           Source                Destination           Protocol Length Info
    254 0.335670       host                  1.6.0                 USB      36     URB_CONTROL out

Frame 254: 36 bytes on wire (288 bits), 36 bytes captured (288 bits) on interface 0
USB URB
    [Source: host]
    [Destination: 1.6.0]
    USBPcap pseudoheader length: 28
    IRP ID: 0xffff800306e436e0
    IRP USBD_STATUS: USBD_STATUS_SUCCESS (0x00000000)
    URB Function: URB_FUNCTION_CONTROL_TRANSFER (0x0008)
    IRP information: 0x00, Direction: FDO -> PDO
        0000 000. = Reserved: 0x00
        .... ...0 = Direction: FDO -> PDO (0x0)
    URB bus id: 1
    Device address: 6
    Endpoint: 0x00, Direction: OUT
        0... .... = Direction: OUT (0)
        .... 0000 = Endpoint number: 0
    URB transfer type: URB_CONTROL (0x02)
    Packet Data Length: 8
    [Response in: 257]
    Control transfer stage: Setup (0)
    [bInterfaceClass: Unknown (0xffff)]
URB setup
    bmRequestType: 0x41
    bRequest: 3
    wValue: 0x0800
    wIndex: 0 (0x0000)
    wLength: 0

No.     Time           Source                Destination           Protocol Length Info
    255 0.335782       1.6.0                 host                  USB      29     URB_CONTROL in

Frame 255: 29 bytes on wire (232 bits), 29 bytes captured (232 bits) on interface 0
USB URB
    [Source: 1.6.0]
    [Destination: host]
    USBPcap pseudoheader length: 28
    IRP ID: 0xffff80030cff8890
    IRP USBD_STATUS: USBD_STATUS_SUCCESS (0x00000000)
    URB Function: URB_FUNCTION_CONTROL_TRANSFER (0x0008)
    IRP information: 0x01, Direction: PDO -> FDO
        0000 000. = Reserved: 0x00
        .... ...1 = Direction: PDO -> FDO (0x1)
    URB bus id: 1
    Device address: 6
    Endpoint: 0x80, Direction: IN
        1... .... = Direction: IN (1)
        .... 0000 = Endpoint number: 0
    URB transfer type: URB_CONTROL (0x02)
    Packet Data Length: 1
    [Request in: 253]
    [Time from request: 0.000120000 seconds]
    Control transfer stage: Data (1)
    [bInterfaceClass: Unknown (0xffff)]
CONTROL response data: 00

No.     Time           Source                Destination           Protocol Length Info
    256 0.335782       1.6.0                 host                  USB      28     GET CONFIGURATION Status

Frame 256: 28 bytes on wire (224 bits), 28 bytes captured (224 bits) on interface 0
USB URB
    [Source: 1.6.0]
    [Destination: host]
    USBPcap pseudoheader length: 28
    IRP ID: 0xffff80030cff8890
    IRP USBD_STATUS: USBD_STATUS_SUCCESS (0x00000000)
    URB Function: URB_FUNCTION_CONTROL_TRANSFER (0x0008)
    IRP information: 0x01, Direction: PDO -> FDO
        0000 000. = Reserved: 0x00
        .... ...1 = Direction: PDO -> FDO (0x1)
    URB bus id: 1
    Device address: 6
    Endpoint: 0x80, Direction: IN
        1... .... = Direction: IN (1)
        .... 0000 = Endpoint number: 0
    URB transfer type: URB_CONTROL (0x02)
    Packet Data Length: 0
    [Request in: 253]
    [Time from request: 0.000120000 seconds]
    Control transfer stage: Status (2)

No.     Time           Source                Destination           Protocol Length Info
    257 0.335914       1.6.0                 host                  USB      28     SET FEATURE Status

Frame 257: 28 bytes on wire (224 bits), 28 bytes captured (224 bits) on interface 0
USB URB
    [Source: 1.6.0]
    [Destination: host]
    USBPcap pseudoheader length: 28
    IRP ID: 0xffff800306e436e0
    IRP USBD_STATUS: USBD_STATUS_SUCCESS (0x00000000)
    URB Function: URB_FUNCTION_CONTROL_TRANSFER (0x0008)
    IRP information: 0x01, Direction: PDO -> FDO
        0000 000. = Reserved: 0x00
        .... ...1 = Direction: PDO -> FDO (0x1)
    URB bus id: 1
    Device address: 6
    Endpoint: 0x00, Direction: OUT
        0... .... = Direction: OUT (0)
        .... 0000 = Endpoint number: 0
    URB transfer type: URB_CONTROL (0x02)
    Packet Data Length: 0
    [Request in: 254]
    [Time from request: 0.000244000 seconds]
    Control transfer stage: Status (2)

No.     Time           Source                Destination           Protocol Length Info
    258 0.335928       host                  1.6.0                 USB      36     URB_CONTROL out

Frame 258: 36 bytes on wire (288 bits), 36 bytes captured (288 bits) on interface 0
USB URB
    [Source: host]
    [Destination: 1.6.0]
    USBPcap pseudoheader length: 28
    IRP ID: 0xffff800307b03af0
    IRP USBD_STATUS: USBD_STATUS_SUCCESS (0x00000000)
    URB Function: URB_FUNCTION_CONTROL_TRANSFER (0x0008)
    IRP information: 0x00, Direction: FDO -> PDO
        0000 000. = Reserved: 0x00
        .... ...0 = Direction: FDO -> PDO (0x0)
    URB bus id: 1
    Device address: 6
    Endpoint: 0x00, Direction: OUT
        0... .... = Direction: OUT (0)
        .... 0000 = Endpoint number: 0
    URB transfer type: URB_CONTROL (0x02)
    Packet Data Length: 8
    [Response in: 259]
    Control transfer stage: Setup (0)
    [bInterfaceClass: Unknown (0xffff)]
URB setup
    bmRequestType: 0x41
    bRequest: 25
    wValue: 0x0000
    wIndex: 0 (0x0000)
    wLength: 6

No.     Time           Source                Destination           Protocol Length Info
    259 0.336056       1.6.0                 host                  USB      34     URB_CONTROL out

Frame 259: 34 bytes on wire (272 bits), 34 bytes captured (272 bits) on interface 0
USB URB
    [Source: 1.6.0]
    [Destination: host]
    USBPcap pseudoheader length: 28
    IRP ID: 0xffff800307b03af0
    IRP USBD_STATUS: USBD_STATUS_SUCCESS (0x00000000)
    URB Function: URB_FUNCTION_CONTROL_TRANSFER (0x0008)
    IRP information: 0x01, Direction: PDO -> FDO
        0000 000. = Reserved: 0x00
        .... ...1 = Direction: PDO -> FDO (0x1)
    URB bus id: 1
    Device address: 6
    Endpoint: 0x00, Direction: OUT
        0... .... = Direction: OUT (0)
        .... 0000 = Endpoint number: 0
    URB transfer type: URB_CONTROL (0x02)
    Packet Data Length: 6
    [Request in: 258]
    [Time from request: 0.000128000 seconds]
    Control transfer stage: Data (1)
    [bInterfaceClass: Unknown (0xffff)]
CONTROL response data: 000000001113

No.     Time           Source                Destination           Protocol Length Info
    260 0.336056       1.6.0                 host                  USB      28     Unknown type 19 Status

Frame 260: 28 bytes on wire (224 bits), 28 bytes captured (224 bits) on interface 0
USB URB
    [Source: 1.6.0]
    [Destination: host]
    USBPcap pseudoheader length: 28
    IRP ID: 0xffff800307b03af0
    IRP USBD_STATUS: USBD_STATUS_SUCCESS (0x00000000)
    URB Function: URB_FUNCTION_CONTROL_TRANSFER (0x0008)
    IRP information: 0x01, Direction: PDO -> FDO
        0000 000. = Reserved: 0x00
        .... ...1 = Direction: PDO -> FDO (0x1)
    URB bus id: 1
    Device address: 6
    Endpoint: 0x00, Direction: OUT
        0... .... = Direction: OUT (0)
        .... 0000 = Endpoint number: 0
    URB transfer type: URB_CONTROL (0x02)
    Packet Data Length: 0
    [Request in: 258]
    [Time from request: 0.000128000 seconds]
    Control transfer stage: Status (2)

No.     Time           Source                Destination           Protocol Length Info
    261 0.336069       host                  1.6.0                 USB      36     URB_CONTROL out

Frame 261: 36 bytes on wire (288 bits), 36 bytes captured (288 bits) on interface 0
USB URB
    [Source: host]
    [Destination: 1.6.0]
    USBPcap pseudoheader length: 28
    IRP ID: 0xffff800307637af0
    IRP USBD_STATUS: USBD_STATUS_SUCCESS (0x00000000)
    URB Function: URB_FUNCTION_CONTROL_TRANSFER (0x0008)
    IRP information: 0x00, Direction: FDO -> PDO
        0000 000. = Reserved: 0x00
        .... ...0 = Direction: FDO -> PDO (0x0)
    URB bus id: 1
    Device address: 6
    Endpoint: 0x00, Direction: OUT
        0... .... = Direction: OUT (0)
        .... 0000 = Endpoint number: 0
    URB transfer type: URB_CONTROL (0x02)
    Packet Data Length: 8
    [Response in: 262]
    Control transfer stage: Setup (0)
    [bInterfaceClass: Unknown (0xffff)]
URB setup
    bmRequestType: 0x41
    bRequest: 19
    wValue: 0x0000
    wIndex: 0 (0x0000)
    wLength: 16

No.     Time           Source                Destination           Protocol Length Info
    262 0.336176       1.6.0                 host                  USB      44     URB_CONTROL out

Frame 262: 44 bytes on wire (352 bits), 44 bytes captured (352 bits) on interface 0
USB URB
    [Source: 1.6.0]
    [Destination: host]
    USBPcap pseudoheader length: 28
    IRP ID: 0xffff800307637af0
    IRP USBD_STATUS: USBD_STATUS_SUCCESS (0x00000000)
    URB Function: URB_FUNCTION_CONTROL_TRANSFER (0x0008)
    IRP information: 0x01, Direction: PDO -> FDO
        0000 000. = Reserved: 0x00
        .... ...1 = Direction: PDO -> FDO (0x1)
    URB bus id: 1
    Device address: 6
    Endpoint: 0x00, Direction: OUT
        0... .... = Direction: OUT (0)
        .... 0000 = Endpoint number: 0
    URB transfer type: URB_CONTROL (0x02)
    Packet Data Length: 16
    [Request in: 261]
    [Time from request: 0.000107000 seconds]
    Control transfer stage: Data (1)
    [bInterfaceClass: Unknown (0xffff)]
CONTROL response data: 00000000000000003200000034000000

No.     Time           Source                Destination           Protocol Length Info
    263 0.336177       1.6.0                 host                  USB      28     Unknown type 13 Status

Frame 263: 28 bytes on wire (224 bits), 28 bytes captured (224 bits) on interface 0
USB URB
    [Source: 1.6.0]
    [Destination: host]
    USBPcap pseudoheader length: 28
    IRP ID: 0xffff800307637af0
    IRP USBD_STATUS: USBD_STATUS_SUCCESS (0x00000000)
    URB Function: URB_FUNCTION_CONTROL_TRANSFER (0x0008)
    IRP information: 0x01, Direction: PDO -> FDO
        0000 000. = Reserved: 0x00
        .... ...1 = Direction: PDO -> FDO (0x1)
    URB bus id: 1
    Device address: 6
    Endpoint: 0x00, Direction: OUT
        0... .... = Direction: OUT (0)
        .... 0000 = Endpoint number: 0
    URB transfer type: URB_CONTROL (0x02)
    Packet Data Length: 0
    [Request in: 261]
    [Time from request: 0.000108000 seconds]
    Control transfer stage: Status (2)

No.     Time           Source                Destination           Protocol Length Info
    264 0.336208       host                  1.6.0                 USB      36     URB_CONTROL out

Frame 264: 36 bytes on wire (288 bits), 36 bytes captured (288 bits) on interface 0
USB URB
    [Source: host]
    [Destination: 1.6.0]
    USBPcap pseudoheader length: 28
    IRP ID: 0xffff80030cff8890
    IRP USBD_STATUS: USBD_STATUS_SUCCESS (0x00000000)
    URB Function: URB_FUNCTION_CONTROL_TRANSFER (0x0008)
    IRP information: 0x00, Direction: FDO -> PDO
        0000 000. = Reserved: 0x00
        .... ...0 = Direction: FDO -> PDO (0x0)
    URB bus id: 1
    Device address: 6
    Endpoint: 0x00, Direction: OUT
        0... .... = Direction: OUT (0)
        .... 0000 = Endpoint number: 0
    URB transfer type: URB_CONTROL (0x02)
    Packet Data Length: 8
    [Response in: 265]
    Control transfer stage: Setup (0)
    [bInterfaceClass: Unknown (0xffff)]
URB setup
    bmRequestType: 0x41
    bRequest: 7
    wValue: 0x0101
    wIndex: 0 (0x0000)
    wLength: 0

No.     Time           Source                Destination           Protocol Length Info
    265 0.336337       1.6.0                 host                  USB      28     SET DESCRIPTOR Status

Frame 265: 28 bytes on wire (224 bits), 28 bytes captured (224 bits) on interface 0
USB URB
    [Source: 1.6.0]
    [Destination: host]
    USBPcap pseudoheader length: 28
    IRP ID: 0xffff80030cff8890
    IRP USBD_STATUS: USBD_STATUS_SUCCESS (0x00000000)
    URB Function: URB_FUNCTION_CONTROL_TRANSFER (0x0008)
    IRP information: 0x01, Direction: PDO -> FDO
        0000 000. = Reserved: 0x00
        .... ...1 = Direction: PDO -> FDO (0x1)
    URB bus id: 1
    Device address: 6
    Endpoint: 0x00, Direction: OUT
        0... .... = Direction: OUT (0)
        .... 0000 = Endpoint number: 0
    URB transfer type: URB_CONTROL (0x02)
    Packet Data Length: 0
    [Request in: 264]
    [Time from request: 0.000129000 seconds]
    Control transfer stage: Status (2)

No.     Time           Source                Destination           Protocol Length Info
    266 0.336346       host                  1.6.0                 USB      36     URB_CONTROL in

Frame 266: 36 bytes on wire (288 bits), 36 bytes captured (288 bits) on interface 0
USB URB
    [Source: host]
    [Destination: 1.6.0]
    USBPcap pseudoheader length: 28
    IRP ID: 0xffff80030cff8890
    IRP USBD_STATUS: USBD_STATUS_SUCCESS (0x00000000)
    URB Function: URB_FUNCTION_CONTROL_TRANSFER (0x0008)
    IRP information: 0x00, Direction: FDO -> PDO
        0000 000. = Reserved: 0x00
        .... ...0 = Direction: FDO -> PDO (0x0)
    URB bus id: 1
    Device address: 6
    Endpoint: 0x80, Direction: IN
        1... .... = Direction: IN (1)
        .... 0000 = Endpoint number: 0
    URB transfer type: URB_CONTROL (0x02)
    Packet Data Length: 8
    [Response in: 268]
    Control transfer stage: Setup (0)
    [bInterfaceClass: Unknown (0xffff)]
URB setup
    bmRequestType: 0xc1
    bRequest: 8
    wValue: 0x0000
    wIndex: 0 (0x0000)
    wLength: 4

No.     Time           Source                Destination           Protocol Length Info
    267 0.336361       host                  1.6.0                 USB      36     URB_CONTROL out

Frame 267: 36 bytes on wire (288 bits), 36 bytes captured (288 bits) on interface 0
USB URB
    [Source: host]
    [Destination: 1.6.0]
    USBPcap pseudoheader length: 28
    IRP ID: 0xffff800307a97690
    IRP USBD_STATUS: USBD_STATUS_SUCCESS (0x00000000)
    URB Function: URB_FUNCTION_CONTROL_TRANSFER (0x0008)
    IRP information: 0x00, Direction: FDO -> PDO
        0000 000. = Reserved: 0x00
        .... ...0 = Direction: FDO -> PDO (0x0)
    URB bus id: 1
    Device address: 6
    Endpoint: 0x00, Direction: OUT
        0... .... = Direction: OUT (0)
        .... 0000 = Endpoint number: 0
    URB transfer type: URB_CONTROL (0x02)
    Packet Data Length: 8
    [Response in: 270]
    Control transfer stage: Setup (0)
    [bInterfaceClass: Unknown (0xffff)]
URB setup
    bmRequestType: 0x41
    bRequest: 7
    wValue: 0x0202
    wIndex: 0 (0x0000)
    wLength: 0

No.     Time           Source                Destination           Protocol Length Info
    268 0.336466       1.6.0                 host                  USB      29     URB_CONTROL in

Frame 268: 29 bytes on wire (232 bits), 29 bytes captured (232 bits) on interface 0
USB URB
    [Source: 1.6.0]
    [Destination: host]
    USBPcap pseudoheader length: 28
    IRP ID: 0xffff80030cff8890
    IRP USBD_STATUS: USBD_STATUS_SUCCESS (0x00000000)
    URB Function: URB_FUNCTION_CONTROL_TRANSFER (0x0008)
    IRP information: 0x01, Direction: PDO -> FDO
        0000 000. = Reserved: 0x00
        .... ...1 = Direction: PDO -> FDO (0x1)
    URB bus id: 1
    Device address: 6
    Endpoint: 0x80, Direction: IN
        1... .... = Direction: IN (1)
        .... 0000 = Endpoint number: 0
    URB transfer type: URB_CONTROL (0x02)
    Packet Data Length: 1
    [Request in: 266]
    [Time from request: 0.000120000 seconds]
    Control transfer stage: Data (1)
    [bInterfaceClass: Unknown (0xffff)]
CONTROL response data: 01

No.     Time           Source                Destination           Protocol Length Info
    269 0.336466       1.6.0                 host                  USB      28     GET CONFIGURATION Status

Frame 269: 28 bytes on wire (224 bits), 28 bytes captured (224 bits) on interface 0
USB URB
    [Source: 1.6.0]
    [Destination: host]
    USBPcap pseudoheader length: 28
    IRP ID: 0xffff80030cff8890
    IRP USBD_STATUS: USBD_STATUS_SUCCESS (0x00000000)
    URB Function: URB_FUNCTION_CONTROL_TRANSFER (0x0008)
    IRP information: 0x01, Direction: PDO -> FDO
        0000 000. = Reserved: 0x00
        .... ...1 = Direction: PDO -> FDO (0x1)
    URB bus id: 1
    Device address: 6
    Endpoint: 0x80, Direction: IN
        1... .... = Direction: IN (1)
        .... 0000 = Endpoint number: 0
    URB transfer type: URB_CONTROL (0x02)
    Packet Data Length: 0
    [Request in: 266]
    [Time from request: 0.000120000 seconds]
    Control transfer stage: Status (2)

No.     Time           Source                Destination           Protocol Length Info
    270 0.336515       1.6.0                 host                  USB      28     SET DESCRIPTOR Status

Frame 270: 28 bytes on wire (224 bits), 28 bytes captured (224 bits) on interface 0
USB URB
    [Source: 1.6.0]
    [Destination: host]
    USBPcap pseudoheader length: 28
    IRP ID: 0xffff800307a97690
    IRP USBD_STATUS: USBD_STATUS_SUCCESS (0x00000000)
    URB Function: URB_FUNCTION_CONTROL_TRANSFER (0x0008)
    IRP information: 0x01, Direction: PDO -> FDO
        0000 000. = Reserved: 0x00
        .... ...1 = Direction: PDO -> FDO (0x1)
    URB bus id: 1
    Device address: 6
    Endpoint: 0x00, Direction: OUT
        0... .... = Direction: OUT (0)
        .... 0000 = Endpoint number: 0
    URB transfer type: URB_CONTROL (0x02)
    Packet Data Length: 0
    [Request in: 267]
    [Time from request: 0.000154000 seconds]
    Control transfer stage: Status (2)

No.     Time           Source                Destination           Protocol Length Info
    271 0.336522       host                  1.6.0                 USB      36     URB_CONTROL in

Frame 271: 36 bytes on wire (288 bits), 36 bytes captured (288 bits) on interface 0
USB URB
    [Source: host]
    [Destination: 1.6.0]
    USBPcap pseudoheader length: 28
    IRP ID: 0xffff800307a97690
    IRP USBD_STATUS: USBD_STATUS_SUCCESS (0x00000000)
    URB Function: URB_FUNCTION_CONTROL_TRANSFER (0x0008)
    IRP information: 0x00, Direction: FDO -> PDO
        0000 000. = Reserved: 0x00
        .... ...0 = Direction: FDO -> PDO (0x0)
    URB bus id: 1
    Device address: 6
    Endpoint: 0x80, Direction: IN
        1... .... = Direction: IN (1)
        .... 0000 = Endpoint number: 0
    URB transfer type: URB_CONTROL (0x02)
    Packet Data Length: 8
    [Response in: 272]
    Control transfer stage: Setup (0)
    [bInterfaceClass: Unknown (0xffff)]
URB setup
    bmRequestType: 0xc1
    bRequest: 8
    wValue: 0x0000
    wIndex: 0 (0x0000)
    wLength: 4

No.     Time           Source                Destination           Protocol Length Info
    272 0.336643       1.6.0                 host                  USB      29     URB_CONTROL in

Frame 272: 29 bytes on wire (232 bits), 29 bytes captured (232 bits) on interface 0
USB URB
    [Source: 1.6.0]
    [Destination: host]
    USBPcap pseudoheader length: 28
    IRP ID: 0xffff800307a97690
    IRP USBD_STATUS: USBD_STATUS_SUCCESS (0x00000000)
    URB Function: URB_FUNCTION_CONTROL_TRANSFER (0x0008)
    IRP information: 0x01, Direction: PDO -> FDO
        0000 000. = Reserved: 0x00
        .... ...1 = Direction: PDO -> FDO (0x1)
    URB bus id: 1
    Device address: 6
    Endpoint: 0x80, Direction: IN
        1... .... = Direction: IN (1)
        .... 0000 = Endpoint number: 0
    URB transfer type: URB_CONTROL (0x02)
    Packet Data Length: 1
    [Request in: 271]
    [Time from request: 0.000121000 seconds]
    Control transfer stage: Data (1)
    [bInterfaceClass: Unknown (0xffff)]
CONTROL response data: 03

No.     Time           Source                Destination           Protocol Length Info
    273 0.336643       1.6.0                 host                  USB      28     GET CONFIGURATION Status

Frame 273: 28 bytes on wire (224 bits), 28 bytes captured (224 bits) on interface 0
USB URB
    [Source: 1.6.0]
    [Destination: host]
    USBPcap pseudoheader length: 28
    IRP ID: 0xffff800307a97690
    IRP USBD_STATUS: USBD_STATUS_SUCCESS (0x00000000)
    URB Function: URB_FUNCTION_CONTROL_TRANSFER (0x0008)
    IRP information: 0x01, Direction: PDO -> FDO
        0000 000. = Reserved: 0x00
        .... ...1 = Direction: PDO -> FDO (0x1)
    URB bus id: 1
    Device address: 6
    Endpoint: 0x80, Direction: IN
        1... .... = Direction: IN (1)
        .... 0000 = Endpoint number: 0
    URB transfer type: URB_CONTROL (0x02)
    Packet Data Length: 0
    [Request in: 271]
    [Time from request: 0.000121000 seconds]
    Control transfer stage: Status (2)

No.     Time           Source                Destination           Protocol Length Info
    274 0.410463       host                  1.6.0                 USB      36     URB_CONTROL in

Frame 274: 36 bytes on wire (288 bits), 36 bytes captured (288 bits) on interface 0
USB URB
    [Source: host]
    [Destination: 1.6.0]
    USBPcap pseudoheader length: 28
    IRP ID: 0xffff800307a97690
    IRP USBD_STATUS: USBD_STATUS_SUCCESS (0x00000000)
    URB Function: URB_FUNCTION_CONTROL_TRANSFER (0x0008)
    IRP information: 0x00, Direction: FDO -> PDO
        0000 000. = Reserved: 0x00
        .... ...0 = Direction: FDO -> PDO (0x0)
    URB bus id: 1
    Device address: 6
    Endpoint: 0x80, Direction: IN
        1... .... = Direction: IN (1)
        .... 0000 = Endpoint number: 0
    URB transfer type: URB_CONTROL (0x02)
    Packet Data Length: 8
    [Response in: 275]
    Control transfer stage: Setup (0)
    [bInterfaceClass: Unknown (0xffff)]
URB setup
    bmRequestType: 0xc1
    bRequest: 8
    wValue: 0x0000
    wIndex: 0 (0x0000)
    wLength: 4

No.     Time           Source                Destination           Protocol Length Info
    275 0.410631       1.6.0                 host                  USB      29     URB_CONTROL in

Frame 275: 29 bytes on wire (232 bits), 29 bytes captured (232 bits) on interface 0
USB URB
    [Source: 1.6.0]
    [Destination: host]
    USBPcap pseudoheader length: 28
    IRP ID: 0xffff800307a97690
    IRP USBD_STATUS: USBD_STATUS_SUCCESS (0x00000000)
    URB Function: URB_FUNCTION_CONTROL_TRANSFER (0x0008)
    IRP information: 0x01, Direction: PDO -> FDO
        0000 000. = Reserved: 0x00
        .... ...1 = Direction: PDO -> FDO (0x1)
    URB bus id: 1
    Device address: 6
    Endpoint: 0x80, Direction: IN
        1... .... = Direction: IN (1)
        .... 0000 = Endpoint number: 0
    URB transfer type: URB_CONTROL (0x02)
    Packet Data Length: 1
    [Request in: 274]
    [Time from request: 0.000168000 seconds]
    Control transfer stage: Data (1)
    [bInterfaceClass: Unknown (0xffff)]
CONTROL response data: 03

No.     Time           Source                Destination           Protocol Length Info
    276 0.410632       1.6.0                 host                  USB      28     GET CONFIGURATION Status

Frame 276: 28 bytes on wire (224 bits), 28 bytes captured (224 bits) on interface 0
USB URB
    [Source: 1.6.0]
    [Destination: host]
    USBPcap pseudoheader length: 28
    IRP ID: 0xffff800307a97690
    IRP USBD_STATUS: USBD_STATUS_SUCCESS (0x00000000)
    URB Function: URB_FUNCTION_CONTROL_TRANSFER (0x0008)
    IRP information: 0x01, Direction: PDO -> FDO
        0000 000. = Reserved: 0x00
        .... ...1 = Direction: PDO -> FDO (0x1)
    URB bus id: 1
    Device address: 6
    Endpoint: 0x80, Direction: IN
        1... .... = Direction: IN (1)
        .... 0000 = Endpoint number: 0
    URB transfer type: URB_CONTROL (0x02)
    Packet Data Length: 0
    [Request in: 274]
    [Time from request: 0.000169000 seconds]
    Control transfer stage: Status (2)

No.     Time           Source                Destination           Protocol Length Info
    277 0.459116       host                  1.6.0                 USB      36     URB_CONTROL out

Frame 277: 36 bytes on wire (288 bits), 36 bytes captured (288 bits) on interface 0
USB URB
    [Source: host]
    [Destination: 1.6.0]
    USBPcap pseudoheader length: 28
    IRP ID: 0xffff800306e436e0
    IRP USBD_STATUS: USBD_STATUS_SUCCESS (0x00000000)
    URB Function: URB_FUNCTION_CONTROL_TRANSFER (0x0008)
    IRP information: 0x00, Direction: FDO -> PDO
        0000 000. = Reserved: 0x00
        .... ...0 = Direction: FDO -> PDO (0x0)
    URB bus id: 1
    Device address: 6
    Endpoint: 0x00, Direction: OUT
        0... .... = Direction: OUT (0)
        .... 0000 = Endpoint number: 0
    URB transfer type: URB_CONTROL (0x02)
    Packet Data Length: 8
    [Response in: 278]
    Control transfer stage: Setup (0)
    [bInterfaceClass: Unknown (0xffff)]
URB setup
    bmRequestType: 0x41
    bRequest: 18
    wValue: 0x000a
    wIndex: 0 (0x0000)
    wLength: 0

No.     Time           Source                Destination           Protocol Length Info
    278 0.459238       1.6.0                 host                  USB      28     Unknown type 12 Status

Frame 278: 28 bytes on wire (224 bits), 28 bytes captured (224 bits) on interface 0
USB URB
    [Source: 1.6.0]
    [Destination: host]
    USBPcap pseudoheader length: 28
    IRP ID: 0xffff800306e436e0
    IRP USBD_STATUS: USBD_STATUS_SUCCESS (0x00000000)
    URB Function: URB_FUNCTION_CONTROL_TRANSFER (0x0008)
    IRP information: 0x01, Direction: PDO -> FDO
        0000 000. = Reserved: 0x00
        .... ...1 = Direction: PDO -> FDO (0x1)
    URB bus id: 1
    Device address: 6
    Endpoint: 0x00, Direction: OUT
        0... .... = Direction: OUT (0)
        .... 0000 = Endpoint number: 0
    URB transfer type: URB_CONTROL (0x02)
    Packet Data Length: 0
    [Request in: 277]
    [Time from request: 0.000122000 seconds]
    Control transfer stage: Status (2)

No.     Time           Source                Destination           Protocol Length Info
    279 0.459297       host                  1.6.1                 USB      35     URB_BULK out

Frame 279: 35 bytes on wire (280 bits), 35 bytes captured (280 bits) on interface 0
USB URB
    [Source: host]
    [Destination: 1.6.1]
    USBPcap pseudoheader length: 27
    IRP ID: 0xffff800307a97690
    IRP USBD_STATUS: USBD_STATUS_SUCCESS (0x00000000)
    URB Function: URB_FUNCTION_BULK_OR_INTERRUPT_TRANSFER (0x0009)
    IRP information: 0x00, Direction: FDO -> PDO
        0000 000. = Reserved: 0x00
        .... ...0 = Direction: FDO -> PDO (0x0)
    URB bus id: 1
    Device address: 6
    Endpoint: 0x01, Direction: OUT
        0... .... = Direction: OUT (0)
        .... 0001 = Endpoint number: 1
    URB transfer type: URB_BULK (0x03)
    Packet Data Length: 8
    [bInterfaceClass: Unknown (0xffff)]
Leftover Capture Data: 2f3030494445440d

No.     Time           Source                Destination           Protocol Length Info
    280 0.480897       1.6.2                 host                  USB      90     URB_BULK in

Frame 280: 90 bytes on wire (720 bits), 90 bytes captured (720 bits) on interface 0
USB URB
    [Source: 1.6.2]
    [Destination: host]
    USBPcap pseudoheader length: 27
    IRP ID: 0xffff80030a541010
    IRP USBD_STATUS: USBD_STATUS_SUCCESS (0x00000000)
    URB Function: URB_FUNCTION_BULK_OR_INTERRUPT_TRANSFER (0x0009)
    IRP information: 0x01, Direction: PDO -> FDO
        0000 000. = Reserved: 0x00
        .... ...1 = Direction: PDO -> FDO (0x1)
    URB bus id: 1
    Device address: 6
    Endpoint: 0x82, Direction: IN
        1... .... = Direction: IN (1)
        .... 0010 = Endpoint number: 2
    URB transfer type: URB_BULK (0x03)
    Packet Data Length: 63
    [bInterfaceClass: Unknown (0xffff)]
Leftover Capture Data: 2f4130304944533752323020423030343030323238423030...

No.     Time           Source                Destination           Protocol Length Info
    281 0.490465       host                  1.6.0                 USB      36     URB_CONTROL in

Frame 281: 36 bytes on wire (288 bits), 36 bytes captured (288 bits) on interface 0
USB URB
    [Source: host]
    [Destination: 1.6.0]
    USBPcap pseudoheader length: 28
    IRP ID: 0xffff800307a97690
    IRP USBD_STATUS: USBD_STATUS_SUCCESS (0x00000000)
    URB Function: URB_FUNCTION_CONTROL_TRANSFER (0x0008)
    IRP information: 0x00, Direction: FDO -> PDO
        0000 000. = Reserved: 0x00
        .... ...0 = Direction: FDO -> PDO (0x0)
    URB bus id: 1
    Device address: 6
    Endpoint: 0x80, Direction: IN
        1... .... = Direction: IN (1)
        .... 0000 = Endpoint number: 0
    URB transfer type: URB_CONTROL (0x02)
    Packet Data Length: 8
    [Response in: 282]
    Control transfer stage: Setup (0)
    [bInterfaceClass: Unknown (0xffff)]
URB setup
    bmRequestType: 0xc1
    bRequest: 8
    wValue: 0x0000
    wIndex: 0 (0x0000)
    wLength: 4

No.     Time           Source                Destination           Protocol Length Info
    282 0.490607       1.6.0                 host                  USB      29     URB_CONTROL in

Frame 282: 29 bytes on wire (232 bits), 29 bytes captured (232 bits) on interface 0
USB URB
    [Source: 1.6.0]
    [Destination: host]
    USBPcap pseudoheader length: 28
    IRP ID: 0xffff800307a97690
    IRP USBD_STATUS: USBD_STATUS_SUCCESS (0x00000000)
    URB Function: URB_FUNCTION_CONTROL_TRANSFER (0x0008)
    IRP information: 0x01, Direction: PDO -> FDO
        0000 000. = Reserved: 0x00
        .... ...1 = Direction: PDO -> FDO (0x1)
    URB bus id: 1
    Device address: 6
    Endpoint: 0x80, Direction: IN
        1... .... = Direction: IN (1)
        .... 0000 = Endpoint number: 0
    URB transfer type: URB_CONTROL (0x02)
    Packet Data Length: 1
    [Request in: 281]
    [Time from request: 0.000142000 seconds]
    Control transfer stage: Data (1)
    [bInterfaceClass: Unknown (0xffff)]
CONTROL response data: 03

No.     Time           Source                Destination           Protocol Length Info
    283 0.490630       1.6.0                 host                  USB      28     GET CONFIGURATION Status

Frame 283: 28 bytes on wire (224 bits), 28 bytes captured (224 bits) on interface 0
USB URB
    [Source: 1.6.0]
    [Destination: host]
    USBPcap pseudoheader length: 28
    IRP ID: 0xffff800307a97690
    IRP USBD_STATUS: USBD_STATUS_SUCCESS (0x00000000)
    URB Function: URB_FUNCTION_CONTROL_TRANSFER (0x0008)
    IRP information: 0x01, Direction: PDO -> FDO
        0000 000. = Reserved: 0x00
        .... ...1 = Direction: PDO -> FDO (0x1)
    URB bus id: 1
    Device address: 6
    Endpoint: 0x80, Direction: IN
        1... .... = Direction: IN (1)
        .... 0000 = Endpoint number: 0
    URB transfer type: URB_CONTROL (0x02)
    Packet Data Length: 0
    [Request in: 281]
    [Time from request: 0.000165000 seconds]
    Control transfer stage: Status (2)

No.     Time           Source                Destination           Protocol Length Info
    284 0.532884       host                  1.6.0                 USB      36     URB_CONTROL out

Frame 284: 36 bytes on wire (288 bits), 36 bytes captured (288 bits) on interface 0
USB URB
    [Source: host]
    [Destination: 1.6.0]
    USBPcap pseudoheader length: 28
    IRP ID: 0xffff80030765b010
    IRP USBD_STATUS: USBD_STATUS_SUCCESS (0x00000000)
    URB Function: URB_FUNCTION_CONTROL_TRANSFER (0x0008)
    IRP information: 0x00, Direction: FDO -> PDO
        0000 000. = Reserved: 0x00
        .... ...0 = Direction: FDO -> PDO (0x0)
    URB bus id: 1
    Device address: 6
    Endpoint: 0x00, Direction: OUT
        0... .... = Direction: OUT (0)
        .... 0000 = Endpoint number: 0
    URB transfer type: URB_CONTROL (0x02)
    Packet Data Length: 8
    [Response in: 285]
    Control transfer stage: Setup (0)
    [bInterfaceClass: Unknown (0xffff)]
URB setup
    bmRequestType: 0x41
    bRequest: 18
    wValue: 0x000a
    wIndex: 0 (0x0000)
    wLength: 0

No.     Time           Source                Destination           Protocol Length Info
    285 0.533009       1.6.0                 host                  USB      28     Unknown type 12 Status

Frame 285: 28 bytes on wire (224 bits), 28 bytes captured (224 bits) on interface 0
USB URB
    [Source: 1.6.0]
    [Destination: host]
    USBPcap pseudoheader length: 28
    IRP ID: 0xffff80030765b010
    IRP USBD_STATUS: USBD_STATUS_SUCCESS (0x00000000)
    URB Function: URB_FUNCTION_CONTROL_TRANSFER (0x0008)
    IRP information: 0x01, Direction: PDO -> FDO
        0000 000. = Reserved: 0x00
        .... ...1 = Direction: PDO -> FDO (0x1)
    URB bus id: 1
    Device address: 6
    Endpoint: 0x00, Direction: OUT
        0... .... = Direction: OUT (0)
        .... 0000 = Endpoint number: 0
    URB transfer type: URB_CONTROL (0x02)
    Packet Data Length: 0
    [Request in: 284]
    [Time from request: 0.000125000 seconds]
    Control transfer stage: Status (2)

No.     Time           Source                Destination           Protocol Length Info
    286 0.533063       host                  1.6.1                 USB      36     URB_BULK out

Frame 286: 36 bytes on wire (288 bits), 36 bytes captured (288 bits) on interface 0
USB URB
    [Source: host]
    [Destination: 1.6.1]
    USBPcap pseudoheader length: 27
    IRP ID: 0xffff800307a97690
    IRP USBD_STATUS: USBD_STATUS_SUCCESS (0x00000000)
    URB Function: URB_FUNCTION_BULK_OR_INTERRUPT_TRANSFER (0x0009)
    IRP information: 0x00, Direction: FDO -> PDO
        0000 000. = Reserved: 0x00
        .... ...0 = Direction: FDO -> PDO (0x0)
    URB bus id: 1
    Device address: 6
    Endpoint: 0x01, Direction: OUT
        0... .... = Direction: OUT (0)
        .... 0001 = Endpoint number: 1
    URB transfer type: URB_BULK (0x03)
    Packet Data Length: 9
    [bInterfaceClass: Unknown (0xffff)]
Leftover Capture Data: 2f303043435233380d

No.     Time           Source                Destination           Protocol Length Info
    287 0.545406       1.6.2                 host                  USB      36     URB_BULK in

Frame 287: 36 bytes on wire (288 bits), 36 bytes captured (288 bits) on interface 0
USB URB
    [Source: 1.6.2]
    [Destination: host]
    USBPcap pseudoheader length: 27
    IRP ID: 0xffff80030a541010
    IRP USBD_STATUS: USBD_STATUS_SUCCESS (0x00000000)
    URB Function: URB_FUNCTION_BULK_OR_INTERRUPT_TRANSFER (0x0009)
    IRP information: 0x01, Direction: PDO -> FDO
        0000 000. = Reserved: 0x00
        .... ...1 = Direction: PDO -> FDO (0x1)
    URB bus id: 1
    Device address: 6
    Endpoint: 0x82, Direction: IN
        1... .... = Direction: IN (1)
        .... 0010 = Endpoint number: 2
    URB transfer type: URB_BULK (0x03)
    Packet Data Length: 9
    [bInterfaceClass: Unknown (0xffff)]
Leftover Capture Data: 2f413030434345360d

No.     Time           Source                Destination           Protocol Length Info
    288 0.570481       host                  1.6.0                 USB      36     URB_CONTROL in

Frame 288: 36 bytes on wire (288 bits), 36 bytes captured (288 bits) on interface 0
USB URB
    [Source: host]
    [Destination: 1.6.0]
    USBPcap pseudoheader length: 28
    IRP ID: 0xffff800307a97690
    IRP USBD_STATUS: USBD_STATUS_SUCCESS (0x00000000)
    URB Function: URB_FUNCTION_CONTROL_TRANSFER (0x0008)
    IRP information: 0x00, Direction: FDO -> PDO
        0000 000. = Reserved: 0x00
        .... ...0 = Direction: FDO -> PDO (0x0)
    URB bus id: 1
    Device address: 6
    Endpoint: 0x80, Direction: IN
        1... .... = Direction: IN (1)
        .... 0000 = Endpoint number: 0
    URB transfer type: URB_CONTROL (0x02)
    Packet Data Length: 8
    [Response in: 289]
    Control transfer stage: Setup (0)
    [bInterfaceClass: Unknown (0xffff)]
URB setup
    bmRequestType: 0xc1
    bRequest: 8
    wValue: 0x0000
    wIndex: 0 (0x0000)
    wLength: 4

No.     Time           Source                Destination           Protocol Length Info
    289 0.570670       1.6.0                 host                  USB      29     URB_CONTROL in

Frame 289: 29 bytes on wire (232 bits), 29 bytes captured (232 bits) on interface 0
USB URB
    [Source: 1.6.0]
    [Destination: host]
    USBPcap pseudoheader length: 28
    IRP ID: 0xffff800307a97690
    IRP USBD_STATUS: USBD_STATUS_SUCCESS (0x00000000)
    URB Function: URB_FUNCTION_CONTROL_TRANSFER (0x0008)
    IRP information: 0x01, Direction: PDO -> FDO
        0000 000. = Reserved: 0x00
        .... ...1 = Direction: PDO -> FDO (0x1)
    URB bus id: 1
    Device address: 6
    Endpoint: 0x80, Direction: IN
        1... .... = Direction: IN (1)
        .... 0000 = Endpoint number: 0
    URB transfer type: URB_CONTROL (0x02)
    Packet Data Length: 1
    [Request in: 288]
    [Time from request: 0.000189000 seconds]
    Control transfer stage: Data (1)
    [bInterfaceClass: Unknown (0xffff)]
CONTROL response data: 03

No.     Time           Source                Destination           Protocol Length Info
    290 0.570671       1.6.0                 host                  USB      28     GET CONFIGURATION Status

Frame 290: 28 bytes on wire (224 bits), 28 bytes captured (224 bits) on interface 0
USB URB
    [Source: 1.6.0]
    [Destination: host]
    USBPcap pseudoheader length: 28
    IRP ID: 0xffff800307a97690
    IRP USBD_STATUS: USBD_STATUS_SUCCESS (0x00000000)
    URB Function: URB_FUNCTION_CONTROL_TRANSFER (0x0008)
    IRP information: 0x01, Direction: PDO -> FDO
        0000 000. = Reserved: 0x00
        .... ...1 = Direction: PDO -> FDO (0x1)
    URB bus id: 1
    Device address: 6
    Endpoint: 0x80, Direction: IN
        1... .... = Direction: IN (1)
        .... 0000 = Endpoint number: 0
    URB transfer type: URB_CONTROL (0x02)
    Packet Data Length: 0
    [Request in: 288]
    [Time from request: 0.000190000 seconds]
    Control transfer stage: Status (2)

No.     Time           Source                Destination           Protocol Length Info
    291 0.650488       host                  1.6.0                 USB      36     URB_CONTROL in

Frame 291: 36 bytes on wire (288 bits), 36 bytes captured (288 bits) on interface 0
USB URB
    [Source: host]
    [Destination: 1.6.0]
    USBPcap pseudoheader length: 28
    IRP ID: 0xffff800307a97690
    IRP USBD_STATUS: USBD_STATUS_SUCCESS (0x00000000)
    URB Function: URB_FUNCTION_CONTROL_TRANSFER (0x0008)
    IRP information: 0x00, Direction: FDO -> PDO
        0000 000. = Reserved: 0x00
        .... ...0 = Direction: FDO -> PDO (0x0)
    URB bus id: 1
    Device address: 6
    Endpoint: 0x80, Direction: IN
        1... .... = Direction: IN (1)
        .... 0000 = Endpoint number: 0
    URB transfer type: URB_CONTROL (0x02)
    Packet Data Length: 8
    [Response in: 292]
    Control transfer stage: Setup (0)
    [bInterfaceClass: Unknown (0xffff)]
URB setup
    bmRequestType: 0xc1
    bRequest: 8
    wValue: 0x0000
    wIndex: 0 (0x0000)
    wLength: 4

No.     Time           Source                Destination           Protocol Length Info
    292 0.650665       1.6.0                 host                  USB      29     URB_CONTROL in

Frame 292: 29 bytes on wire (232 bits), 29 bytes captured (232 bits) on interface 0
USB URB
    [Source: 1.6.0]
    [Destination: host]
    USBPcap pseudoheader length: 28
    IRP ID: 0xffff800307a97690
    IRP USBD_STATUS: USBD_STATUS_SUCCESS (0x00000000)
    URB Function: URB_FUNCTION_CONTROL_TRANSFER (0x0008)
    IRP information: 0x01, Direction: PDO -> FDO
        0000 000. = Reserved: 0x00
        .... ...1 = Direction: PDO -> FDO (0x1)
    URB bus id: 1
    Device address: 6
    Endpoint: 0x80, Direction: IN
        1... .... = Direction: IN (1)
        .... 0000 = Endpoint number: 0
    URB transfer type: URB_CONTROL (0x02)
    Packet Data Length: 1
    [Request in: 291]
    [Time from request: 0.000177000 seconds]
    Control transfer stage: Data (1)
    [bInterfaceClass: Unknown (0xffff)]
CONTROL response data: 03

No.     Time           Source                Destination           Protocol Length Info
    293 0.650665       1.6.0                 host                  USB      28     GET CONFIGURATION Status

Frame 293: 28 bytes on wire (224 bits), 28 bytes captured (224 bits) on interface 0
USB URB
    [Source: 1.6.0]
    [Destination: host]
    USBPcap pseudoheader length: 28
    IRP ID: 0xffff800307a97690
    IRP USBD_STATUS: USBD_STATUS_SUCCESS (0x00000000)
    URB Function: URB_FUNCTION_CONTROL_TRANSFER (0x0008)
    IRP information: 0x01, Direction: PDO -> FDO
        0000 000. = Reserved: 0x00
        .... ...1 = Direction: PDO -> FDO (0x1)
    URB bus id: 1
    Device address: 6
    Endpoint: 0x80, Direction: IN
        1... .... = Direction: IN (1)
        .... 0000 = Endpoint number: 0
    URB transfer type: URB_CONTROL (0x02)
    Packet Data Length: 0
    [Request in: 291]
    [Time from request: 0.000177000 seconds]
    Control transfer stage: Status (2)

No.     Time           Source                Destination           Protocol Length Info
    294 0.675205       host                  1.6.0                 USB      36     URB_CONTROL out

Frame 294: 36 bytes on wire (288 bits), 36 bytes captured (288 bits) on interface 0
USB URB
    [Source: host]
    [Destination: 1.6.0]
    USBPcap pseudoheader length: 28
    IRP ID: 0xffff800306e436e0
    IRP USBD_STATUS: USBD_STATUS_SUCCESS (0x00000000)
    URB Function: URB_FUNCTION_CONTROL_TRANSFER (0x0008)
    IRP information: 0x00, Direction: FDO -> PDO
        0000 000. = Reserved: 0x00
        .... ...0 = Direction: FDO -> PDO (0x0)
    URB bus id: 1
    Device address: 6
    Endpoint: 0x00, Direction: OUT
        0... .... = Direction: OUT (0)
        .... 0000 = Endpoint number: 0
    URB transfer type: URB_CONTROL (0x02)
    Packet Data Length: 8
    [Response in: 296]
    Control transfer stage: Setup (0)
    [bInterfaceClass: Unknown (0xffff)]
URB setup
    bmRequestType: 0x41
    bRequest: 18
    wValue: 0x0005
    wIndex: 0 (0x0000)
    wLength: 0

No.     Time           Source                Destination           Protocol Length Info
    295 0.675268       host                  1.6.0                 USB      36     URB_CONTROL out

Frame 295: 36 bytes on wire (288 bits), 36 bytes captured (288 bits) on interface 0
USB URB
    [Source: host]
    [Destination: 1.6.0]
    USBPcap pseudoheader length: 28
    IRP ID: 0xffff800307881010
    IRP USBD_STATUS: USBD_STATUS_SUCCESS (0x00000000)
    URB Function: URB_FUNCTION_CONTROL_TRANSFER (0x0008)
    IRP information: 0x00, Direction: FDO -> PDO
        0000 000. = Reserved: 0x00
        .... ...0 = Direction: FDO -> PDO (0x0)
    URB bus id: 1
    Device address: 6
    Endpoint: 0x00, Direction: OUT
        0... .... = Direction: OUT (0)
        .... 0000 = Endpoint number: 0
    URB transfer type: URB_CONTROL (0x02)
    Packet Data Length: 8
    [Response in: 297]
    Control transfer stage: Setup (0)
    [bInterfaceClass: Unknown (0xffff)]
URB setup
    bmRequestType: 0x41
    bRequest: 18
    wValue: 0x0005
    wIndex: 0 (0x0000)
    wLength: 0

No.     Time           Source                Destination           Protocol Length Info
    296 0.675343       1.6.0                 host                  USB      28     Unknown type 12 Status

Frame 296: 28 bytes on wire (224 bits), 28 bytes captured (224 bits) on interface 0
USB URB
    [Source: 1.6.0]
    [Destination: host]
    USBPcap pseudoheader length: 28
    IRP ID: 0xffff800306e436e0
    IRP USBD_STATUS: USBD_STATUS_SUCCESS (0x00000000)
    URB Function: URB_FUNCTION_CONTROL_TRANSFER (0x0008)
    IRP information: 0x01, Direction: PDO -> FDO
        0000 000. = Reserved: 0x00
        .... ...1 = Direction: PDO -> FDO (0x1)
    URB bus id: 1
    Device address: 6
    Endpoint: 0x00, Direction: OUT
        0... .... = Direction: OUT (0)
        .... 0000 = Endpoint number: 0
    URB transfer type: URB_CONTROL (0x02)
    Packet Data Length: 0
    [Request in: 294]
    [Time from request: 0.000138000 seconds]
    Control transfer stage: Status (2)

No.     Time           Source                Destination           Protocol Length Info
    297 0.675419       1.6.0                 host                  USB      28     Unknown type 12 Status

Frame 297: 28 bytes on wire (224 bits), 28 bytes captured (224 bits) on interface 0
USB URB
    [Source: 1.6.0]
    [Destination: host]
    USBPcap pseudoheader length: 28
    IRP ID: 0xffff800307881010
    IRP USBD_STATUS: USBD_STATUS_SUCCESS (0x00000000)
    URB Function: URB_FUNCTION_CONTROL_TRANSFER (0x0008)
    IRP information: 0x01, Direction: PDO -> FDO
        0000 000. = Reserved: 0x00
        .... ...1 = Direction: PDO -> FDO (0x1)
    URB bus id: 1
    Device address: 6
    Endpoint: 0x00, Direction: OUT
        0... .... = Direction: OUT (0)
        .... 0000 = Endpoint number: 0
    URB transfer type: URB_CONTROL (0x02)
    Packet Data Length: 0
    [Request in: 295]
    [Time from request: 0.000151000 seconds]
    Control transfer stage: Status (2)

No.     Time           Source                Destination           Protocol Length Info
    298 0.675875       host                  1.6.0                 USB      36     URB_CONTROL out

Frame 298: 36 bytes on wire (288 bits), 36 bytes captured (288 bits) on interface 0
USB URB
    [Source: host]
    [Destination: 1.6.0]
    USBPcap pseudoheader length: 28
    IRP ID: 0xffff800307881010
    IRP USBD_STATUS: USBD_STATUS_SUCCESS (0x00000000)
    URB Function: URB_FUNCTION_CONTROL_TRANSFER (0x0008)
    IRP information: 0x00, Direction: FDO -> PDO
        0000 000. = Reserved: 0x00
        .... ...0 = Direction: FDO -> PDO (0x0)
    URB bus id: 1
    Device address: 6
    Endpoint: 0x00, Direction: OUT
        0... .... = Direction: OUT (0)
        .... 0000 = Endpoint number: 0
    URB transfer type: URB_CONTROL (0x02)
    Packet Data Length: 8
    [Response in: 299]
    Control transfer stage: Setup (0)
    [bInterfaceClass: Unknown (0xffff)]
URB setup
    bmRequestType: 0x41
    bRequest: 18
    wValue: 0x000a
    wIndex: 0 (0x0000)
    wLength: 0

No.     Time           Source                Destination           Protocol Length Info
    299 0.675967       1.6.0                 host                  USB      28     Unknown type 12 Status

Frame 299: 28 bytes on wire (224 bits), 28 bytes captured (224 bits) on interface 0
USB URB
    [Source: 1.6.0]
    [Destination: host]
    USBPcap pseudoheader length: 28
    IRP ID: 0xffff800307881010
    IRP USBD_STATUS: USBD_STATUS_SUCCESS (0x00000000)
    URB Function: URB_FUNCTION_CONTROL_TRANSFER (0x0008)
    IRP information: 0x01, Direction: PDO -> FDO
        0000 000. = Reserved: 0x00
        .... ...1 = Direction: PDO -> FDO (0x1)
    URB bus id: 1
    Device address: 6
    Endpoint: 0x00, Direction: OUT
        0... .... = Direction: OUT (0)
        .... 0000 = Endpoint number: 0
    URB transfer type: URB_CONTROL (0x02)
    Packet Data Length: 0
    [Request in: 298]
    [Time from request: 0.000092000 seconds]
    Control transfer stage: Status (2)

No.     Time           Source                Destination           Protocol Length Info
    300 0.676011       host                  1.6.0                 USB      36     URB_CONTROL out

Frame 300: 36 bytes on wire (288 bits), 36 bytes captured (288 bits) on interface 0
USB URB
    [Source: host]
    [Destination: 1.6.0]
    USBPcap pseudoheader length: 28
    IRP ID: 0xffff80030aad3af0
    IRP USBD_STATUS: USBD_STATUS_SUCCESS (0x00000000)
    URB Function: URB_FUNCTION_CONTROL_TRANSFER (0x0008)
    IRP information: 0x00, Direction: FDO -> PDO
        0000 000. = Reserved: 0x00
        .... ...0 = Direction: FDO -> PDO (0x0)
    URB bus id: 1
    Device address: 6
    Endpoint: 0x00, Direction: OUT
        0... .... = Direction: OUT (0)
        .... 0000 = Endpoint number: 0
    URB transfer type: URB_CONTROL (0x02)
    Packet Data Length: 8
    [Response in: 301]
    Control transfer stage: Setup (0)
    [bInterfaceClass: Unknown (0xffff)]
URB setup
    bmRequestType: 0x41
    bRequest: 7
    wValue: 0x0100
    wIndex: 0 (0x0000)
    wLength: 0

No.     Time           Source                Destination           Protocol Length Info
    301 0.676065       1.6.0                 host                  USB      28     SET DESCRIPTOR Status

Frame 301: 28 bytes on wire (224 bits), 28 bytes captured (224 bits) on interface 0
USB URB
    [Source: 1.6.0]
    [Destination: host]
    USBPcap pseudoheader length: 28
    IRP ID: 0xffff80030aad3af0
    IRP USBD_STATUS: USBD_STATUS_SUCCESS (0x00000000)
    URB Function: URB_FUNCTION_CONTROL_TRANSFER (0x0008)
    IRP information: 0x01, Direction: PDO -> FDO
        0000 000. = Reserved: 0x00
        .... ...1 = Direction: PDO -> FDO (0x1)
    URB bus id: 1
    Device address: 6
    Endpoint: 0x00, Direction: OUT
        0... .... = Direction: OUT (0)
        .... 0000 = Endpoint number: 0
    URB transfer type: URB_CONTROL (0x02)
    Packet Data Length: 0
    [Request in: 300]
    [Time from request: 0.000054000 seconds]
    Control transfer stage: Status (2)

No.     Time           Source                Destination           Protocol Length Info
    302 0.676075       host                  1.6.0                 USB      36     URB_CONTROL in

Frame 302: 36 bytes on wire (288 bits), 36 bytes captured (288 bits) on interface 0
USB URB
    [Source: host]
    [Destination: 1.6.0]
    USBPcap pseudoheader length: 28
    IRP ID: 0xffff80030aad3af0
    IRP USBD_STATUS: USBD_STATUS_SUCCESS (0x00000000)
    URB Function: URB_FUNCTION_CONTROL_TRANSFER (0x0008)
    IRP information: 0x00, Direction: FDO -> PDO
        0000 000. = Reserved: 0x00
        .... ...0 = Direction: FDO -> PDO (0x0)
    URB bus id: 1
    Device address: 6
    Endpoint: 0x80, Direction: IN
        1... .... = Direction: IN (1)
        .... 0000 = Endpoint number: 0
    URB transfer type: URB_CONTROL (0x02)
    Packet Data Length: 8
    [Response in: 304]
    Control transfer stage: Setup (0)
    [bInterfaceClass: Unknown (0xffff)]
URB setup
    bmRequestType: 0xc1
    bRequest: 8
    wValue: 0x0000
    wIndex: 0 (0x0000)
    wLength: 4

No.     Time           Source                Destination           Protocol Length Info
    303 0.676082       host                  1.6.0                 USB      36     URB_CONTROL out

Frame 303: 36 bytes on wire (288 bits), 36 bytes captured (288 bits) on interface 0
USB URB
    [Source: host]
    [Destination: 1.6.0]
    USBPcap pseudoheader length: 28
    IRP ID: 0xffff800307881010
    IRP USBD_STATUS: USBD_STATUS_SUCCESS (0x00000000)
    URB Function: URB_FUNCTION_CONTROL_TRANSFER (0x0008)
    IRP information: 0x00, Direction: FDO -> PDO
        0000 000. = Reserved: 0x00
        .... ...0 = Direction: FDO -> PDO (0x0)
    URB bus id: 1
    Device address: 6
    Endpoint: 0x00, Direction: OUT
        0... .... = Direction: OUT (0)
        .... 0000 = Endpoint number: 0
    URB transfer type: URB_CONTROL (0x02)
    Packet Data Length: 8
    [Response in: 306]
    Control transfer stage: Setup (0)
    [bInterfaceClass: Unknown (0xffff)]
URB setup
    bmRequestType: 0x41
    bRequest: 7
    wValue: 0x0200
    wIndex: 0 (0x0000)
    wLength: 0

No.     Time           Source                Destination           Protocol Length Info
    304 0.676196       1.6.0                 host                  USB      29     URB_CONTROL in

Frame 304: 29 bytes on wire (232 bits), 29 bytes captured (232 bits) on interface 0
USB URB
    [Source: 1.6.0]
    [Destination: host]
    USBPcap pseudoheader length: 28
    IRP ID: 0xffff80030aad3af0
    IRP USBD_STATUS: USBD_STATUS_SUCCESS (0x00000000)
    URB Function: URB_FUNCTION_CONTROL_TRANSFER (0x0008)
    IRP information: 0x01, Direction: PDO -> FDO
        0000 000. = Reserved: 0x00
        .... ...1 = Direction: PDO -> FDO (0x1)
    URB bus id: 1
    Device address: 6
    Endpoint: 0x80, Direction: IN
        1... .... = Direction: IN (1)
        .... 0000 = Endpoint number: 0
    URB transfer type: URB_CONTROL (0x02)
    Packet Data Length: 1
    [Request in: 302]
    [Time from request: 0.000121000 seconds]
    Control transfer stage: Data (1)
    [bInterfaceClass: Unknown (0xffff)]
CONTROL response data: 02

No.     Time           Source                Destination           Protocol Length Info
    305 0.676196       1.6.0                 host                  USB      28     GET CONFIGURATION Status

Frame 305: 28 bytes on wire (224 bits), 28 bytes captured (224 bits) on interface 0
USB URB
    [Source: 1.6.0]
    [Destination: host]
    USBPcap pseudoheader length: 28
    IRP ID: 0xffff80030aad3af0
    IRP USBD_STATUS: USBD_STATUS_SUCCESS (0x00000000)
    URB Function: URB_FUNCTION_CONTROL_TRANSFER (0x0008)
    IRP information: 0x01, Direction: PDO -> FDO
        0000 000. = Reserved: 0x00
        .... ...1 = Direction: PDO -> FDO (0x1)
    URB bus id: 1
    Device address: 6
    Endpoint: 0x80, Direction: IN
        1... .... = Direction: IN (1)
        .... 0000 = Endpoint number: 0
    URB transfer type: URB_CONTROL (0x02)
    Packet Data Length: 0
    [Request in: 302]
    [Time from request: 0.000121000 seconds]
    Control transfer stage: Status (2)

No.     Time           Source                Destination           Protocol Length Info
    306 0.676245       1.6.0                 host                  USB      28     SET DESCRIPTOR Status

Frame 306: 28 bytes on wire (224 bits), 28 bytes captured (224 bits) on interface 0
USB URB
    [Source: 1.6.0]
    [Destination: host]
    USBPcap pseudoheader length: 28
    IRP ID: 0xffff800307881010
    IRP USBD_STATUS: USBD_STATUS_SUCCESS (0x00000000)
    URB Function: URB_FUNCTION_CONTROL_TRANSFER (0x0008)
    IRP information: 0x01, Direction: PDO -> FDO
        0000 000. = Reserved: 0x00
        .... ...1 = Direction: PDO -> FDO (0x1)
    URB bus id: 1
    Device address: 6
    Endpoint: 0x00, Direction: OUT
        0... .... = Direction: OUT (0)
        .... 0000 = Endpoint number: 0
    URB transfer type: URB_CONTROL (0x02)
    Packet Data Length: 0
    [Request in: 303]
    [Time from request: 0.000163000 seconds]
    Control transfer stage: Status (2)

No.     Time           Source                Destination           Protocol Length Info
    307 0.676252       host                  1.6.0                 USB      36     URB_CONTROL in

Frame 307: 36 bytes on wire (288 bits), 36 bytes captured (288 bits) on interface 0
USB URB
    [Source: host]
    [Destination: 1.6.0]
    USBPcap pseudoheader length: 28
    IRP ID: 0xffff80030aad3af0
    IRP USBD_STATUS: USBD_STATUS_SUCCESS (0x00000000)
    URB Function: URB_FUNCTION_CONTROL_TRANSFER (0x0008)
    IRP information: 0x00, Direction: FDO -> PDO
        0000 000. = Reserved: 0x00
        .... ...0 = Direction: FDO -> PDO (0x0)
    URB bus id: 1
    Device address: 6
    Endpoint: 0x80, Direction: IN
        1... .... = Direction: IN (1)
        .... 0000 = Endpoint number: 0
    URB transfer type: URB_CONTROL (0x02)
    Packet Data Length: 8
    [Response in: 309]
    Control transfer stage: Setup (0)
    [bInterfaceClass: Unknown (0xffff)]
URB setup
    bmRequestType: 0xc1
    bRequest: 8
    wValue: 0x0000
    wIndex: 0 (0x0000)
    wLength: 4

No.     Time           Source                Destination           Protocol Length Info
    308 0.676307       host                  1.6.0                 USB      36     URB_CONTROL out

Frame 308: 36 bytes on wire (288 bits), 36 bytes captured (288 bits) on interface 0
USB URB
    [Source: host]
    [Destination: 1.6.0]
    USBPcap pseudoheader length: 28
    IRP ID: 0xffff800307881010
    IRP USBD_STATUS: USBD_STATUS_SUCCESS (0x00000000)
    URB Function: URB_FUNCTION_CONTROL_TRANSFER (0x0008)
    IRP information: 0x00, Direction: FDO -> PDO
        0000 000. = Reserved: 0x00
        .... ...0 = Direction: FDO -> PDO (0x0)
    URB bus id: 1
    Device address: 6
    Endpoint: 0x00, Direction: OUT
        0... .... = Direction: OUT (0)
        .... 0000 = Endpoint number: 0
    URB transfer type: URB_CONTROL (0x02)
    Packet Data Length: 8
    [Response in: 311]
    Control transfer stage: Setup (0)
    [bInterfaceClass: Unknown (0xffff)]
URB setup
    bmRequestType: 0x41
    bRequest: 30
    wValue: 0x0000
    wIndex: 0 (0x0000)
    wLength: 4

No.     Time           Source                Destination           Protocol Length Info
    309 0.676395       1.6.0                 host                  USB      29     URB_CONTROL in

Frame 309: 29 bytes on wire (232 bits), 29 bytes captured (232 bits) on interface 0
USB URB
    [Source: 1.6.0]
    [Destination: host]
    USBPcap pseudoheader length: 28
    IRP ID: 0xffff80030aad3af0
    IRP USBD_STATUS: USBD_STATUS_SUCCESS (0x00000000)
    URB Function: URB_FUNCTION_CONTROL_TRANSFER (0x0008)
    IRP information: 0x01, Direction: PDO -> FDO
        0000 000. = Reserved: 0x00
        .... ...1 = Direction: PDO -> FDO (0x1)
    URB bus id: 1
    Device address: 6
    Endpoint: 0x80, Direction: IN
        1... .... = Direction: IN (1)
        .... 0000 = Endpoint number: 0
    URB transfer type: URB_CONTROL (0x02)
    Packet Data Length: 1
    [Request in: 307]
    [Time from request: 0.000143000 seconds]
    Control transfer stage: Data (1)
    [bInterfaceClass: Unknown (0xffff)]
CONTROL response data: 00

No.     Time           Source                Destination           Protocol Length Info
    310 0.676396       1.6.0                 host                  USB      28     GET CONFIGURATION Status

Frame 310: 28 bytes on wire (224 bits), 28 bytes captured (224 bits) on interface 0
USB URB
    [Source: 1.6.0]
    [Destination: host]
    USBPcap pseudoheader length: 28
    IRP ID: 0xffff80030aad3af0
    IRP USBD_STATUS: USBD_STATUS_SUCCESS (0x00000000)
    URB Function: URB_FUNCTION_CONTROL_TRANSFER (0x0008)
    IRP information: 0x01, Direction: PDO -> FDO
        0000 000. = Reserved: 0x00
        .... ...1 = Direction: PDO -> FDO (0x1)
    URB bus id: 1
    Device address: 6
    Endpoint: 0x80, Direction: IN
        1... .... = Direction: IN (1)
        .... 0000 = Endpoint number: 0
    URB transfer type: URB_CONTROL (0x02)
    Packet Data Length: 0
    [Request in: 307]
    [Time from request: 0.000144000 seconds]
    Control transfer stage: Status (2)

No.     Time           Source                Destination           Protocol Length Info
    311 0.676518       1.6.0                 host                  USB      32     URB_CONTROL out

Frame 311: 32 bytes on wire (256 bits), 32 bytes captured (256 bits) on interface 0
USB URB
    [Source: 1.6.0]
    [Destination: host]
    USBPcap pseudoheader length: 28
    IRP ID: 0xffff800307881010
    IRP USBD_STATUS: USBD_STATUS_SUCCESS (0x00000000)
    URB Function: URB_FUNCTION_CONTROL_TRANSFER (0x0008)
    IRP information: 0x01, Direction: PDO -> FDO
        0000 000. = Reserved: 0x00
        .... ...1 = Direction: PDO -> FDO (0x1)
    URB bus id: 1
    Device address: 6
    Endpoint: 0x00, Direction: OUT
        0... .... = Direction: OUT (0)
        .... 0000 = Endpoint number: 0
    URB transfer type: URB_CONTROL (0x02)
    Packet Data Length: 4
    [Request in: 308]
    [Time from request: 0.000211000 seconds]
    Control transfer stage: Data (1)
    [bInterfaceClass: Unknown (0xffff)]
CONTROL response data: b0040000

No.     Time           Source                Destination           Protocol Length Info
    312 0.676518       1.6.0                 host                  USB      28     Unknown type 1e Status

Frame 312: 28 bytes on wire (224 bits), 28 bytes captured (224 bits) on interface 0
USB URB
    [Source: 1.6.0]
    [Destination: host]
    USBPcap pseudoheader length: 28
    IRP ID: 0xffff800307881010
    IRP USBD_STATUS: USBD_STATUS_SUCCESS (0x00000000)
    URB Function: URB_FUNCTION_CONTROL_TRANSFER (0x0008)
    IRP information: 0x01, Direction: PDO -> FDO
        0000 000. = Reserved: 0x00
        .... ...1 = Direction: PDO -> FDO (0x1)
    URB bus id: 1
    Device address: 6
    Endpoint: 0x00, Direction: OUT
        0... .... = Direction: OUT (0)
        .... 0000 = Endpoint number: 0
    URB transfer type: URB_CONTROL (0x02)
    Packet Data Length: 0
    [Request in: 308]
    [Time from request: 0.000211000 seconds]
    Control transfer stage: Status (2)

No.     Time           Source                Destination           Protocol Length Info
    313 0.676533       host                  1.6.0                 USB      36     URB_CONTROL out

Frame 313: 36 bytes on wire (288 bits), 36 bytes captured (288 bits) on interface 0
USB URB
    [Source: host]
    [Destination: 1.6.0]
    USBPcap pseudoheader length: 28
    IRP ID: 0xffff80030aad3af0
    IRP USBD_STATUS: USBD_STATUS_SUCCESS (0x00000000)
    URB Function: URB_FUNCTION_CONTROL_TRANSFER (0x0008)
    IRP information: 0x00, Direction: FDO -> PDO
        0000 000. = Reserved: 0x00
        .... ...0 = Direction: FDO -> PDO (0x0)
    URB bus id: 1
    Device address: 6
    Endpoint: 0x00, Direction: OUT
        0... .... = Direction: OUT (0)
        .... 0000 = Endpoint number: 0
    URB transfer type: URB_CONTROL (0x02)
    Packet Data Length: 8
    [Response in: 314]
    Control transfer stage: Setup (0)
    [bInterfaceClass: Unknown (0xffff)]
URB setup
    bmRequestType: 0x41
    bRequest: 7
    wValue: 0x0200
    wIndex: 0 (0x0000)
    wLength: 0

No.     Time           Source                Destination           Protocol Length Info
    314 0.676598       1.6.0                 host                  USB      28     SET DESCRIPTOR Status

Frame 314: 28 bytes on wire (224 bits), 28 bytes captured (224 bits) on interface 0
USB URB
    [Source: 1.6.0]
    [Destination: host]
    USBPcap pseudoheader length: 28
    IRP ID: 0xffff80030aad3af0
    IRP USBD_STATUS: USBD_STATUS_SUCCESS (0x00000000)
    URB Function: URB_FUNCTION_CONTROL_TRANSFER (0x0008)
    IRP information: 0x01, Direction: PDO -> FDO
        0000 000. = Reserved: 0x00
        .... ...1 = Direction: PDO -> FDO (0x1)
    URB bus id: 1
    Device address: 6
    Endpoint: 0x00, Direction: OUT
        0... .... = Direction: OUT (0)
        .... 0000 = Endpoint number: 0
    URB transfer type: URB_CONTROL (0x02)
    Packet Data Length: 0
    [Request in: 313]
    [Time from request: 0.000065000 seconds]
    Control transfer stage: Status (2)

No.     Time           Source                Destination           Protocol Length Info
    315 0.676605       host                  1.6.0                 USB      36     URB_CONTROL in

Frame 315: 36 bytes on wire (288 bits), 36 bytes captured (288 bits) on interface 0
USB URB
    [Source: host]
    [Destination: 1.6.0]
    USBPcap pseudoheader length: 28
    IRP ID: 0xffff80030aad3af0
    IRP USBD_STATUS: USBD_STATUS_SUCCESS (0x00000000)
    URB Function: URB_FUNCTION_CONTROL_TRANSFER (0x0008)
    IRP information: 0x00, Direction: FDO -> PDO
        0000 000. = Reserved: 0x00
        .... ...0 = Direction: FDO -> PDO (0x0)
    URB bus id: 1
    Device address: 6
    Endpoint: 0x80, Direction: IN
        1... .... = Direction: IN (1)
        .... 0000 = Endpoint number: 0
    URB transfer type: URB_CONTROL (0x02)
    Packet Data Length: 8
    [Response in: 317]
    Control transfer stage: Setup (0)
    [bInterfaceClass: Unknown (0xffff)]
URB setup
    bmRequestType: 0xc1
    bRequest: 8
    wValue: 0x0000
    wIndex: 0 (0x0000)
    wLength: 4

No.     Time           Source                Destination           Protocol Length Info
    316 0.676615       host                  1.6.0                 USB      36     URB_CONTROL out

Frame 316: 36 bytes on wire (288 bits), 36 bytes captured (288 bits) on interface 0
USB URB
    [Source: host]
    [Destination: 1.6.0]
    USBPcap pseudoheader length: 28
    IRP ID: 0xffff800306e436e0
    IRP USBD_STATUS: USBD_STATUS_SUCCESS (0x00000000)
    URB Function: URB_FUNCTION_CONTROL_TRANSFER (0x0008)
    IRP information: 0x00, Direction: FDO -> PDO
        0000 000. = Reserved: 0x00
        .... ...0 = Direction: FDO -> PDO (0x0)
    URB bus id: 1
    Device address: 6
    Endpoint: 0x00, Direction: OUT
        0... .... = Direction: OUT (0)
        .... 0000 = Endpoint number: 0
    URB transfer type: URB_CONTROL (0x02)
    Packet Data Length: 8
    [Response in: 319]
    Control transfer stage: Setup (0)
    [bInterfaceClass: Unknown (0xffff)]
URB setup
    bmRequestType: 0x41
    bRequest: 7
    wValue: 0x0100
    wIndex: 0 (0x0000)
    wLength: 0

No.     Time           Source                Destination           Protocol Length Info
    317 0.676724       1.6.0                 host                  USB      29     URB_CONTROL in

Frame 317: 29 bytes on wire (232 bits), 29 bytes captured (232 bits) on interface 0
USB URB
    [Source: 1.6.0]
    [Destination: host]
    USBPcap pseudoheader length: 28
    IRP ID: 0xffff80030aad3af0
    IRP USBD_STATUS: USBD_STATUS_SUCCESS (0x00000000)
    URB Function: URB_FUNCTION_CONTROL_TRANSFER (0x0008)
    IRP information: 0x01, Direction: PDO -> FDO
        0000 000. = Reserved: 0x00
        .... ...1 = Direction: PDO -> FDO (0x1)
    URB bus id: 1
    Device address: 6
    Endpoint: 0x80, Direction: IN
        1... .... = Direction: IN (1)
        .... 0000 = Endpoint number: 0
    URB transfer type: URB_CONTROL (0x02)
    Packet Data Length: 1
    [Request in: 315]
    [Time from request: 0.000119000 seconds]
    Control transfer stage: Data (1)
    [bInterfaceClass: Unknown (0xffff)]
CONTROL response data: 00

No.     Time           Source                Destination           Protocol Length Info
    318 0.676725       1.6.0                 host                  USB      28     GET CONFIGURATION Status

Frame 318: 28 bytes on wire (224 bits), 28 bytes captured (224 bits) on interface 0
USB URB
    [Source: 1.6.0]
    [Destination: host]
    USBPcap pseudoheader length: 28
    IRP ID: 0xffff80030aad3af0
    IRP USBD_STATUS: USBD_STATUS_SUCCESS (0x00000000)
    URB Function: URB_FUNCTION_CONTROL_TRANSFER (0x0008)
    IRP information: 0x01, Direction: PDO -> FDO
        0000 000. = Reserved: 0x00
        .... ...1 = Direction: PDO -> FDO (0x1)
    URB bus id: 1
    Device address: 6
    Endpoint: 0x80, Direction: IN
        1... .... = Direction: IN (1)
        .... 0000 = Endpoint number: 0
    URB transfer type: URB_CONTROL (0x02)
    Packet Data Length: 0
    [Request in: 315]
    [Time from request: 0.000120000 seconds]
    Control transfer stage: Status (2)

No.     Time           Source                Destination           Protocol Length Info
    319 0.676774       1.6.0                 host                  USB      28     SET DESCRIPTOR Status

Frame 319: 28 bytes on wire (224 bits), 28 bytes captured (224 bits) on interface 0
USB URB
    [Source: 1.6.0]
    [Destination: host]
    USBPcap pseudoheader length: 28
    IRP ID: 0xffff800306e436e0
    IRP USBD_STATUS: USBD_STATUS_SUCCESS (0x00000000)
    URB Function: URB_FUNCTION_CONTROL_TRANSFER (0x0008)
    IRP information: 0x01, Direction: PDO -> FDO
        0000 000. = Reserved: 0x00
        .... ...1 = Direction: PDO -> FDO (0x1)
    URB bus id: 1
    Device address: 6
    Endpoint: 0x00, Direction: OUT
        0... .... = Direction: OUT (0)
        .... 0000 = Endpoint number: 0
    URB transfer type: URB_CONTROL (0x02)
    Packet Data Length: 0
    [Request in: 316]
    [Time from request: 0.000159000 seconds]
    Control transfer stage: Status (2)

No.     Time           Source                Destination           Protocol Length Info
    320 0.676782       host                  1.6.0                 USB      36     URB_CONTROL in

Frame 320: 36 bytes on wire (288 bits), 36 bytes captured (288 bits) on interface 0
USB URB
    [Source: host]
    [Destination: 1.6.0]
    USBPcap pseudoheader length: 28
    IRP ID: 0xffff80030aad3af0
    IRP USBD_STATUS: USBD_STATUS_SUCCESS (0x00000000)
    URB Function: URB_FUNCTION_CONTROL_TRANSFER (0x0008)
    IRP information: 0x00, Direction: FDO -> PDO
        0000 000. = Reserved: 0x00
        .... ...0 = Direction: FDO -> PDO (0x0)
    URB bus id: 1
    Device address: 6
    Endpoint: 0x80, Direction: IN
        1... .... = Direction: IN (1)
        .... 0000 = Endpoint number: 0
    URB transfer type: URB_CONTROL (0x02)
    Packet Data Length: 8
    [Response in: 322]
    Control transfer stage: Setup (0)
    [bInterfaceClass: Unknown (0xffff)]
URB setup
    bmRequestType: 0xc1
    bRequest: 8
    wValue: 0x0000
    wIndex: 0 (0x0000)
    wLength: 4

No.     Time           Source                Destination           Protocol Length Info
    321 0.676789       host                  1.6.0                 USB      36     URB_CONTROL out

Frame 321: 36 bytes on wire (288 bits), 36 bytes captured (288 bits) on interface 0
USB URB
    [Source: host]
    [Destination: 1.6.0]
    USBPcap pseudoheader length: 28
    IRP ID: 0xffff800307881010
    IRP USBD_STATUS: USBD_STATUS_SUCCESS (0x00000000)
    URB Function: URB_FUNCTION_CONTROL_TRANSFER (0x0008)
    IRP information: 0x00, Direction: FDO -> PDO
        0000 000. = Reserved: 0x00
        .... ...0 = Direction: FDO -> PDO (0x0)
    URB bus id: 1
    Device address: 6
    Endpoint: 0x00, Direction: OUT
        0... .... = Direction: OUT (0)
        .... 0000 = Endpoint number: 0
    URB transfer type: URB_CONTROL (0x02)
    Packet Data Length: 8
    [Response in: 324]
    Control transfer stage: Setup (0)
    [bInterfaceClass: Unknown (0xffff)]
URB setup
    bmRequestType: 0x41
    bRequest: 3
    wValue: 0x0700
    wIndex: 0 (0x0000)
    wLength: 0

No.     Time           Source                Destination           Protocol Length Info
    322 0.676902       1.6.0                 host                  USB      29     URB_CONTROL in

Frame 322: 29 bytes on wire (232 bits), 29 bytes captured (232 bits) on interface 0
USB URB
    [Source: 1.6.0]
    [Destination: host]
    USBPcap pseudoheader length: 28
    IRP ID: 0xffff80030aad3af0
    IRP USBD_STATUS: USBD_STATUS_SUCCESS (0x00000000)
    URB Function: URB_FUNCTION_CONTROL_TRANSFER (0x0008)
    IRP information: 0x01, Direction: PDO -> FDO
        0000 000. = Reserved: 0x00
        .... ...1 = Direction: PDO -> FDO (0x1)
    URB bus id: 1
    Device address: 6
    Endpoint: 0x80, Direction: IN
        1... .... = Direction: IN (1)
        .... 0000 = Endpoint number: 0
    URB transfer type: URB_CONTROL (0x02)
    Packet Data Length: 1
    [Request in: 320]
    [Time from request: 0.000120000 seconds]
    Control transfer stage: Data (1)
    [bInterfaceClass: Unknown (0xffff)]
CONTROL response data: 00

No.     Time           Source                Destination           Protocol Length Info
    323 0.676902       1.6.0                 host                  USB      28     GET CONFIGURATION Status

Frame 323: 28 bytes on wire (224 bits), 28 bytes captured (224 bits) on interface 0
USB URB
    [Source: 1.6.0]
    [Destination: host]
    USBPcap pseudoheader length: 28
    IRP ID: 0xffff80030aad3af0
    IRP USBD_STATUS: USBD_STATUS_SUCCESS (0x00000000)
    URB Function: URB_FUNCTION_CONTROL_TRANSFER (0x0008)
    IRP information: 0x01, Direction: PDO -> FDO
        0000 000. = Reserved: 0x00
        .... ...1 = Direction: PDO -> FDO (0x1)
    URB bus id: 1
    Device address: 6
    Endpoint: 0x80, Direction: IN
        1... .... = Direction: IN (1)
        .... 0000 = Endpoint number: 0
    URB transfer type: URB_CONTROL (0x02)
    Packet Data Length: 0
    [Request in: 320]
    [Time from request: 0.000120000 seconds]
    Control transfer stage: Status (2)

No.     Time           Source                Destination           Protocol Length Info
    324 0.677003       1.6.0                 host                  USB      28     SET FEATURE Status

Frame 324: 28 bytes on wire (224 bits), 28 bytes captured (224 bits) on interface 0
USB URB
    [Source: 1.6.0]
    [Destination: host]
    USBPcap pseudoheader length: 28
    IRP ID: 0xffff800307881010
    IRP USBD_STATUS: USBD_STATUS_SUCCESS (0x00000000)
    URB Function: URB_FUNCTION_CONTROL_TRANSFER (0x0008)
    IRP information: 0x01, Direction: PDO -> FDO
        0000 000. = Reserved: 0x00
        .... ...1 = Direction: PDO -> FDO (0x1)
    URB bus id: 1
    Device address: 6
    Endpoint: 0x00, Direction: OUT
        0... .... = Direction: OUT (0)
        .... 0000 = Endpoint number: 0
    URB transfer type: URB_CONTROL (0x02)
    Packet Data Length: 0
    [Request in: 321]
    [Time from request: 0.000214000 seconds]
    Control transfer stage: Status (2)

No.     Time           Source                Destination           Protocol Length Info
    325 0.677014       host                  1.6.0                 USB      36     URB_CONTROL out

Frame 325: 36 bytes on wire (288 bits), 36 bytes captured (288 bits) on interface 0
USB URB
    [Source: host]
    [Destination: 1.6.0]
    USBPcap pseudoheader length: 28
    IRP ID: 0xffff800307881010
    IRP USBD_STATUS: USBD_STATUS_SUCCESS (0x00000000)
    URB Function: URB_FUNCTION_CONTROL_TRANSFER (0x0008)
    IRP information: 0x00, Direction: FDO -> PDO
        0000 000. = Reserved: 0x00
        .... ...0 = Direction: FDO -> PDO (0x0)
    URB bus id: 1
    Device address: 6
    Endpoint: 0x00, Direction: OUT
        0... .... = Direction: OUT (0)
        .... 0000 = Endpoint number: 0
    URB transfer type: URB_CONTROL (0x02)
    Packet Data Length: 8
    [Response in: 326]
    Control transfer stage: Setup (0)
    [bInterfaceClass: Unknown (0xffff)]
URB setup
    bmRequestType: 0x41
    bRequest: 25
    wValue: 0x0000
    wIndex: 0 (0x0000)
    wLength: 6

No.     Time           Source                Destination           Protocol Length Info
    326 0.677146       1.6.0                 host                  USB      34     URB_CONTROL out

Frame 326: 34 bytes on wire (272 bits), 34 bytes captured (272 bits) on interface 0
USB URB
    [Source: 1.6.0]
    [Destination: host]
    USBPcap pseudoheader length: 28
    IRP ID: 0xffff800307881010
    IRP USBD_STATUS: USBD_STATUS_SUCCESS (0x00000000)
    URB Function: URB_FUNCTION_CONTROL_TRANSFER (0x0008)
    IRP information: 0x01, Direction: PDO -> FDO
        0000 000. = Reserved: 0x00
        .... ...1 = Direction: PDO -> FDO (0x1)
    URB bus id: 1
    Device address: 6
    Endpoint: 0x00, Direction: OUT
        0... .... = Direction: OUT (0)
        .... 0000 = Endpoint number: 0
    URB transfer type: URB_CONTROL (0x02)
    Packet Data Length: 6
    [Request in: 325]
    [Time from request: 0.000132000 seconds]
    Control transfer stage: Data (1)
    [bInterfaceClass: Unknown (0xffff)]
CONTROL response data: 000000001113

No.     Time           Source                Destination           Protocol Length Info
    327 0.677146       1.6.0                 host                  USB      28     Unknown type 19 Status

Frame 327: 28 bytes on wire (224 bits), 28 bytes captured (224 bits) on interface 0
USB URB
    [Source: 1.6.0]
    [Destination: host]
    USBPcap pseudoheader length: 28
    IRP ID: 0xffff800307881010
    IRP USBD_STATUS: USBD_STATUS_SUCCESS (0x00000000)
    URB Function: URB_FUNCTION_CONTROL_TRANSFER (0x0008)
    IRP information: 0x01, Direction: PDO -> FDO
        0000 000. = Reserved: 0x00
        .... ...1 = Direction: PDO -> FDO (0x1)
    URB bus id: 1
    Device address: 6
    Endpoint: 0x00, Direction: OUT
        0... .... = Direction: OUT (0)
        .... 0000 = Endpoint number: 0
    URB transfer type: URB_CONTROL (0x02)
    Packet Data Length: 0
    [Request in: 325]
    [Time from request: 0.000132000 seconds]
    Control transfer stage: Status (2)

No.     Time           Source                Destination           Protocol Length Info
    328 0.677161       host                  1.6.0                 USB      36     URB_CONTROL out

Frame 328: 36 bytes on wire (288 bits), 36 bytes captured (288 bits) on interface 0
USB URB
    [Source: host]
    [Destination: 1.6.0]
    USBPcap pseudoheader length: 28
    IRP ID: 0xffff800309e1e770
    IRP USBD_STATUS: USBD_STATUS_SUCCESS (0x00000000)
    URB Function: URB_FUNCTION_CONTROL_TRANSFER (0x0008)
    IRP information: 0x00, Direction: FDO -> PDO
        0000 000. = Reserved: 0x00
        .... ...0 = Direction: FDO -> PDO (0x0)
    URB bus id: 1
    Device address: 6
    Endpoint: 0x00, Direction: OUT
        0... .... = Direction: OUT (0)
        .... 0000 = Endpoint number: 0
    URB transfer type: URB_CONTROL (0x02)
    Packet Data Length: 8
    [Response in: 329]
    Control transfer stage: Setup (0)
    [bInterfaceClass: Unknown (0xffff)]
URB setup
    bmRequestType: 0x41
    bRequest: 19
    wValue: 0x0000
    wIndex: 0 (0x0000)
    wLength: 16

No.     Time           Source                Destination           Protocol Length Info
    329 0.677268       1.6.0                 host                  USB      44     URB_CONTROL out

Frame 329: 44 bytes on wire (352 bits), 44 bytes captured (352 bits) on interface 0
USB URB
    [Source: 1.6.0]
    [Destination: host]
    USBPcap pseudoheader length: 28
    IRP ID: 0xffff800309e1e770
    IRP USBD_STATUS: USBD_STATUS_SUCCESS (0x00000000)
    URB Function: URB_FUNCTION_CONTROL_TRANSFER (0x0008)
    IRP information: 0x01, Direction: PDO -> FDO
        0000 000. = Reserved: 0x00
        .... ...1 = Direction: PDO -> FDO (0x1)
    URB bus id: 1
    Device address: 6
    Endpoint: 0x00, Direction: OUT
        0... .... = Direction: OUT (0)
        .... 0000 = Endpoint number: 0
    URB transfer type: URB_CONTROL (0x02)
    Packet Data Length: 16
    [Request in: 328]
    [Time from request: 0.000107000 seconds]
    Control transfer stage: Data (1)
    [bInterfaceClass: Unknown (0xffff)]
CONTROL response data: 00000000000000000080000000200000

No.     Time           Source                Destination           Protocol Length Info
    330 0.677269       1.6.0                 host                  USB      28     Unknown type 13 Status

Frame 330: 28 bytes on wire (224 bits), 28 bytes captured (224 bits) on interface 0
USB URB
    [Source: 1.6.0]
    [Destination: host]
    USBPcap pseudoheader length: 28
    IRP ID: 0xffff800309e1e770
    IRP USBD_STATUS: USBD_STATUS_SUCCESS (0x00000000)
    URB Function: URB_FUNCTION_CONTROL_TRANSFER (0x0008)
    IRP information: 0x01, Direction: PDO -> FDO
        0000 000. = Reserved: 0x00
        .... ...1 = Direction: PDO -> FDO (0x1)
    URB bus id: 1
    Device address: 6
    Endpoint: 0x00, Direction: OUT
        0... .... = Direction: OUT (0)
        .... 0000 = Endpoint number: 0
    URB transfer type: URB_CONTROL (0x02)
    Packet Data Length: 0
    [Request in: 328]
    [Time from request: 0.000108000 seconds]
    Control transfer stage: Status (2)

No.     Time           Source                Destination           Protocol Length Info
    331 0.677307       host                  1.6.0                 USB      36     URB_CONTROL out

Frame 331: 36 bytes on wire (288 bits), 36 bytes captured (288 bits) on interface 0
USB URB
    [Source: host]
    [Destination: 1.6.0]
    USBPcap pseudoheader length: 28
    IRP ID: 0xffff80030aad3af0
    IRP USBD_STATUS: USBD_STATUS_SUCCESS (0x00000000)
    URB Function: URB_FUNCTION_CONTROL_TRANSFER (0x0008)
    IRP information: 0x00, Direction: FDO -> PDO
        0000 000. = Reserved: 0x00
        .... ...0 = Direction: FDO -> PDO (0x0)
    URB bus id: 1
    Device address: 6
    Endpoint: 0x00, Direction: OUT
        0... .... = Direction: OUT (0)
        .... 0000 = Endpoint number: 0
    URB transfer type: URB_CONTROL (0x02)
    Packet Data Length: 8
    [Response in: 332]
    Control transfer stage: Setup (0)
    [bInterfaceClass: Unknown (0xffff)]
URB setup
    bmRequestType: 0x41
    bRequest: 5
    wValue: 0x0000
    wIndex: 0 (0x0000)
    wLength: 0

No.     Time           Source                Destination           Protocol Length Info
    332 0.677393       1.6.0                 host                  USB      28     SET ADDRESS Status

Frame 332: 28 bytes on wire (224 bits), 28 bytes captured (224 bits) on interface 0
USB URB
    [Source: 1.6.0]
    [Destination: host]
    USBPcap pseudoheader length: 28
    IRP ID: 0xffff80030aad3af0
    IRP USBD_STATUS: USBD_STATUS_SUCCESS (0x00000000)
    URB Function: URB_FUNCTION_CONTROL_TRANSFER (0x0008)
    IRP information: 0x01, Direction: PDO -> FDO
        0000 000. = Reserved: 0x00
        .... ...1 = Direction: PDO -> FDO (0x1)
    URB bus id: 1
    Device address: 6
    Endpoint: 0x00, Direction: OUT
        0... .... = Direction: OUT (0)
        .... 0000 = Endpoint number: 0
    URB transfer type: URB_CONTROL (0x02)
    Packet Data Length: 0
    [Request in: 331]
    [Time from request: 0.000086000 seconds]
    Control transfer stage: Status (2)

No.     Time           Source                Destination           Protocol Length Info
    333 0.677399       host                  1.6.0                 USB      36     URB_CONTROL out

Frame 333: 36 bytes on wire (288 bits), 36 bytes captured (288 bits) on interface 0
USB URB
    [Source: host]
    [Destination: 1.6.0]
    USBPcap pseudoheader length: 28
    IRP ID: 0xffff80030aad3af0
    IRP USBD_STATUS: USBD_STATUS_SUCCESS (0x00000000)
    URB Function: URB_FUNCTION_CONTROL_TRANSFER (0x0008)
    IRP information: 0x00, Direction: FDO -> PDO
        0000 000. = Reserved: 0x00
        .... ...0 = Direction: FDO -> PDO (0x0)
    URB bus id: 1
    Device address: 6
    Endpoint: 0x00, Direction: OUT
        0... .... = Direction: OUT (0)
        .... 0000 = Endpoint number: 0
    URB transfer type: URB_CONTROL (0x02)
    Packet Data Length: 8
    [Response in: 334]
    Control transfer stage: Setup (0)
    [bInterfaceClass: Unknown (0xffff)]
URB setup
    bmRequestType: 0x41
    bRequest: 0
    wValue: 0x0000
    wIndex: 0 (0x0000)
    wLength: 0

No.     Time           Source                Destination           Protocol Length Info
    334 0.677468       1.6.0                 host                  USB      28     GET STATUS Status

Frame 334: 28 bytes on wire (224 bits), 28 bytes captured (224 bits) on interface 0
USB URB
    [Source: 1.6.0]
    [Destination: host]
    USBPcap pseudoheader length: 28
    IRP ID: 0xffff80030aad3af0
    IRP USBD_STATUS: USBD_STATUS_SUCCESS (0x00000000)
    URB Function: URB_FUNCTION_CONTROL_TRANSFER (0x0008)
    IRP information: 0x01, Direction: PDO -> FDO
        0000 000. = Reserved: 0x00
        .... ...1 = Direction: PDO -> FDO (0x1)
    URB bus id: 1
    Device address: 6
    Endpoint: 0x00, Direction: OUT
        0... .... = Direction: OUT (0)
        .... 0000 = Endpoint number: 0
    URB transfer type: URB_CONTROL (0x02)
    Packet Data Length: 0
    [Request in: 333]
    [Time from request: 0.000069000 seconds]
    Control transfer stage: Status (2)
